"No.","Time","Source","Destination","Protocol","Length","Info"
"1","0.000000","100.86.191.105","54.197.162.13","TCP","78","53306  >  443 [SYN] Seq=0 Win=65535 Len=0 MSS=1460 WS=64 TSval=1542518936 TSecr=0 SACK_PERM"
"2","0.000087","100.86.191.105","54.197.162.13","TCP","78","53307  >  443 [SYN] Seq=0 Win=65535 Len=0 MSS=1460 WS=64 TSval=1558713622 TSecr=0 SACK_PERM"
"3","0.013212","54.197.162.13","100.86.191.105","TCP","74","443  >  53307 [SYN, ACK] Seq=0 Ack=1 Win=26847 Len=0 MSS=1460 SACK_PERM TSval=4263386181 TSecr=1558713622 WS=256"
"4","0.013214","54.197.162.13","100.86.191.105","TCP","74","443  >  53306 [SYN, ACK] Seq=0 Ack=1 Win=26847 Len=0 MSS=1460 SACK_PERM TSval=4263386181 TSecr=1542518936 WS=256"
"5","0.013341","100.86.191.105","54.197.162.13","TCP","66","53307  >  443 [ACK] Seq=1 Ack=1 Win=131712 Len=0 TSval=1558713636 TSecr=4263386181"
"6","0.013392","100.86.191.105","54.197.162.13","TCP","66","53306  >  443 [ACK] Seq=1 Ack=1 Win=131712 Len=0 TSval=1542518950 TSecr=4263386181"
"7","0.013723","100.86.191.105","54.197.162.13","TCP","1514","53307  >  443 [ACK] Seq=1 Ack=1 Win=131712 Len=1448 TSval=1558713636 TSecr=4263386181 [TCP segment of a reassembled PDU]"
"8","0.013738","100.86.191.105","54.197.162.13","TLSv1.2","345","Client Hello (SNI=blackboard.wm.edu)"
"9","0.013975","100.86.191.105","54.197.162.13","TCP","1514","53306  >  443 [ACK] Seq=1 Ack=1 Win=131712 Len=1448 TSval=1542518950 TSecr=4263386181 [TCP segment of a reassembled PDU]"
"10","0.013981","100.86.191.105","54.197.162.13","TLSv1.2","345","Client Hello (SNI=blackboard.wm.edu)"
"11","0.029286","54.197.162.13","100.86.191.105","TLSv1.2","1514","Server Hello"
"12","0.029287","54.197.162.13","100.86.191.105","TCP","1514","443  >  53307 [ACK] Seq=1449 Ack=1728 Win=44800 Len=1448 TSval=4263386196 TSecr=1558713636 [TCP segment of a reassembled PDU]"
"13","0.029288","54.197.162.13","100.86.191.105","TCP","1266","443  >  53307 [PSH, ACK] Seq=2897 Ack=1728 Win=44800 Len=1200 TSval=4263386196 TSecr=1558713636 [TCP segment of a reassembled PDU]"
"14","0.029289","54.197.162.13","100.86.191.105","TCP","66","443  >  53306 [ACK] Seq=1 Ack=1728 Win=47872 Len=0 TSval=4263386197 TSecr=1542518950"
"15","0.029381","100.86.191.105","54.197.162.13","TCP","66","53307  >  443 [ACK] Seq=1728 Ack=4097 Win=127616 Len=0 TSval=1558713652 TSecr=4263386196"
"16","0.029480","100.86.191.105","54.197.162.13","TCP","66","[TCP Window Update] 53307  >  443 [ACK] Seq=1728 Ack=4097 Win=131072 Len=0 TSval=1558713652 TSecr=4263386196"
"17","0.031047","54.197.162.13","100.86.191.105","TLSv1.2","1384","Certificate, Server Key Exchange, Server Hello Done"
"18","0.031048","54.197.162.13","100.86.191.105","TLSv1.2","1514","Server Hello"
"19","0.031049","54.197.162.13","100.86.191.105","TCP","1514","443  >  53306 [ACK] Seq=1449 Ack=1728 Win=47872 Len=1448 TSval=4263386197 TSecr=1542518950 [TCP segment of a reassembled PDU]"
"20","0.031049","54.197.162.13","100.86.191.105","TCP","1266","443  >  53306 [PSH, ACK] Seq=2897 Ack=1728 Win=47872 Len=1200 TSval=4263386197 TSecr=1542518950 [TCP segment of a reassembled PDU]"
"21","0.031050","54.197.162.13","100.86.191.105","TLSv1.2","1384","Certificate, Server Key Exchange, Server Hello Done"
"22","0.031083","100.86.191.105","54.197.162.13","TCP","66","53307  >  443 [ACK] Seq=1728 Ack=5415 Win=129728 Len=0 TSval=1558713654 TSecr=4263386197"
"23","0.031326","100.86.191.105","54.197.162.13","TCP","66","53306  >  443 [ACK] Seq=1728 Ack=5415 Win=131072 Len=0 TSval=1542518968 TSecr=4263386198"
"24","0.033130","100.86.191.105","54.197.162.13","TLSv1.2","192","Client Key Exchange, Change Cipher Spec, Encrypted Handshake Message"
"25","0.033564","100.86.191.105","54.197.162.13","TLSv1.2","192","Client Key Exchange, Change Cipher Spec, Encrypted Handshake Message"
"26","0.046382","54.197.162.13","100.86.191.105","TLSv1.2","117","Change Cipher Spec, Encrypted Handshake Message"
"27","0.046383","54.197.162.13","100.86.191.105","TLSv1.2","117","Change Cipher Spec, Encrypted Handshake Message"
"28","0.046486","100.86.191.105","54.197.162.13","TCP","66","53307  >  443 [ACK] Seq=1854 Ack=5466 Win=131008 Len=0 TSval=1558713669 TSecr=4263386215"
"29","0.046523","100.86.191.105","54.197.162.13","TCP","66","53306  >  443 [ACK] Seq=1854 Ack=5466 Win=131008 Len=0 TSval=1542518983 TSecr=4263386215"
"30","0.046738","100.86.191.105","54.197.162.13","TCP","1514","53307  >  443 [ACK] Seq=1854 Ack=5466 Win=131072 Len=1448 TSval=1558713669 TSecr=4263386215 [TCP segment of a reassembled PDU]"
"31","0.046741","100.86.191.105","54.197.162.13","TCP","1514","53307  >  443 [ACK] Seq=3302 Ack=5466 Win=131072 Len=1448 TSval=1558713669 TSecr=4263386215 [TCP segment of a reassembled PDU]"
"32","0.046755","100.86.191.105","54.197.162.13","TLSv1.2","288","Application Data"
"33","0.059719","54.197.162.13","100.86.191.105","TCP","66","443  >  53307 [ACK] Seq=5466 Ack=4750 Win=80640 Len=0 TSval=4263386228 TSecr=1558713669"
"34","0.075590","54.197.162.13","100.86.191.105","TCP","1514","443  >  53307 [ACK] Seq=5466 Ack=4972 Win=83456 Len=1448 TSval=4263386244 TSecr=1558713669 [TCP segment of a reassembled PDU]"
"35","0.075592","54.197.162.13","100.86.191.105","TCP","1514","443  >  53307 [ACK] Seq=6914 Ack=4972 Win=83456 Len=1448 TSval=4263386244 TSecr=1558713669 [TCP segment of a reassembled PDU]"
"36","0.075593","54.197.162.13","100.86.191.105","TCP","1514","443  >  53307 [ACK] Seq=8362 Ack=4972 Win=83456 Len=1448 TSval=4263386244 TSecr=1558713669 [TCP segment of a reassembled PDU]"
"37","0.075699","100.86.191.105","54.197.162.13","TCP","66","53307  >  443 [ACK] Seq=4972 Ack=9810 Win=126720 Len=0 TSval=1558713698 TSecr=4263386244"
"38","0.075790","100.86.191.105","54.197.162.13","TCP","66","[TCP Window Update] 53307  >  443 [ACK] Seq=4972 Ack=9810 Win=131072 Len=0 TSval=1558713698 TSecr=4263386244"
"39","0.076965","54.197.162.13","100.86.191.105","TCP","1514","443  >  53307 [ACK] Seq=9810 Ack=4972 Win=83456 Len=1448 TSval=4263386244 TSecr=1558713669 [TCP segment of a reassembled PDU]"
"40","0.076966","54.197.162.13","100.86.191.105","TCP","1514","443  >  53307 [ACK] Seq=11258 Ack=4972 Win=83456 Len=1448 TSval=4263386244 TSecr=1558713669 [TCP segment of a reassembled PDU]"
"41","0.076967","54.197.162.13","100.86.191.105","TCP","1514","443  >  53307 [ACK] Seq=12706 Ack=4972 Win=83456 Len=1448 TSval=4263386244 TSecr=1558713669 [TCP segment of a reassembled PDU]"
"42","0.076968","54.197.162.13","100.86.191.105","TCP","1514","443  >  53307 [ACK] Seq=14154 Ack=4972 Win=83456 Len=1448 TSval=4263386244 TSecr=1558713669 [TCP segment of a reassembled PDU]"
"43","0.076970","54.197.162.13","100.86.191.105","TCP","1514","443  >  53307 [ACK] Seq=15602 Ack=4972 Win=83456 Len=1448 TSval=4263386244 TSecr=1558713669 [TCP segment of a reassembled PDU]"
"44","0.076971","54.197.162.13","100.86.191.105","TCP","1514","443  >  53307 [ACK] Seq=17050 Ack=4972 Win=83456 Len=1448 TSval=4263386244 TSecr=1558713669 [TCP segment of a reassembled PDU]"
"45","0.076972","54.197.162.13","100.86.191.105","TCP","1514","443  >  53307 [ACK] Seq=18498 Ack=4972 Win=83456 Len=1448 TSval=4263386244 TSecr=1558713669 [TCP segment of a reassembled PDU]"
"46","0.077018","100.86.191.105","54.197.162.13","TCP","66","53307  >  443 [ACK] Seq=4972 Ack=19946 Win=120896 Len=0 TSval=1558713699 TSecr=4263386244"
"47","0.077074","100.86.191.105","54.197.162.13","TCP","66","[TCP Window Update] 53307  >  443 [ACK] Seq=4972 Ack=19946 Win=131072 Len=0 TSval=1558713699 TSecr=4263386244"
"48","0.087669","54.197.162.13","100.86.191.105","TCP","1514","443  >  53307 [ACK] Seq=19946 Ack=4972 Win=83456 Len=1448 TSval=4263386256 TSecr=1558713698 [TCP segment of a reassembled PDU]"
"49","0.087670","54.197.162.13","100.86.191.105","TLSv1.2","1514","Application Data"
"50","0.087671","54.197.162.13","100.86.191.105","TLSv1.2","674","Application Data"
"51","0.087787","100.86.191.105","54.197.162.13","TCP","66","53307  >  443 [ACK] Seq=4972 Ack=23450 Win=127552 Len=0 TSval=1558713710 TSecr=4263386256"
"52","0.087878","100.86.191.105","54.197.162.13","TCP","66","[TCP Window Update] 53307  >  443 [ACK] Seq=4972 Ack=23450 Win=131072 Len=0 TSval=1558713710 TSecr=4263386256"
"53","0.708483","100.86.191.105","54.197.162.13","TCP","1514","53307  >  443 [ACK] Seq=4972 Ack=23450 Win=131072 Len=1448 TSval=1558714331 TSecr=4263386256 [TCP segment of a reassembled PDU]"
"54","0.708486","100.86.191.105","54.197.162.13","TCP","1514","53307  >  443 [ACK] Seq=6420 Ack=23450 Win=131072 Len=1448 TSval=1558714331 TSecr=4263386256 [TCP segment of a reassembled PDU]"
"55","0.708510","100.86.191.105","54.197.162.13","TLSv1.2","528","Application Data"
"56","0.709887","100.86.191.105","54.197.162.13","TCP","1514","53306  >  443 [ACK] Seq=1854 Ack=5466 Win=131072 Len=1448 TSval=1542519646 TSecr=4263386215 [TCP segment of a reassembled PDU]"
"57","0.709889","100.86.191.105","54.197.162.13","TCP","1514","53306  >  443 [ACK] Seq=3302 Ack=5466 Win=131072 Len=1448 TSval=1542519646 TSecr=4263386215 [TCP segment of a reassembled PDU]"
"58","0.709904","100.86.191.105","54.197.162.13","TLSv1.2","553","Application Data"
"59","0.721253","54.197.162.13","100.86.191.105","TCP","66","443  >  53307 [ACK] Seq=23450 Ack=7868 Win=101376 Len=0 TSval=4263386890 TSecr=1558714331"
"60","0.721254","54.197.162.13","100.86.191.105","TCP","66","443  >  53306 [ACK] Seq=5466 Ack=4750 Win=65792 Len=0 TSval=4263386890 TSecr=1542519646"
"61","0.729977","54.197.162.13","100.86.191.105","TCP","1514","443  >  53306 [ACK] Seq=5466 Ack=5237 Win=68608 Len=1448 TSval=4263386898 TSecr=1542519646 [TCP segment of a reassembled PDU]"
"62","0.729979","54.197.162.13","100.86.191.105","TLSv1.2","484","Application Data"
"63","0.730086","100.86.191.105","54.197.162.13","TCP","66","53306  >  443 [ACK] Seq=5237 Ack=7332 Win=129152 Len=0 TSval=1542519667 TSecr=4263386898"
"64","0.736192","54.197.162.13","100.86.191.105","TCP","1514","443  >  53307 [ACK] Seq=23450 Ack=8330 Win=104448 Len=1448 TSval=4263386904 TSecr=1558714331 [TCP segment of a reassembled PDU]"
"65","0.736194","54.197.162.13","100.86.191.105","TLSv1.2","784","Application Data"
"66","0.736338","100.86.191.105","54.197.162.13","TCP","66","53307  >  443 [ACK] Seq=8330 Ack=25616 Win=128896 Len=0 TSval=1558714359 TSecr=4263386904"
"67","0.922002","100.86.191.105","54.197.162.13","TCP","1514","53307  >  443 [ACK] Seq=8330 Ack=25616 Win=131072 Len=1448 TSval=1558714544 TSecr=4263386904 [TCP segment of a reassembled PDU]"
"68","0.922004","100.86.191.105","54.197.162.13","TCP","1514","53307  >  443 [ACK] Seq=9778 Ack=25616 Win=131072 Len=1448 TSval=1558714544 TSecr=4263386904 [TCP segment of a reassembled PDU]"
"69","0.922026","100.86.191.105","54.197.162.13","TLSv1.2","751","Application Data"
"70","0.922945","100.86.191.105","54.197.162.13","TCP","1514","53306  >  443 [ACK] Seq=5237 Ack=7332 Win=131072 Len=1448 TSval=1542519858 TSecr=4263386898 [TCP segment of a reassembled PDU]"
"71","0.922947","100.86.191.105","54.197.162.13","TCP","1514","53306  >  443 [ACK] Seq=6685 Ack=7332 Win=131072 Len=1448 TSval=1542519858 TSecr=4263386898 [TCP segment of a reassembled PDU]"
"72","0.922969","100.86.191.105","54.197.162.13","TLSv1.2","751","Application Data"
"73","0.924173","100.86.191.105","54.197.162.13","TCP","78","53319  >  443 [SYN] Seq=0 Win=65535 Len=0 MSS=1460 WS=64 TSval=3528475641 TSecr=0 SACK_PERM"
"74","0.936006","54.197.162.13","100.86.191.105","TCP","66","443  >  53307 [ACK] Seq=25616 Ack=11226 Win=108800 Len=0 TSval=4263387104 TSecr=1558714544"
"75","0.936007","54.197.162.13","100.86.191.105","TCP","66","443  >  53306 [ACK] Seq=7332 Ack=8133 Win=104448 Len=0 TSval=4263387105 TSecr=1542519858"
"76","0.936008","54.197.162.13","100.86.191.105","TCP","74","443  >  53319 [SYN, ACK] Seq=0 Ack=1 Win=26847 Len=0 MSS=1460 SACK_PERM TSval=4263387105 TSecr=3528475641 WS=256"
"77","0.936149","100.86.191.105","54.197.162.13","TCP","66","53319  >  443 [ACK] Seq=1 Ack=1 Win=131712 Len=0 TSval=3528475653 TSecr=4263387105"
"78","0.936347","100.86.191.105","54.197.162.13","TCP","1514","53319  >  443 [ACK] Seq=1 Ack=1 Win=131712 Len=1448 TSval=3528475653 TSecr=4263387105 [TCP segment of a reassembled PDU]"
"79","0.936363","100.86.191.105","54.197.162.13","TLSv1.2","345","Client Hello (SNI=blackboard.wm.edu)"
"80","0.948314","54.197.162.13","100.86.191.105","TCP","66","443  >  53319 [ACK] Seq=1 Ack=1728 Win=44800 Len=0 TSval=4263387117 TSecr=3528475653"
"81","0.948315","54.197.162.13","100.86.191.105","TLSv1.2","211","Server Hello, Change Cipher Spec, Encrypted Handshake Message"
"82","0.948378","100.86.191.105","54.197.162.13","TCP","66","53319  >  443 [ACK] Seq=1728 Ack=146 Win=131584 Len=0 TSval=3528475665 TSecr=4263387117"
"83","0.948532","100.86.191.105","54.197.162.13","TLSv1.2","117","Change Cipher Spec, Encrypted Handshake Message"
"84","0.948800","100.86.191.105","54.197.162.13","TCP","1514","53319  >  443 [ACK] Seq=1779 Ack=146 Win=131584 Len=1448 TSval=3528475665 TSecr=4263387117 [TCP segment of a reassembled PDU]"
"85","0.948801","100.86.191.105","54.197.162.13","TCP","1514","53319  >  443 [ACK] Seq=3227 Ack=146 Win=131584 Len=1448 TSval=3528475665 TSecr=4263387117 [TCP segment of a reassembled PDU]"
"86","0.948805","100.86.191.105","54.197.162.13","TLSv1.2","751","Application Data"
"87","0.951718","100.86.191.105","54.197.162.13","TCP","751","[TCP Retransmission] 53306  >  443 [PSH, ACK] Seq=8133 Ack=7332 Win=131072 Len=685 TSval=1542519888 TSecr=4263387105 [TCP segment of a reassembled PDU]"
"88","0.958536","100.86.191.105","54.197.162.13","TCP","751","[TCP Retransmission] 53307  >  443 [PSH, ACK] Seq=11226 Ack=25616 Win=131072 Len=685 TSval=1558714581 TSecr=4263387104 [TCP segment of a reassembled PDU]"
"89","0.962066","54.197.162.13","100.86.191.105","TCP","66","443  >  53319 [ACK] Seq=146 Ack=4675 Win=62720 Len=0 TSval=4263387131 TSecr=3528475665"
"90","0.963792","54.197.162.13","100.86.191.105","TCP","78","443  >  53306 [ACK] Seq=7332 Ack=8818 Win=107264 Len=0 TSval=4263387132 TSecr=1542519888 SLE=8133 SRE=8818"
"91","0.970586","54.197.162.13","100.86.191.105","TCP","78","443  >  53307 [ACK] Seq=25616 Ack=11911 Win=108800 Len=0 TSval=4263387139 TSecr=1558714581 SLE=11226 SRE=11911"
"92","0.973793","54.197.162.13","100.86.191.105","TCP","1514","443  >  53319 [ACK] Seq=146 Ack=5360 Win=65792 Len=1448 TSval=4263387142 TSecr=3528475665 [TCP segment of a reassembled PDU]"
"93","0.973795","54.197.162.13","100.86.191.105","TLSv1.2","1091","Application Data"
"94","0.973872","100.86.191.105","54.197.162.13","TCP","66","53319  >  443 [ACK] Seq=5360 Ack=2619 Win=129088 Len=0 TSval=3528475690 TSecr=4263387142"
"95","0.990285","54.197.162.13","100.86.191.105","TCP","1514","443  >  53306 [ACK] Seq=7332 Ack=8818 Win=107264 Len=1448 TSval=4263387158 TSecr=1542519888 [TCP segment of a reassembled PDU]"
"96","0.990286","54.197.162.13","100.86.191.105","TCP","1514","443  >  53306 [ACK] Seq=8780 Ack=8818 Win=107264 Len=1448 TSval=4263387158 TSecr=1542519888 [TCP segment of a reassembled PDU]"
"97","0.990287","54.197.162.13","100.86.191.105","TCP","1514","443  >  53306 [ACK] Seq=10228 Ack=8818 Win=107264 Len=1448 TSval=4263387158 TSecr=1542519888 [TCP segment of a reassembled PDU]"
"98","0.990287","54.197.162.13","100.86.191.105","TCP","1514","443  >  53306 [ACK] Seq=11676 Ack=8818 Win=107264 Len=1448 TSval=4263387158 TSecr=1542519888 [TCP segment of a reassembled PDU]"
"99","0.990288","54.197.162.13","100.86.191.105","TCP","1514","443  >  53306 [ACK] Seq=13124 Ack=8818 Win=107264 Len=1448 TSval=4263387158 TSecr=1542519888 [TCP segment of a reassembled PDU]"
"100","0.990361","100.86.191.105","54.197.162.13","TCP","66","53306  >  443 [ACK] Seq=8818 Ack=14572 Win=123776 Len=0 TSval=1542519927 TSecr=4263387158"
"101","0.990434","100.86.191.105","54.197.162.13","TCP","66","[TCP Window Update] 53306  >  443 [ACK] Seq=8818 Ack=14572 Win=131072 Len=0 TSval=1542519927 TSecr=4263387158"
"102","0.992586","54.197.162.13","100.86.191.105","TCP","1514","443  >  53306 [ACK] Seq=14572 Ack=8818 Win=107264 Len=1448 TSval=4263387158 TSecr=1542519888 [TCP segment of a reassembled PDU]"
"103","0.992587","54.197.162.13","100.86.191.105","TCP","1514","443  >  53306 [ACK] Seq=16020 Ack=8818 Win=107264 Len=1448 TSval=4263387158 TSecr=1542519888 [TCP segment of a reassembled PDU]"
"104","0.992588","54.197.162.13","100.86.191.105","TCP","1514","443  >  53306 [ACK] Seq=17468 Ack=8818 Win=107264 Len=1448 TSval=4263387158 TSecr=1542519888 [TCP segment of a reassembled PDU]"
"105","0.992589","54.197.162.13","100.86.191.105","TCP","1514","443  >  53306 [ACK] Seq=18916 Ack=8818 Win=107264 Len=1448 TSval=4263387158 TSecr=1542519888 [TCP segment of a reassembled PDU]"
"106","0.992590","54.197.162.13","100.86.191.105","TCP","1514","443  >  53306 [ACK] Seq=20364 Ack=8818 Win=107264 Len=1448 TSval=4263387158 TSecr=1542519888 [TCP segment of a reassembled PDU]"
"107","0.992591","54.197.162.13","100.86.191.105","TCP","1514","443  >  53307 [ACK] Seq=25616 Ack=11911 Win=108800 Len=1448 TSval=4263387161 TSecr=1558714581 [TCP segment of a reassembled PDU]"
"108","0.992592","54.197.162.13","100.86.191.105","TCP","1514","443  >  53307 [ACK] Seq=27064 Ack=11911 Win=108800 Len=1448 TSval=4263387161 TSecr=1558714581 [TCP segment of a reassembled PDU]"
"109","0.992594","54.197.162.13","100.86.191.105","TCP","1514","443  >  53307 [ACK] Seq=28512 Ack=11911 Win=108800 Len=1448 TSval=4263387161 TSecr=1558714581 [TCP segment of a reassembled PDU]"
"110","0.992650","100.86.191.105","54.197.162.13","TCP","66","53306  >  443 [ACK] Seq=8818 Ack=21812 Win=123776 Len=0 TSval=1542519929 TSecr=4263387158"
"111","0.992703","100.86.191.105","54.197.162.13","TCP","66","53307  >  443 [ACK] Seq=11911 Ack=29960 Win=126720 Len=0 TSval=1558714615 TSecr=4263387161"
"112","0.992728","100.86.191.105","54.197.162.13","TCP","66","[TCP Window Update] 53306  >  443 [ACK] Seq=8818 Ack=21812 Win=131072 Len=0 TSval=1542519929 TSecr=4263387158"
"113","0.992730","100.86.191.105","54.197.162.13","TCP","66","[TCP Window Update] 53307  >  443 [ACK] Seq=11911 Ack=29960 Win=131072 Len=0 TSval=1558714615 TSecr=4263387161"
"114","0.994511","54.197.162.13","100.86.191.105","TCP","1514","443  >  53307 [ACK] Seq=29960 Ack=11911 Win=108800 Len=1448 TSval=4263387161 TSecr=1558714581 [TCP segment of a reassembled PDU]"
"115","0.994512","54.197.162.13","100.86.191.105","TCP","1514","443  >  53307 [ACK] Seq=31408 Ack=11911 Win=108800 Len=1448 TSval=4263387161 TSecr=1558714581 [TCP segment of a reassembled PDU]"
"116","0.994512","54.197.162.13","100.86.191.105","TCP","1514","443  >  53307 [ACK] Seq=32856 Ack=11911 Win=108800 Len=1448 TSval=4263387161 TSecr=1558714581 [TCP segment of a reassembled PDU]"
"117","0.994513","54.197.162.13","100.86.191.105","TCP","1514","443  >  53307 [ACK] Seq=34304 Ack=11911 Win=108800 Len=1448 TSval=4263387161 TSecr=1558714581 [TCP segment of a reassembled PDU]"
"118","0.994514","54.197.162.13","100.86.191.105","TCP","1514","443  >  53307 [ACK] Seq=35752 Ack=11911 Win=108800 Len=1448 TSval=4263387161 TSecr=1558714581 [TCP segment of a reassembled PDU]"
"119","0.994515","54.197.162.13","100.86.191.105","TCP","1514","443  >  53307 [ACK] Seq=37200 Ack=11911 Win=108800 Len=1448 TSval=4263387161 TSecr=1558714581 [TCP segment of a reassembled PDU]"
"120","0.994515","54.197.162.13","100.86.191.105","TCP","1514","443  >  53307 [ACK] Seq=38648 Ack=11911 Win=108800 Len=1448 TSval=4263387161 TSecr=1558714581 [TCP segment of a reassembled PDU]"
"121","0.994516","54.197.162.13","100.86.191.105","TCP","1514","443  >  53307 [ACK] Seq=40096 Ack=11911 Win=108800 Len=1448 TSval=4263387161 TSecr=1558714581 [TCP segment of a reassembled PDU]"
"122","0.994517","54.197.162.13","100.86.191.105","TLSv1.2","1514","Application Data, Application Data"
"123","0.994518","54.197.162.13","100.86.191.105","TCP","1514","443  >  53307 [ACK] Seq=42992 Ack=11911 Win=108800 Len=1448 TSval=4263387161 TSecr=1558714581 [TCP segment of a reassembled PDU]"
"124","0.994519","54.197.162.13","100.86.191.105","TCP","1514","443  >  53307 [ACK] Seq=44440 Ack=11911 Win=108800 Len=1448 TSval=4263387161 TSecr=1558714581 [TCP segment of a reassembled PDU]"
"125","0.994520","54.197.162.13","100.86.191.105","TCP","1514","443  >  53307 [ACK] Seq=45888 Ack=11911 Win=108800 Len=1448 TSval=4263387161 TSecr=1558714581 [TCP segment of a reassembled PDU]"
"126","0.994565","100.86.191.105","54.197.162.13","TCP","66","53307  >  443 [ACK] Seq=11911 Ack=45888 Win=115136 Len=0 TSval=1558714617 TSecr=4263387161"
"127","0.994581","100.86.191.105","54.197.162.13","TCP","66","53307  >  443 [ACK] Seq=11911 Ack=47336 Win=113664 Len=0 TSval=1558714617 TSecr=4263387161"
"128","0.994607","100.86.191.105","54.197.162.13","TCP","66","[TCP Window Update] 53307  >  443 [ACK] Seq=11911 Ack=47336 Win=131072 Len=0 TSval=1558714617 TSecr=4263387161"
"129","0.995700","54.197.162.13","100.86.191.105","TCP","1514","443  >  53307 [ACK] Seq=47336 Ack=11911 Win=108800 Len=1448 TSval=4263387161 TSecr=1558714581 [TCP segment of a reassembled PDU]"
"130","0.995701","54.197.162.13","100.86.191.105","TCP","1514","443  >  53307 [ACK] Seq=48784 Ack=11911 Win=108800 Len=1448 TSval=4263387161 TSecr=1558714581 [TCP segment of a reassembled PDU]"
"131","0.995702","54.197.162.13","100.86.191.105","TCP","1514","443  >  53307 [ACK] Seq=50232 Ack=11911 Win=108800 Len=1448 TSval=4263387161 TSecr=1558714581 [TCP segment of a reassembled PDU]"
"132","0.995703","54.197.162.13","100.86.191.105","TCP","1514","443  >  53307 [ACK] Seq=51680 Ack=11911 Win=108800 Len=1448 TSval=4263387161 TSecr=1558714581 [TCP segment of a reassembled PDU]"
"133","0.995703","54.197.162.13","100.86.191.105","TCP","1514","443  >  53307 [ACK] Seq=53128 Ack=11911 Win=108800 Len=1448 TSval=4263387161 TSecr=1558714581 [TCP segment of a reassembled PDU]"
"134","0.995704","54.197.162.13","100.86.191.105","TLSv1.2","740","Application Data"
"135","0.995751","100.86.191.105","54.197.162.13","TCP","66","53307  >  443 [ACK] Seq=11911 Ack=55250 Win=123136 Len=0 TSval=1558714618 TSecr=4263387161"
"136","0.995786","100.86.191.105","54.197.162.13","TCP","66","[TCP Window Update] 53307  >  443 [ACK] Seq=11911 Ack=55250 Win=131072 Len=0 TSval=1558714618 TSecr=4263387161"
"137","1.006344","54.197.162.13","100.86.191.105","TCP","1514","443  >  53306 [ACK] Seq=21812 Ack=8818 Win=107264 Len=1448 TSval=4263387174 TSecr=1542519929 [TCP segment of a reassembled PDU]"
"138","1.006345","54.197.162.13","100.86.191.105","TLSv1.2","1514","Application Data, Application Data"
"139","1.006346","54.197.162.13","100.86.191.105","TCP","1514","443  >  53306 [ACK] Seq=24708 Ack=8818 Win=107264 Len=1448 TSval=4263387174 TSecr=1542519929 [TCP segment of a reassembled PDU]"
"140","1.006347","54.197.162.13","100.86.191.105","TCP","1514","443  >  53306 [ACK] Seq=26156 Ack=8818 Win=107264 Len=1448 TSval=4263387174 TSecr=1542519929 [TCP segment of a reassembled PDU]"
"141","1.006348","54.197.162.13","100.86.191.105","TCP","1514","443  >  53306 [ACK] Seq=27604 Ack=8818 Win=107264 Len=1448 TSval=4263387174 TSecr=1542519929 [TCP segment of a reassembled PDU]"
"142","1.006467","100.86.191.105","54.197.162.13","TCP","66","53306  >  443 [ACK] Seq=8818 Ack=29052 Win=123776 Len=0 TSval=1542519943 TSecr=4263387174"
"143","1.006554","100.86.191.105","54.197.162.13","TCP","66","[TCP Window Update] 53306  >  443 [ACK] Seq=8818 Ack=29052 Win=131072 Len=0 TSval=1542519943 TSecr=4263387174"
"144","1.007543","54.197.162.13","100.86.191.105","TCP","1514","443  >  53306 [ACK] Seq=29052 Ack=8818 Win=107264 Len=1448 TSval=4263387174 TSecr=1542519929 [TCP segment of a reassembled PDU]"
"145","1.007544","54.197.162.13","100.86.191.105","TCP","1514","443  >  53306 [ACK] Seq=30500 Ack=8818 Win=107264 Len=1448 TSval=4263387174 TSecr=1542519929 [TCP segment of a reassembled PDU]"
"146","1.007545","54.197.162.13","100.86.191.105","TCP","1514","443  >  53306 [ACK] Seq=31948 Ack=8818 Win=107264 Len=1448 TSval=4263387174 TSecr=1542519929 [TCP segment of a reassembled PDU]"
"147","1.007546","54.197.162.13","100.86.191.105","TCP","1514","[TCP Previous segment not captured] 443  >  53306 [ACK] Seq=34844 Ack=8818 Win=107264 Len=1448 TSval=4263387174 TSecr=1542519929 [TCP segment of a reassembled PDU]"
"148","1.007546","54.197.162.13","100.86.191.105","TCP","711","443  >  53306 [PSH, ACK] Seq=36292 Ack=8818 Win=107264 Len=645 TSval=4263387174 TSecr=1542519929 [TCP segment of a reassembled PDU]"
"149","1.007626","100.86.191.105","54.197.162.13","TCP","66","53306  >  443 [ACK] Seq=8818 Ack=33396 Win=126720 Len=0 TSval=1542519944 TSecr=4263387174"
"150","1.007684","100.86.191.105","54.197.162.13","TCP","78","[TCP Dup ACK 149#1] 53306  >  443 [ACK] Seq=8818 Ack=33396 Win=126720 Len=0 TSval=1542519944 TSecr=4263387174 SLE=34844 SRE=36937"
"151","1.007885","100.86.191.105","54.197.162.13","TCP","78","[TCP Window Update] 53306  >  443 [ACK] Seq=8818 Ack=33396 Win=131072 Len=0 TSval=1542519944 TSecr=4263387174 SLE=34844 SRE=36937"
"152","1.033691","54.197.162.13","100.86.191.105","TCP","1514","[TCP Retransmission] 443  >  53306 [ACK] Seq=33396 Ack=8818 Win=107264 Len=1448 TSval=4263387203 TSecr=1542519944"
"153","1.033763","100.86.191.105","54.197.162.13","TCP","66","53306  >  443 [ACK] Seq=8818 Ack=36937 Win=127488 Len=0 TSval=1542519970 TSecr=4263387203"
"154","1.033824","100.86.191.105","54.197.162.13","TCP","66","[TCP Window Update] 53306  >  443 [ACK] Seq=8818 Ack=36937 Win=131072 Len=0 TSval=1542519970 TSecr=4263387203"
"155","1.067089","100.86.191.105","54.197.162.13","TCP","1514","53306  >  443 [ACK] Seq=8818 Ack=36937 Win=131072 Len=1448 TSval=1542520004 TSecr=4263387203 [TCP segment of a reassembled PDU]"
"156","1.067090","100.86.191.105","54.197.162.13","TCP","1514","53306  >  443 [ACK] Seq=10266 Ack=36937 Win=131072 Len=1448 TSval=1542520004 TSecr=4263387203 [TCP segment of a reassembled PDU]"
"157","1.067091","100.86.191.105","54.197.162.13","TCP","1514","53306  >  443 [ACK] Seq=11714 Ack=36937 Win=131072 Len=1448 TSval=1542520004 TSecr=4263387203 [TCP segment of a reassembled PDU]"
"158","1.067114","100.86.191.105","54.197.162.13","TLSv1.2","442","Application Data"
"159","1.080884","54.197.162.13","100.86.191.105","TCP","66","443  >  53306 [ACK] Seq=36937 Ack=11714 Win=108800 Len=0 TSval=4263387249 TSecr=1542520004"
"160","1.080885","54.197.162.13","100.86.191.105","TCP","66","443  >  53306 [ACK] Seq=36937 Ack=13538 Win=108800 Len=0 TSval=4263387249 TSecr=1542520004"
"161","1.157561","54.197.162.13","100.86.191.105","TCP","1514","443  >  53306 [ACK] Seq=36937 Ack=13538 Win=108800 Len=1448 TSval=4263387326 TSecr=1542520004 [TCP segment of a reassembled PDU]"
"162","1.157562","54.197.162.13","100.86.191.105","TCP","1514","443  >  53306 [ACK] Seq=38385 Ack=13538 Win=108800 Len=1448 TSval=4263387326 TSecr=1542520004 [TCP segment of a reassembled PDU]"
"163","1.157563","54.197.162.13","100.86.191.105","TCP","1514","443  >  53306 [ACK] Seq=39833 Ack=13538 Win=108800 Len=1448 TSval=4263387326 TSecr=1542520004 [TCP segment of a reassembled PDU]"
"164","1.157615","54.197.162.13","100.86.191.105","TCP","1514","443  >  53306 [ACK] Seq=41281 Ack=13538 Win=108800 Len=1448 TSval=4263387326 TSecr=1542520004 [TCP segment of a reassembled PDU]"
"165","1.157618","54.197.162.13","100.86.191.105","TCP","1514","[TCP Previous segment not captured] 443  >  53306 [ACK] Seq=44177 Ack=13538 Win=108800 Len=1448 TSval=4263387326 TSecr=1542520004 [TCP segment of a reassembled PDU]"
"166","1.157720","100.86.191.105","54.197.162.13","TCP","66","53306  >  443 [ACK] Seq=13538 Ack=41281 Win=126720 Len=0 TSval=1542520094 TSecr=4263387326"
"167","1.157793","100.86.191.105","54.197.162.13","TCP","66","53306  >  443 [ACK] Seq=13538 Ack=42729 Win=125248 Len=0 TSval=1542520094 TSecr=4263387326"
"168","1.157814","54.197.162.13","100.86.191.105","TCP","1514","443  >  53306 [ACK] Seq=45625 Ack=13538 Win=108800 Len=1448 TSval=4263387326 TSecr=1542520004 [TCP segment of a reassembled PDU]"
"169","1.157817","54.197.162.13","100.86.191.105","TCP","1514","443  >  53306 [ACK] Seq=47073 Ack=13538 Win=108800 Len=1448 TSval=4263387326 TSecr=1542520004 [TCP segment of a reassembled PDU]"
"170","1.157819","54.197.162.13","100.86.191.105","TCP","1514","443  >  53306 [ACK] Seq=48521 Ack=13538 Win=108800 Len=1448 TSval=4263387326 TSecr=1542520004 [TCP segment of a reassembled PDU]"
"171","1.157822","54.197.162.13","100.86.191.105","TCP","1514","443  >  53306 [ACK] Seq=49969 Ack=13538 Win=108800 Len=1448 TSval=4263387326 TSecr=1542520004 [TCP segment of a reassembled PDU]"
"172","1.157844","100.86.191.105","54.197.162.13","TCP","78","[TCP Dup ACK 167#1] 53306  >  443 [ACK] Seq=13538 Ack=42729 Win=125248 Len=0 TSval=1542520094 TSecr=4263387326 SLE=44177 SRE=45625"
"173","1.157852","100.86.191.105","54.197.162.13","TCP","78","[TCP Dup ACK 167#2] 53306  >  443 [ACK] Seq=13538 Ack=42729 Win=125248 Len=0 TSval=1542520094 TSecr=4263387326 SLE=44177 SRE=51417"
"174","1.158875","54.197.162.13","100.86.191.105","TCP","1514","443  >  53306 [ACK] Seq=51417 Ack=13538 Win=108800 Len=1448 TSval=4263387326 TSecr=1542520004 [TCP segment of a reassembled PDU]"
"175","1.158876","54.197.162.13","100.86.191.105","TCP","1514","443  >  53306 [ACK] Seq=52865 Ack=13538 Win=108800 Len=1448 TSval=4263387326 TSecr=1542520004 [TCP segment of a reassembled PDU], Application Data"
"176","1.158973","100.86.191.105","54.197.162.13","TCP","78","[TCP Dup ACK 167#3] 53306  >  443 [ACK] Seq=13538 Ack=42729 Win=125248 Len=0 TSval=1542520095 TSecr=4263387326 SLE=44177 SRE=54313"
"177","1.160214","100.86.191.105","54.197.162.13","TCP","78","[TCP Window Update] 53306  >  443 [ACK] Seq=13538 Ack=42729 Win=131072 Len=0 TSval=1542520097 TSecr=4263387326 SLE=44177 SRE=54313"
"178","1.160753","54.197.162.13","100.86.191.105","TCP","1514","443  >  53306 [ACK] Seq=54313 Ack=13538 Win=108800 Len=1448 TSval=4263387326 TSecr=1542520004 [TCP segment of a reassembled PDU]"
"179","1.160755","54.197.162.13","100.86.191.105","TCP","1514","443  >  53306 [ACK] Seq=55761 Ack=13538 Win=108800 Len=1448 TSval=4263387326 TSecr=1542520004 [TCP segment of a reassembled PDU]"
"180","1.160756","54.197.162.13","100.86.191.105","TCP","1514","443  >  53306 [ACK] Seq=57209 Ack=13538 Win=108800 Len=1448 TSval=4263387326 TSecr=1542520004 [TCP segment of a reassembled PDU]"
"181","1.160757","54.197.162.13","100.86.191.105","TCP","1514","443  >  53306 [ACK] Seq=58657 Ack=13538 Win=108800 Len=1448 TSval=4263387326 TSecr=1542520004 [TCP segment of a reassembled PDU]"
"182","1.160758","54.197.162.13","100.86.191.105","TCP","1514","443  >  53306 [ACK] Seq=60105 Ack=13538 Win=108800 Len=1448 TSval=4263387326 TSecr=1542520004 [TCP segment of a reassembled PDU]"
"183","1.160852","100.86.191.105","54.197.162.13","TCP","78","[TCP Dup ACK 167#4] 53306  >  443 [ACK] Seq=13538 Ack=42729 Win=131072 Len=0 TSval=1542520097 TSecr=4263387326 SLE=44177 SRE=61553"
"184","1.171835","54.197.162.13","100.86.191.105","TCP","1514","443  >  53306 [ACK] Seq=61553 Ack=13538 Win=108800 Len=1448 TSval=4263387340 TSecr=1542520094 [TCP segment of a reassembled PDU]"
"185","1.171837","54.197.162.13","100.86.191.105","TCP","1514","443  >  53306 [ACK] Seq=63001 Ack=13538 Win=108800 Len=1448 TSval=4263387340 TSecr=1542520094 [TCP segment of a reassembled PDU]"
"186","1.171838","54.197.162.13","100.86.191.105","TLSv1.2","1514","[TCP Fast Retransmission] , Application Data"
"187","1.171941","100.86.191.105","54.197.162.13","TCP","78","[TCP Dup ACK 167#5] 53306  >  443 [ACK] Seq=13538 Ack=42729 Win=131072 Len=0 TSval=1542520108 TSecr=4263387326 SLE=44177 SRE=64449"
"188","1.171995","100.86.191.105","54.197.162.13","TCP","66","53306  >  443 [ACK] Seq=13538 Ack=64449 Win=109312 Len=0 TSval=1542520108 TSecr=4263387340"
"189","1.175197","100.86.191.105","54.197.162.13","TCP","66","[TCP Window Update] 53306  >  443 [ACK] Seq=13538 Ack=64449 Win=131072 Len=0 TSval=1542520112 TSecr=4263387340"
"190","1.198896","54.197.162.13","100.86.191.105","TCP","1514","443  >  53306 [ACK] Seq=64449 Ack=13538 Win=108800 Len=1448 TSval=4263387340 TSecr=1542520095 [TCP segment of a reassembled PDU]"
"191","1.198897","54.197.162.13","100.86.191.105","TCP","1514","443  >  53306 [ACK] Seq=65897 Ack=13538 Win=108800 Len=1448 TSval=4263387340 TSecr=1542520095 [TCP segment of a reassembled PDU]"
"192","1.198898","54.197.162.13","100.86.191.105","TLSv1.2","275","Application Data"
"193","1.198973","100.86.191.105","54.197.162.13","TCP","66","53306  >  443 [ACK] Seq=13538 Ack=67554 Win=127936 Len=0 TSval=1542520135 TSecr=4263387342"
"194","1.199048","100.86.191.105","54.197.162.13","TCP","66","[TCP Window Update] 53306  >  443 [ACK] Seq=13538 Ack=67554 Win=131072 Len=0 TSval=1542520135 TSecr=4263387342"
"195","1.325476","100.86.191.105","54.197.162.13","TCP","1514","53306  >  443 [ACK] Seq=13538 Ack=67554 Win=131072 Len=1448 TSval=1542520262 TSecr=4263387342 [TCP segment of a reassembled PDU]"
"196","1.325478","100.86.191.105","54.197.162.13","TCP","1514","53306  >  443 [ACK] Seq=14986 Ack=67554 Win=131072 Len=1448 TSval=1542520262 TSecr=4263387342 [TCP segment of a reassembled PDU]"
"197","1.325497","100.86.191.105","54.197.162.13","TLSv1.2","710","Application Data"
"198","1.326110","100.86.191.105","54.197.162.13","TCP","1514","53307  >  443 [ACK] Seq=11911 Ack=55250 Win=131072 Len=1448 TSval=1558714948 TSecr=4263387161 [TCP segment of a reassembled PDU]"
"199","1.326112","100.86.191.105","54.197.162.13","TCP","1514","53307  >  443 [ACK] Seq=13359 Ack=55250 Win=131072 Len=1448 TSval=1558714948 TSecr=4263387161 [TCP segment of a reassembled PDU]"
"200","1.326122","100.86.191.105","54.197.162.13","TLSv1.2","628","Application Data"
"201","1.326722","100.86.191.105","54.197.162.13","TCP","1514","53319  >  443 [ACK] Seq=5360 Ack=2619 Win=131072 Len=1448 TSval=3528476043 TSecr=4263387142 [TCP segment of a reassembled PDU]"
"202","1.326724","100.86.191.105","54.197.162.13","TCP","1514","53319  >  443 [ACK] Seq=6808 Ack=2619 Win=131072 Len=1448 TSval=3528476043 TSecr=4263387142 [TCP segment of a reassembled PDU]"
"203","1.326748","100.86.191.105","54.197.162.13","TLSv1.2","618","Application Data"
"204","1.338069","54.197.162.13","100.86.191.105","TCP","66","443  >  53306 [ACK] Seq=67554 Ack=16434 Win=108800 Len=0 TSval=4263387506 TSecr=1542520262"
"205","1.338071","54.197.162.13","100.86.191.105","TCP","66","443  >  53306 [ACK] Seq=67554 Ack=17078 Win=108800 Len=0 TSval=4263387506 TSecr=1542520262"
"206","1.338073","54.197.162.13","100.86.191.105","TCP","66","443  >  53307 [ACK] Seq=55250 Ack=14807 Win=108800 Len=0 TSval=4263387507 TSecr=1558714948"
"207","1.338073","54.197.162.13","100.86.191.105","TCP","66","443  >  53319 [ACK] Seq=2619 Ack=8256 Win=83456 Len=0 TSval=4263387507 TSecr=3528476043"
"208","1.338074","54.197.162.13","100.86.191.105","TCP","66","443  >  53307 [ACK] Seq=55250 Ack=15369 Win=108800 Len=0 TSval=4263387507 TSecr=1558714948"
"209","1.343297","54.197.162.13","100.86.191.105","TLSv1.2","1444","Application Data"
"210","1.343374","100.86.191.105","54.197.162.13","TCP","66","53319  >  443 [ACK] Seq=8808 Ack=3997 Win=129664 Len=0 TSval=3528476060 TSecr=4263387513"
"211","1.349139","54.197.162.13","100.86.191.105","TCP","1514","443  >  53307 [ACK] Seq=55250 Ack=15369 Win=108800 Len=1448 TSval=4263387517 TSecr=1558714948 [TCP segment of a reassembled PDU]"
"212","1.349140","54.197.162.13","100.86.191.105","TLSv1.2","599","Application Data"
"213","1.349189","100.86.191.105","54.197.162.13","TCP","66","53307  >  443 [ACK] Seq=15369 Ack=57231 Win=129088 Len=0 TSval=1558714972 TSecr=4263387517"
"214","1.358780","54.197.162.13","100.86.191.105","TCP","1514","443  >  53306 [ACK] Seq=67554 Ack=17078 Win=108800 Len=1448 TSval=4263387527 TSecr=1542520262 [TCP segment of a reassembled PDU]"
"215","1.358782","54.197.162.13","100.86.191.105","TLSv1.2","975","Application Data"
"216","1.358859","100.86.191.105","54.197.162.13","TCP","66","53306  >  443 [ACK] Seq=17078 Ack=69911 Win=128704 Len=0 TSval=1542520295 TSecr=4263387527"
"217","1.365983","100.86.191.105","54.197.162.13","TCP","1514","53306  >  443 [ACK] Seq=17078 Ack=69911 Win=131072 Len=1448 TSval=1542520302 TSecr=4263387527 [TCP segment of a reassembled PDU]"
"218","1.365985","100.86.191.105","54.197.162.13","TCP","1514","53306  >  443 [ACK] Seq=18526 Ack=69911 Win=131072 Len=1448 TSval=1542520302 TSecr=4263387527 [TCP segment of a reassembled PDU]"
"219","1.366002","100.86.191.105","54.197.162.13","TLSv1.2","624","Application Data"
"220","1.377578","54.197.162.13","100.86.191.105","TCP","66","443  >  53306 [ACK] Seq=69911 Ack=19974 Win=108800 Len=0 TSval=4263387547 TSecr=1542520302"
"221","1.384473","54.197.162.13","100.86.191.105","TLSv1.2","1341","Application Data"
"222","1.384578","100.86.191.105","54.197.162.13","TCP","66","53306  >  443 [ACK] Seq=20532 Ack=71186 Win=129792 Len=0 TSval=1542520321 TSecr=4263387553"
"223","1.388818","100.86.191.105","54.197.162.13","TCP","1514","53306  >  443 [ACK] Seq=20532 Ack=71186 Win=131072 Len=1448 TSval=1542520325 TSecr=4263387553 [TCP segment of a reassembled PDU]"
"224","1.388821","100.86.191.105","54.197.162.13","TCP","1514","53306  >  443 [ACK] Seq=21980 Ack=71186 Win=131072 Len=1448 TSval=1542520325 TSecr=4263387553 [TCP segment of a reassembled PDU]"
"225","1.388823","100.86.191.105","54.197.162.13","TLSv1.2","648","Application Data"
"226","1.402204","54.197.162.13","100.86.191.105","TCP","66","443  >  53306 [ACK] Seq=71186 Ack=23428 Win=108800 Len=0 TSval=4263387570 TSecr=1542520325"
"227","1.412423","54.197.162.13","100.86.191.105","TCP","1514","443  >  53306 [ACK] Seq=71186 Ack=24010 Win=108800 Len=1448 TSval=4263387582 TSecr=1542520325 [TCP segment of a reassembled PDU]"
"228","1.412436","54.197.162.13","100.86.191.105","TLSv1.2","335","Application Data"
"229","1.412459","100.86.191.105","54.197.162.13","TCP","66","53306  >  443 [ACK] Seq=24010 Ack=72634 Win=129600 Len=0 TSval=1542520348 TSecr=4263387582"
"230","1.412493","100.86.191.105","54.197.162.13","TCP","66","53306  >  443 [ACK] Seq=24010 Ack=72903 Win=130752 Len=0 TSval=1542520348 TSecr=4263387582"
"231","1.414282","100.86.191.105","54.197.162.13","TCP","1514","53306  >  443 [ACK] Seq=24010 Ack=72903 Win=131072 Len=1448 TSval=1542520350 TSecr=4263387582 [TCP segment of a reassembled PDU]"
"232","1.414284","100.86.191.105","54.197.162.13","TCP","1514","53306  >  443 [ACK] Seq=25458 Ack=72903 Win=131072 Len=1448 TSval=1542520350 TSecr=4263387582 [TCP segment of a reassembled PDU]"
"233","1.414300","100.86.191.105","54.197.162.13","TLSv1.2","964","Application Data"
"234","1.425129","100.86.191.105","54.197.162.13","TCP","1514","53307  >  443 [ACK] Seq=15369 Ack=57231 Win=131072 Len=1448 TSval=1558715048 TSecr=4263387517 [TCP segment of a reassembled PDU]"
"235","1.425131","100.86.191.105","54.197.162.13","TCP","1514","53307  >  443 [ACK] Seq=16817 Ack=57231 Win=131072 Len=1448 TSval=1558715048 TSecr=4263387517 [TCP segment of a reassembled PDU]"
"236","1.425157","100.86.191.105","54.197.162.13","TLSv1.2","622","Application Data"
"237","1.426755","54.197.162.13","100.86.191.105","TCP","66","443  >  53306 [ACK] Seq=72903 Ack=26906 Win=108800 Len=0 TSval=4263387596 TSecr=1542520350"
"238","1.428309","100.86.191.105","54.197.162.13","TCP","1514","53319  >  443 [ACK] Seq=8808 Ack=3997 Win=131072 Len=1448 TSval=3528476145 TSecr=4263387513 [TCP segment of a reassembled PDU]"
"239","1.428311","100.86.191.105","54.197.162.13","TCP","1514","53319  >  443 [ACK] Seq=10256 Ack=3997 Win=131072 Len=1448 TSval=3528476145 TSecr=4263387513 [TCP segment of a reassembled PDU]"
"240","1.428332","100.86.191.105","54.197.162.13","TLSv1.2","613","Application Data"
"241","1.428524","100.86.191.105","54.197.162.13","TCP","78","53324  >  443 [SYN] Seq=0 Win=65535 Len=0 MSS=1460 WS=64 TSval=2295035389 TSecr=0 SACK_PERM"
"242","1.430368","100.86.191.105","54.197.162.13","TCP","78","53325  >  443 [SYN] Seq=0 Win=65535 Len=0 MSS=1460 WS=64 TSval=1630725133 TSecr=0 SACK_PERM"
