"No.","Time","Source","Destination","Protocol","Length","Info"
"1","0.000000","100.81.191.105","13.107.42.14","TCP","78","56355  >  443 [SYN] Seq=0 Win=65535 Len=0 MSS=1460 WS=64 TSval=2750354889 TSecr=0 SACK_PERM"
"2","0.000100","100.81.191.105","13.107.42.14","TCP","78","56356  >  443 [SYN] Seq=0 Win=65535 Len=0 MSS=1460 WS=64 TSval=1093904105 TSecr=0 SACK_PERM"
"3","0.013127","13.107.42.14","100.81.191.105","TCP","66","443  >  56356 [SYN, ACK] Seq=0 Ack=1 Win=65535 Len=0 MSS=1440 WS=256 SACK_PERM"
"4","0.013128","13.107.42.14","100.81.191.105","TCP","66","443  >  56355 [SYN, ACK] Seq=0 Ack=1 Win=65535 Len=0 MSS=1440 WS=256 SACK_PERM"
"5","0.013228","100.81.191.105","13.107.42.14","TCP","54","56356  >  443 [ACK] Seq=1 Ack=1 Win=262144 Len=0"
"6","0.013284","100.81.191.105","13.107.42.14","TCP","54","56355  >  443 [ACK] Seq=1 Ack=1 Win=262144 Len=0"
"7","0.013592","100.81.191.105","13.107.42.14","TCP","1494","56356  >  443 [ACK] Seq=1 Ack=1 Win=262144 Len=1440 [TCP segment of a reassembled PDU]"
"8","0.013610","100.81.191.105","13.107.42.14","TLSv1.2","372","Client Hello (SNI=www.linkedin.com)"
"9","0.013828","100.81.191.105","13.107.42.14","TCP","1494","56355  >  443 [ACK] Seq=1 Ack=1 Win=262144 Len=1440 [TCP segment of a reassembled PDU]"
"10","0.013834","100.81.191.105","13.107.42.14","TLSv1.2","436","Client Hello (SNI=www.linkedin.com)"
"11","0.026555","13.107.42.14","100.81.191.105","TCP","56","443  >  56356 [ACK] Seq=1 Ack=1759 Win=4194560 Len=0"
"12","0.026556","13.107.42.14","100.81.191.105","TCP","56","443  >  56355 [ACK] Seq=1 Ack=1823 Win=4194560 Len=0"
"13","0.027863","13.107.42.14","100.81.191.105","TCP","1514","443  >  56355 [ACK] Seq=1 Ack=1823 Win=4194560 Len=1460 [TCP segment of a reassembled PDU]"
"14","0.027864","13.107.42.14","100.81.191.105","TCP","1514","443  >  56355 [ACK] Seq=1461 Ack=1823 Win=4194560 Len=1460 [TCP segment of a reassembled PDU]"
"15","0.027865","13.107.42.14","100.81.191.105","TCP","1514","443  >  56355 [ACK] Seq=2921 Ack=1823 Win=4194560 Len=1460 [TCP segment of a reassembled PDU]"
"16","0.027867","13.107.42.14","100.81.191.105","TLSv1.2","265","Server Hello, Certificate, Certificate Status, Server Key Exchange, Server Hello Done"
"17","0.027933","100.81.191.105","13.107.42.14","TCP","54","56355  >  443 [ACK] Seq=1823 Ack=4592 Win=257536 Len=0"
"18","0.028008","100.81.191.105","13.107.42.14","TCP","54","[TCP Window Update] 56355  >  443 [ACK] Seq=1823 Ack=4592 Win=262144 Len=0"
"19","0.029730","13.107.42.14","100.81.191.105","TCP","1514","443  >  56356 [ACK] Seq=1 Ack=1759 Win=4194560 Len=1460 [TCP segment of a reassembled PDU]"
"20","0.029731","13.107.42.14","100.81.191.105","TCP","1514","443  >  56356 [ACK] Seq=1461 Ack=1759 Win=4194560 Len=1460 [TCP segment of a reassembled PDU]"
"21","0.029732","13.107.42.14","100.81.191.105","TCP","1514","443  >  56356 [ACK] Seq=2921 Ack=1759 Win=4194560 Len=1460 [TCP segment of a reassembled PDU]"
"22","0.029732","13.107.42.14","100.81.191.105","TLSv1.2","265","Server Hello, Certificate, Certificate Status, Server Key Exchange, Server Hello Done"
"23","0.029807","100.81.191.105","13.107.42.14","TCP","54","56356  >  443 [ACK] Seq=1759 Ack=4592 Win=257536 Len=0"
"24","0.030297","100.81.191.105","13.107.42.14","TLSv1.2","212","Client Key Exchange, Change Cipher Spec, Encrypted Handshake Message"
"25","0.030384","100.81.191.105","13.107.42.14","TCP","54","[TCP Window Update] 56356  >  443 [ACK] Seq=1759 Ack=4592 Win=262144 Len=0"
"26","0.031368","100.81.191.105","13.107.42.14","TLSv1.2","212","Client Key Exchange, Change Cipher Spec, Encrypted Handshake Message"
"27","0.031402","100.81.191.105","13.107.42.14","TCP","54","56356  >  443 [FIN, ACK] Seq=1917 Ack=4592 Win=262144 Len=0"
"28","0.031638","100.81.191.105","13.107.42.14","TLSv1.2","153","Application Data"
"29","0.031757","100.81.191.105","13.107.42.14","TCP","1494","56355  >  443 [ACK] Seq=2080 Ack=4592 Win=262144 Len=1440 [TCP segment of a reassembled PDU]"
"30","0.031762","100.81.191.105","13.107.42.14","TLSv1.2","627","Application Data"
"31","0.042751","13.107.42.14","100.81.191.105","TCP","56","443  >  56355 [ACK] Seq=4592 Ack=1981 Win=4194304 Len=0"
"32","0.042752","13.107.42.14","100.81.191.105","TLSv1.2","396","New Session Ticket, Change Cipher Spec, Encrypted Handshake Message"
"33","0.042823","100.81.191.105","13.107.42.14","TCP","54","56355  >  443 [ACK] Seq=4093 Ack=4934 Win=261760 Len=0"
"34","0.044219","13.107.42.14","100.81.191.105","TLSv1.2","123","Application Data"
"35","0.044220","13.107.42.14","100.81.191.105","TCP","56","443  >  56356 [ACK] Seq=4592 Ack=1918 Win=4194304 Len=0"
"36","0.044220","13.107.42.14","100.81.191.105","TLSv1.2","92","Application Data"
"37","0.044249","100.81.191.105","13.107.42.14","TCP","54","56355  >  443 [ACK] Seq=4093 Ack=5003 Win=262016 Len=0"
"38","0.044276","100.81.191.105","13.107.42.14","TCP","54","56355  >  443 [ACK] Seq=4093 Ack=5041 Win=262016 Len=0"
"39","0.044321","100.81.191.105","13.107.42.14","TLSv1.2","92","Application Data"
"40","0.045483","13.107.42.14","100.81.191.105","TLSv1.2","396","New Session Ticket, Change Cipher Spec, Encrypted Handshake Message"
"41","0.045483","13.107.42.14","100.81.191.105","TLSv1.2","123","Application Data"
"42","0.045484","13.107.42.14","100.81.191.105","TCP","56","443  >  56356 [RST, ACK] Seq=5003 Ack=1918 Win=0 Len=0"
"43","0.045561","100.81.191.105","13.107.42.14","TCP","54","56356  >  443 [RST] Seq=1918 Win=0 Len=0"
"44","0.056226","13.107.42.14","100.81.191.105","TCP","56","443  >  56355 [ACK] Seq=5041 Ack=4131 Win=4194304 Len=0"
"45","0.230105","13.107.42.14","100.81.191.105","TCP","1514","443  >  56355 [ACK] Seq=5041 Ack=4131 Win=4194304 Len=1460 [TCP segment of a reassembled PDU]"
"46","0.230222","100.81.191.105","13.107.42.14","TCP","54","56355  >  443 [ACK] Seq=4131 Ack=6501 Win=260672 Len=0"
"47","0.231914","13.107.42.14","100.81.191.105","TCP","1514","443  >  56355 [ACK] Seq=6501 Ack=4131 Win=4194304 Len=1460 [TCP segment of a reassembled PDU]"
"48","0.231915","13.107.42.14","100.81.191.105","TLSv1.2","212","Application Data"
"49","0.231916","13.107.42.14","100.81.191.105","TLSv1.2","147","Application Data"
"50","0.231916","13.107.42.14","100.81.191.105","TLSv1.2","790","Application Data"
"51","0.231917","13.107.42.14","100.81.191.105","TCP","1514","443  >  56355 [ACK] Seq=8948 Ack=4131 Win=4194304 Len=1460 [TCP segment of a reassembled PDU]"
"52","0.231918","13.107.42.14","100.81.191.105","TCP","1514","443  >  56355 [ACK] Seq=10408 Ack=4131 Win=4194304 Len=1460 [TCP segment of a reassembled PDU]"
"53","0.231919","13.107.42.14","100.81.191.105","TLSv1.2","1268","Application Data"
"54","0.231920","13.107.42.14","100.81.191.105","TCP","1514","443  >  56355 [ACK] Seq=13082 Ack=4131 Win=4194304 Len=1460 [TCP segment of a reassembled PDU]"
"55","0.231921","13.107.42.14","100.81.191.105","TCP","1514","443  >  56355 [ACK] Seq=14542 Ack=4131 Win=4194304 Len=1460 [TCP segment of a reassembled PDU]"
"56","0.231922","13.107.42.14","100.81.191.105","TLSv1.2","1268","Application Data"
"57","0.232014","100.81.191.105","13.107.42.14","TCP","54","56355  >  443 [ACK] Seq=4131 Ack=17216 Win=251392 Len=0"
"58","0.232073","100.81.191.105","13.107.42.14","TCP","54","[TCP Window Update] 56355  >  443 [ACK] Seq=4131 Ack=17216 Win=262144 Len=0"
"59","0.238973","13.107.42.14","100.81.191.105","TCP","1514","443  >  56355 [ACK] Seq=17216 Ack=4131 Win=4194304 Len=1460 [TCP segment of a reassembled PDU]"
"60","0.238974","13.107.42.14","100.81.191.105","TCP","1514","443  >  56355 [ACK] Seq=18676 Ack=4131 Win=4194304 Len=1460 [TCP segment of a reassembled PDU]"
"61","0.238975","13.107.42.14","100.81.191.105","TLSv1.2","1268","Application Data"
"62","0.239056","100.81.191.105","13.107.42.14","TCP","54","56355  >  443 [ACK] Seq=4131 Ack=21350 Win=257984 Len=0"
"63","0.239142","100.81.191.105","13.107.42.14","TCP","54","[TCP Window Update] 56355  >  443 [ACK] Seq=4131 Ack=21350 Win=262144 Len=0"
"64","0.263299","13.107.42.14","100.81.191.105","TCP","1514","443  >  56355 [ACK] Seq=21350 Ack=4131 Win=4194304 Len=1460 [TCP segment of a reassembled PDU]"
"65","0.263371","100.81.191.105","13.107.42.14","TCP","54","56355  >  443 [ACK] Seq=4131 Ack=22810 Win=260672 Len=0"
"66","0.264602","13.107.42.14","100.81.191.105","TCP","1514","443  >  56355 [ACK] Seq=22810 Ack=4131 Win=4194304 Len=1460 [TCP segment of a reassembled PDU]"
"67","0.264603","13.107.42.14","100.81.191.105","TLSv1.2","1268","Application Data"
"68","0.264604","13.107.42.14","100.81.191.105","TCP","1514","443  >  56355 [ACK] Seq=25484 Ack=4131 Win=4194304 Len=1460 [TCP segment of a reassembled PDU]"
"69","0.264605","13.107.42.14","100.81.191.105","TCP","1514","443  >  56355 [ACK] Seq=26944 Ack=4131 Win=4194304 Len=1460 [TCP segment of a reassembled PDU]"
"70","0.264606","13.107.42.14","100.81.191.105","TLSv1.2","1268","Application Data"
"71","0.264606","13.107.42.14","100.81.191.105","TCP","1514","443  >  56355 [ACK] Seq=29618 Ack=4131 Win=4194304 Len=1460 [TCP segment of a reassembled PDU]"
"72","0.264607","13.107.42.14","100.81.191.105","TCP","1514","443  >  56355 [ACK] Seq=31078 Ack=4131 Win=4194304 Len=1460 [TCP segment of a reassembled PDU]"
"73","0.264608","13.107.42.14","100.81.191.105","TLSv1.2","1268","Application Data"
"74","0.264609","13.107.42.14","100.81.191.105","TCP","1514","443  >  56355 [ACK] Seq=33752 Ack=4131 Win=4194304 Len=1460 [TCP segment of a reassembled PDU]"
"75","0.264610","13.107.42.14","100.81.191.105","TCP","1514","443  >  56355 [ACK] Seq=35212 Ack=4131 Win=4194304 Len=1460 [TCP segment of a reassembled PDU]"
"76","0.264654","100.81.191.105","13.107.42.14","TCP","54","56355  >  443 [ACK] Seq=4131 Ack=36672 Win=248256 Len=0"
"77","0.264695","100.81.191.105","13.107.42.14","TCP","54","[TCP Window Update] 56355  >  443 [ACK] Seq=4131 Ack=36672 Win=262144 Len=0"
"78","0.266165","13.107.42.14","100.81.191.105","TLSv1.2","1268","Application Data"
"79","0.266166","13.107.42.14","100.81.191.105","TCP","1514","443  >  56355 [ACK] Seq=37886 Ack=4131 Win=4194304 Len=1460 [TCP segment of a reassembled PDU]"
"80","0.266167","13.107.42.14","100.81.191.105","TCP","1514","443  >  56355 [ACK] Seq=39346 Ack=4131 Win=4194304 Len=1460 [TCP segment of a reassembled PDU]"
"81","0.266168","13.107.42.14","100.81.191.105","TLSv1.2","570","Application Data"
"82","0.266168","13.107.42.14","100.81.191.105","TLSv1.2","790","Application Data"
"83","0.266233","100.81.191.105","13.107.42.14","TCP","54","56355  >  443 [ACK] Seq=4131 Ack=42058 Win=256704 Len=0"
"84","0.266288","100.81.191.105","13.107.42.14","TCP","54","[TCP Window Update] 56355  >  443 [ACK] Seq=4131 Ack=42058 Win=262144 Len=0"
"85","0.272007","13.107.42.14","100.81.191.105","TCP","1514","443  >  56355 [ACK] Seq=42058 Ack=4131 Win=4194304 Len=1460 [TCP segment of a reassembled PDU]"
"86","0.272073","100.81.191.105","13.107.42.14","TCP","54","56355  >  443 [ACK] Seq=4131 Ack=43518 Win=260672 Len=0"
"87","0.272668","13.107.42.14","100.81.191.105","TCP","1514","443  >  56355 [ACK] Seq=43518 Ack=4131 Win=4194304 Len=1460 [TCP segment of a reassembled PDU]"
"88","0.272670","13.107.42.14","100.81.191.105","TLSv1.2","1268","Application Data"
"89","0.272671","13.107.42.14","100.81.191.105","TCP","1514","443  >  56355 [ACK] Seq=46192 Ack=4131 Win=4194304 Len=1460 [TCP segment of a reassembled PDU]"
"90","0.272672","13.107.42.14","100.81.191.105","TCP","1514","443  >  56355 [ACK] Seq=47652 Ack=4131 Win=4194304 Len=1460 [TCP segment of a reassembled PDU]"
"91","0.272673","13.107.42.14","100.81.191.105","TLSv1.2","1268","Application Data"
"92","0.272674","13.107.42.14","100.81.191.105","TCP","1514","443  >  56355 [ACK] Seq=50326 Ack=4131 Win=4194304 Len=1460 [TCP segment of a reassembled PDU]"
"93","0.272675","13.107.42.14","100.81.191.105","TCP","1514","443  >  56355 [ACK] Seq=51786 Ack=4131 Win=4194304 Len=1460 [TCP segment of a reassembled PDU]"
"94","0.272675","13.107.42.14","100.81.191.105","TLSv1.2","1268","Application Data"
"95","0.272676","13.107.42.14","100.81.191.105","TCP","1514","443  >  56355 [ACK] Seq=54460 Ack=4131 Win=4194304 Len=1460 [TCP segment of a reassembled PDU]"
"96","0.272677","13.107.42.14","100.81.191.105","TCP","1514","443  >  56355 [ACK] Seq=55920 Ack=4131 Win=4194304 Len=1460 [TCP segment of a reassembled PDU]"
"97","0.272746","100.81.191.105","13.107.42.14","TCP","54","56355  >  443 [ACK] Seq=4131 Ack=57380 Win=248256 Len=0"
"98","0.272910","100.81.191.105","13.107.42.14","TCP","54","[TCP Window Update] 56355  >  443 [ACK] Seq=4131 Ack=57380 Win=262144 Len=0"
"99","0.273716","13.107.42.14","100.81.191.105","TLSv1.2","1268","Application Data"
"100","0.273784","100.81.191.105","13.107.42.14","TCP","54","56355  >  443 [ACK] Seq=4131 Ack=58594 Win=260928 Len=0"
"101","0.297242","13.107.42.14","100.81.191.105","TCP","1514","443  >  56355 [ACK] Seq=58594 Ack=4131 Win=4194304 Len=1460 [TCP segment of a reassembled PDU]"
"102","0.297243","13.107.42.14","100.81.191.105","TCP","1514","443  >  56355 [ACK] Seq=60054 Ack=4131 Win=4194304 Len=1460 [TCP segment of a reassembled PDU]"
"103","0.297244","13.107.42.14","100.81.191.105","TLSv1.2","109","Application Data"
"104","0.297329","100.81.191.105","13.107.42.14","TCP","54","56355  >  443 [ACK] Seq=4131 Ack=61569 Win=259136 Len=0"
"105","0.297429","100.81.191.105","13.107.42.14","TCP","54","[TCP Window Update] 56355  >  443 [ACK] Seq=4131 Ack=61569 Win=262144 Len=0"
"106","0.298038","13.107.42.14","100.81.191.105","TLSv1.2","1243","Application Data"
"107","0.298039","13.107.42.14","100.81.191.105","TCP","1514","443  >  56355 [ACK] Seq=62758 Ack=4131 Win=4194304 Len=1460 [TCP segment of a reassembled PDU]"
"108","0.298040","13.107.42.14","100.81.191.105","TCP","1514","443  >  56355 [ACK] Seq=64218 Ack=4131 Win=4194304 Len=1460 [TCP segment of a reassembled PDU]"
"109","0.298041","13.107.42.14","100.81.191.105","TLSv1.2","1268","Application Data"
"110","0.298042","13.107.42.14","100.81.191.105","TCP","1514","443  >  56355 [ACK] Seq=66892 Ack=4131 Win=4194304 Len=1460 [TCP segment of a reassembled PDU]"
"111","0.298043","13.107.42.14","100.81.191.105","TCP","1514","443  >  56355 [ACK] Seq=68352 Ack=4131 Win=4194304 Len=1460 [TCP segment of a reassembled PDU]"
"112","0.298043","13.107.42.14","100.81.191.105","TLSv1.2","1268","Application Data"
"113","0.298044","13.107.42.14","100.81.191.105","TCP","1514","443  >  56355 [ACK] Seq=71026 Ack=4131 Win=4194304 Len=1460 [TCP segment of a reassembled PDU]"
"114","0.298045","13.107.42.14","100.81.191.105","TCP","1514","443  >  56355 [ACK] Seq=72486 Ack=4131 Win=4194304 Len=1460 [TCP segment of a reassembled PDU]"
"115","0.298045","13.107.42.14","100.81.191.105","TLSv1.2","570","Application Data"
"116","0.298108","100.81.191.105","13.107.42.14","TCP","54","56355  >  443 [ACK] Seq=4131 Ack=74462 Win=249216 Len=0"
"117","0.298152","100.81.191.105","13.107.42.14","TCP","54","[TCP Window Update] 56355  >  443 [ACK] Seq=4131 Ack=74462 Win=262144 Len=0"
"118","0.299283","13.107.42.14","100.81.191.105","TLSv1.2","412","Application Data"
"119","0.299284","13.107.42.14","100.81.191.105","TCP","1514","443  >  56355 [ACK] Seq=74820 Ack=4131 Win=4194304 Len=1460 [TCP segment of a reassembled PDU]"
"120","0.299284","13.107.42.14","100.81.191.105","TLSv1.2","1513","Application Data"
"121","0.299285","13.107.42.14","100.81.191.105","TLSv1.2","979","Application Data"
"122","0.299640","100.81.191.105","13.107.42.14","TCP","54","56355  >  443 [ACK] Seq=4131 Ack=78664 Win=262144 Len=0"
"123","0.301383","13.107.42.14","100.81.191.105","TCP","1514","443  >  56355 [ACK] Seq=78664 Ack=4131 Win=4194304 Len=1460 [TCP segment of a reassembled PDU]"
"124","0.301384","13.107.42.14","100.81.191.105","TCP","1514","443  >  56355 [ACK] Seq=80124 Ack=4131 Win=4194304 Len=1460 [TCP segment of a reassembled PDU]"
"125","0.301385","13.107.42.14","100.81.191.105","TLSv1.2","1268","Application Data"
"126","0.301386","13.107.42.14","100.81.191.105","TLSv1.2","240","Application Data"
"127","0.301386","13.107.42.14","100.81.191.105","TLSv1.2","225","Application Data"
"128","0.301387","13.107.42.14","100.81.191.105","TCP","1514","443  >  56355 [ACK] Seq=83155 Ack=4131 Win=4194304 Len=1460 [TCP segment of a reassembled PDU]"
"129","0.301387","13.107.42.14","100.81.191.105","TLSv1.2","61","Application Data"
"130","0.301388","13.107.42.14","100.81.191.105","TLSv1.2","214","Application Data"
"131","0.301388","13.107.42.14","100.81.191.105","TLSv1.2","159","Application Data"
"132","0.301492","100.81.191.105","13.107.42.14","TCP","54","56355  >  443 [ACK] Seq=4131 Ack=84887 Win=262144 Len=0"
"133","0.414043","13.107.42.14","100.81.191.105","TCP","1514","443  >  56355 [ACK] Seq=84887 Ack=4131 Win=4194304 Len=1460 [TCP segment of a reassembled PDU]"
"134","0.414044","13.107.42.14","100.81.191.105","TLSv1.2","897","Application Data"
"135","0.414045","13.107.42.14","100.81.191.105","TLSv1.2","1172","Application Data"
"136","0.414175","100.81.191.105","13.107.42.14","TCP","54","56355  >  443 [ACK] Seq=4131 Ack=88308 Win=262144 Len=0"
"137","0.443977","13.107.42.14","100.81.191.105","TLSv1.2","291","Application Data"
"138","0.443978","13.107.42.14","100.81.191.105","TLSv1.2","507","Application Data"
"139","0.444244","100.81.191.105","13.107.42.14","TCP","54","56355  >  443 [ACK] Seq=4131 Ack=88998 Win=262144 Len=0"
"140","0.473918","13.107.42.14","100.81.191.105","TLSv1.2","880","Application Data"
"141","0.474443","100.81.191.105","13.107.42.14","TCP","54","56355  >  443 [ACK] Seq=4131 Ack=89824 Win=262144 Len=0"
"142","0.524469","13.107.42.14","100.81.191.105","TCP","1514","443  >  56355 [ACK] Seq=89824 Ack=4131 Win=4194304 Len=1460 [TCP segment of a reassembled PDU]"
"143","0.524470","13.107.42.14","100.81.191.105","TLSv1.2","1250","Application Data"
"144","0.524471","13.107.42.14","100.81.191.105","TCP","1514","443  >  56355 [ACK] Seq=92480 Ack=4131 Win=4194304 Len=1460 [TCP segment of a reassembled PDU]"
"145","0.524472","13.107.42.14","100.81.191.105","TLSv1.2","104","Application Data"
"146","0.524473","13.107.42.14","100.81.191.105","TCP","1514","443  >  56355 [ACK] Seq=93990 Ack=4131 Win=4194304 Len=1460 [TCP segment of a reassembled PDU]"
"147","0.524473","13.107.42.14","100.81.191.105","TCP","1514","443  >  56355 [ACK] Seq=95450 Ack=4131 Win=4194304 Len=1460 [TCP segment of a reassembled PDU]"
"148","0.524474","13.107.42.14","100.81.191.105","TLSv1.2","1268","Application Data"
"149","0.524646","13.107.42.14","100.81.191.105","TCP","1514","443  >  56355 [ACK] Seq=98124 Ack=4131 Win=4194304 Len=1460 [TCP segment of a reassembled PDU]"
"150","0.524647","13.107.42.14","100.81.191.105","TCP","1514","443  >  56355 [ACK] Seq=99584 Ack=4131 Win=4194304 Len=1460 [TCP segment of a reassembled PDU]"
"151","0.524660","100.81.191.105","13.107.42.14","TCP","54","56355  >  443 [ACK] Seq=4131 Ack=98124 Win=262144 Len=0"
"152","0.524682","100.81.191.105","13.107.42.14","TCP","54","56355  >  443 [ACK] Seq=4131 Ack=101044 Win=262144 Len=0"
"153","0.525748","13.107.42.14","100.81.191.105","TLSv1.2","1268","Application Data"
"154","0.525749","13.107.42.14","100.81.191.105","TCP","1514","443  >  56355 [ACK] Seq=102258 Ack=4131 Win=4194304 Len=1460 [TCP segment of a reassembled PDU]"
"155","0.525749","13.107.42.14","100.81.191.105","TCP","1514","443  >  56355 [ACK] Seq=103718 Ack=4131 Win=4194304 Len=1460 [TCP segment of a reassembled PDU]"
"156","0.525750","13.107.42.14","100.81.191.105","TLSv1.2","1268","Application Data"
"157","0.525751","13.107.42.14","100.81.191.105","TCP","1514","443  >  56355 [ACK] Seq=106392 Ack=4131 Win=4194304 Len=1460 [TCP segment of a reassembled PDU]"
"158","0.525751","13.107.42.14","100.81.191.105","TLSv1.2","124","Application Data"
"159","0.525752","13.107.42.14","100.81.191.105","TLSv1.2","581","Application Data"
"160","0.525785","100.81.191.105","13.107.42.14","TCP","54","56355  >  443 [ACK] Seq=4131 Ack=108449 Win=262144 Len=0"
"161","0.619088","13.107.42.14","100.81.191.105","TCP","1514","443  >  56355 [ACK] Seq=108449 Ack=4131 Win=4194304 Len=1460 [TCP segment of a reassembled PDU]"
"162","0.622632","13.107.42.14","100.81.191.105","TCP","1514","443  >  56355 [ACK] Seq=109909 Ack=4131 Win=4194304 Len=1460 [TCP segment of a reassembled PDU]"
"163","0.622633","13.107.42.14","100.81.191.105","TLSv1.2","1212","Application Data"
"164","0.622634","13.107.42.14","100.81.191.105","TLSv1.2","142","Application Data"
"165","0.622635","13.107.42.14","100.81.191.105","TCP","1514","443  >  56355 [ACK] Seq=112615 Ack=4131 Win=4194304 Len=1460 [TCP segment of a reassembled PDU]"
"166","0.622635","13.107.42.14","100.81.191.105","TCP","1514","443  >  56355 [ACK] Seq=114075 Ack=4131 Win=4194304 Len=1460 [TCP segment of a reassembled PDU]"
"167","0.622636","13.107.42.14","100.81.191.105","TLSv1.2","1268","Application Data"
"168","0.622637","13.107.42.14","100.81.191.105","TLSv1.2","240","Application Data"
"169","0.622751","100.81.191.105","13.107.42.14","TCP","54","56355  >  443 [ACK] Seq=4131 Ack=116935 Win=262144 Len=0"
"170","0.627325","13.107.42.14","100.81.191.105","TCP","1514","443  >  56355 [ACK] Seq=116935 Ack=4131 Win=4194304 Len=1460 [TCP segment of a reassembled PDU]"
"171","0.627327","13.107.42.14","100.81.191.105","TLSv1.2","264","Application Data"
"172","0.627578","100.81.191.105","13.107.42.14","TCP","54","56355  >  443 [ACK] Seq=4131 Ack=118605 Win=262144 Len=0"
"173","0.635473","13.107.42.14","100.81.191.105","TLSv1.2","468","Application Data"
"174","0.635580","100.81.191.105","13.107.42.14","TCP","54","56355  >  443 [ACK] Seq=4131 Ack=119019 Win=262144 Len=0"
"175","0.645032","13.107.42.14","100.81.191.105","TLSv1.2","1266","Application Data"
"176","0.645122","100.81.191.105","13.107.42.14","TCP","54","56355  >  443 [ACK] Seq=4131 Ack=120231 Win=262144 Len=0"
"177","0.653701","13.107.42.14","100.81.191.105","TCP","1514","[TCP Spurious Retransmission] 443  >  56355 [PSH, ACK] Seq=118771 Ack=4131 Win=4194304 Len=1460"
"178","0.653788","100.81.191.105","13.107.42.14","TCP","66","[TCP Dup ACK 176#1] 56355  >  443 [ACK] Seq=4131 Ack=120231 Win=262144 Len=0 SLE=118771 SRE=120231"
"179","0.660963","13.107.42.14","100.81.191.105","TLSv1.2","929","Application Data"
"180","0.660964","13.107.42.14","100.81.191.105","TCP","1514","443  >  56355 [ACK] Seq=121106 Ack=4131 Win=4194304 Len=1460 [TCP segment of a reassembled PDU]"
"181","0.661063","100.81.191.105","13.107.42.14","TCP","54","56355  >  443 [ACK] Seq=4131 Ack=122566 Win=262144 Len=0"
"182","0.664080","13.107.42.14","100.81.191.105","TCP","1514","443  >  56355 [ACK] Seq=122566 Ack=4131 Win=4194304 Len=1460 [TCP segment of a reassembled PDU]"
"183","0.664081","13.107.42.14","100.81.191.105","TLSv1.2","425","Application Data"
"184","0.664090","13.107.42.14","100.81.191.105","TLSv1.2","353","Application Data"
"185","0.664091","13.107.42.14","100.81.191.105","TLSv1.2","334","Application Data"
"186","0.664163","100.81.191.105","13.107.42.14","TCP","54","56355  >  443 [ACK] Seq=4131 Ack=124976 Win=262144 Len=0"
"187","0.671244","13.107.42.14","100.81.191.105","TCP","1514","443  >  56355 [ACK] Seq=124976 Ack=4131 Win=4194304 Len=1460 [TCP segment of a reassembled PDU]"
"188","0.671245","13.107.42.14","100.81.191.105","TLSv1.2","335","Application Data"
"189","0.671332","100.81.191.105","13.107.42.14","TCP","54","56355  >  443 [ACK] Seq=4131 Ack=126717 Win=262144 Len=0"
"190","0.747099","13.107.42.14","100.81.191.105","TCP","1514","443  >  56355 [ACK] Seq=126717 Ack=4131 Win=4194304 Len=1460 [TCP segment of a reassembled PDU]"
"191","0.747101","13.107.42.14","100.81.191.105","TLSv1.2","714","Application Data"
"192","0.747101","13.107.42.14","100.81.191.105","TCP","1514","443  >  56355 [ACK] Seq=128837 Ack=4131 Win=4194304 Len=1460 [TCP segment of a reassembled PDU]"
"193","0.747102","13.107.42.14","100.81.191.105","TLSv1.2","640","Application Data"
"194","0.747103","13.107.42.14","100.81.191.105","TCP","1514","443  >  56355 [ACK] Seq=130883 Ack=4131 Win=4194304 Len=1460 [TCP segment of a reassembled PDU]"
"195","0.747104","13.107.42.14","100.81.191.105","TCP","1514","443  >  56355 [ACK] Seq=132343 Ack=4131 Win=4194304 Len=1460 [TCP segment of a reassembled PDU]"
"196","0.747104","13.107.42.14","100.81.191.105","TLSv1.2","1268","Application Data"
"197","0.747105","13.107.42.14","100.81.191.105","TCP","1514","443  >  56355 [ACK] Seq=135017 Ack=4131 Win=4194304 Len=1460 [TCP segment of a reassembled PDU]"
"198","0.747240","100.81.191.105","13.107.42.14","TCP","54","56355  >  443 [ACK] Seq=4131 Ack=136477 Win=262144 Len=0"
"199","0.748138","13.107.42.14","100.81.191.105","TCP","1514","443  >  56355 [ACK] Seq=136477 Ack=4131 Win=4194304 Len=1460 [TCP segment of a reassembled PDU]"
"200","0.748139","13.107.42.14","100.81.191.105","TLSv1.2","1268","Application Data"
"201","0.748208","100.81.191.105","13.107.42.14","TCP","54","56355  >  443 [ACK] Seq=4131 Ack=139151 Win=262144 Len=0"
"202","0.748949","13.107.42.14","100.81.191.105","TCP","1514","443  >  56355 [ACK] Seq=139151 Ack=4131 Win=4194304 Len=1460 [TCP segment of a reassembled PDU]"
"203","0.748951","13.107.42.14","100.81.191.105","TLSv1.2","759","Application Data"
"204","0.748952","13.107.42.14","100.81.191.105","TCP","1514","443  >  56355 [ACK] Seq=141316 Ack=4131 Win=4194304 Len=1460 [TCP segment of a reassembled PDU]"
"205","0.748953","13.107.42.14","100.81.191.105","TCP","1514","443  >  56355 [ACK] Seq=142776 Ack=4131 Win=4194304 Len=1460 [TCP segment of a reassembled PDU]"
"206","0.748954","13.107.42.14","100.81.191.105","TLSv1.2","1268","Application Data"
"207","0.748955","13.107.42.14","100.81.191.105","TLSv1.2","790","Application Data"
"208","0.748955","13.107.42.14","100.81.191.105","TCP","1514","443  >  56355 [ACK] Seq=146186 Ack=4131 Win=4194304 Len=1460 [TCP segment of a reassembled PDU]"
"209","0.748957","13.107.42.14","100.81.191.105","TLSv1.2","87","Application Data"
"210","0.749027","100.81.191.105","13.107.42.14","TCP","54","56355  >  443 [ACK] Seq=4131 Ack=147679 Win=262144 Len=0"
"211","0.824701","13.107.42.14","100.81.191.105","TCP","1514","443  >  56355 [ACK] Seq=147679 Ack=4131 Win=4194304 Len=1460 [TCP segment of a reassembled PDU]"
"212","0.824929","13.107.42.14","100.81.191.105","TCP","1514","443  >  56355 [ACK] Seq=149139 Ack=4131 Win=4194304 Len=1460 [TCP segment of a reassembled PDU]"
"213","0.824931","13.107.42.14","100.81.191.105","TLSv1.2","682","Application Data"
"214","0.825011","100.81.191.105","13.107.42.14","TCP","54","56355  >  443 [ACK] Seq=4131 Ack=151227 Win=262144 Len=0"
"215","0.994183","100.81.191.105","13.107.42.14","TCP","1494","56355  >  443 [ACK] Seq=4131 Ack=151227 Win=262144 Len=1440 [TCP segment of a reassembled PDU]"
"216","0.994184","100.81.191.105","13.107.42.14","TCP","1494","56355  >  443 [ACK] Seq=5571 Ack=151227 Win=262144 Len=1440 [TCP segment of a reassembled PDU]"
"217","0.994185","100.81.191.105","13.107.42.14","TCP","1494","56355  >  443 [ACK] Seq=7011 Ack=151227 Win=262144 Len=1440 [TCP segment of a reassembled PDU]"
"218","0.994205","100.81.191.105","13.107.42.14","TLSv1.2","1476","Application Data"
"219","0.994221","100.81.191.105","13.107.42.14","TLSv1.2","273","Application Data"
"220","0.994414","100.81.191.105","13.107.42.14","TCP","1494","56355  >  443 [ACK] Seq=10092 Ack=151227 Win=262144 Len=1440 [TCP segment of a reassembled PDU]"
"221","0.994415","100.81.191.105","13.107.42.14","TCP","1494","56355  >  443 [ACK] Seq=11532 Ack=151227 Win=262144 Len=1440 [TCP segment of a reassembled PDU]"
"222","0.994416","100.81.191.105","13.107.42.14","TCP","1494","56355  >  443 [ACK] Seq=12972 Ack=151227 Win=262144 Len=1440 [TCP segment of a reassembled PDU]"
"223","0.994421","100.81.191.105","13.107.42.14","TLSv1.2","1477","Application Data"
"224","1.007707","13.107.42.14","100.81.191.105","TCP","56","443  >  56355 [ACK] Seq=151227 Ack=5571 Win=4194560 Len=0"
"225","1.007708","13.107.42.14","100.81.191.105","TCP","56","443  >  56355 [ACK] Seq=151227 Ack=7011 Win=4193024 Len=0"
"226","1.007709","13.107.42.14","100.81.191.105","TCP","56","443  >  56355 [ACK] Seq=151227 Ack=8451 Win=4194560 Len=0"
"227","1.007709","13.107.42.14","100.81.191.105","TCP","56","443  >  56355 [ACK] Seq=151227 Ack=11532 Win=4194560 Len=0"
"228","1.007710","13.107.42.14","100.81.191.105","TCP","56","443  >  56355 [ACK] Seq=151227 Ack=12972 Win=4193024 Len=0"
"229","1.007710","13.107.42.14","100.81.191.105","TCP","56","443  >  56355 [ACK] Seq=151227 Ack=14412 Win=4194560 Len=0"
"230","1.007711","13.107.42.14","100.81.191.105","TCP","56","443  >  56355 [ACK] Seq=151227 Ack=15835 Win=4193024 Len=0"
"231","1.072631","13.107.42.14","100.81.191.105","TCP","1514","443  >  56355 [ACK] Seq=151227 Ack=15835 Win=4193024 Len=1460 [TCP segment of a reassembled PDU]"
"232","1.072632","13.107.42.14","100.81.191.105","TLSv1.2","1456","Application Data"
"233","1.072752","100.81.191.105","13.107.42.14","TCP","54","56355  >  443 [ACK] Seq=15835 Ack=154089 Win=262144 Len=0"
"234","1.085295","13.107.42.14","100.81.191.105","TLSv1.2","427","Application Data"
"235","1.085417","100.81.191.105","13.107.42.14","TCP","54","56355  >  443 [ACK] Seq=15835 Ack=154462 Win=262144 Len=0"
"236","1.114034","100.81.191.105","13.107.42.14","TLSv1.2","390","Application Data"
"237","1.114077","100.81.191.105","13.107.42.14","TCP","1494","56355  >  443 [ACK] Seq=16171 Ack=154462 Win=262144 Len=1440 [TCP segment of a reassembled PDU]"
"238","1.114077","100.81.191.105","13.107.42.14","TCP","1494","56355  >  443 [ACK] Seq=17611 Ack=154462 Win=262144 Len=1440 [TCP segment of a reassembled PDU]"
"239","1.114095","100.81.191.105","13.107.42.14","TLSv1.2","389","Application Data"
"240","1.117005","100.81.191.105","13.107.42.14","TLSv1.2","155","Application Data"
"241","1.117043","100.81.191.105","13.107.42.14","TCP","1494","56355  >  443 [ACK] Seq=19487 Ack=154462 Win=262144 Len=1440 [TCP segment of a reassembled PDU]"
"242","1.117044","100.81.191.105","13.107.42.14","TCP","1494","56355  >  443 [ACK] Seq=20927 Ack=154462 Win=262144 Len=1440 [TCP segment of a reassembled PDU]"
"243","1.117045","100.81.191.105","13.107.42.14","TLSv1.2","406","Application Data"
"244","1.117661","100.81.191.105","13.107.42.14","TLSv1.2","155","Application Data"
"245","1.117678","100.81.191.105","13.107.42.14","TLSv1.2","755","Application Data"
"246","1.119771","100.81.191.105","13.107.42.14","TLSv1.2","155","Application Data"
"247","1.119809","100.81.191.105","13.107.42.14","TCP","1494","56355  >  443 [ACK] Seq=23622 Ack=154462 Win=262144 Len=1440 [TCP segment of a reassembled PDU]"
"248","1.119814","100.81.191.105","13.107.42.14","TLSv1.2","1197","Application Data"
"249","1.126205","13.107.42.14","100.81.191.105","TCP","56","443  >  56355 [ACK] Seq=154462 Ack=16171 Win=4194560 Len=0"
"250","1.126206","13.107.42.14","100.81.191.105","TCP","56","443  >  56355 [ACK] Seq=154462 Ack=19386 Win=4194560 Len=0"
"251","1.130462","13.107.42.14","100.81.191.105","TCP","56","443  >  56355 [ACK] Seq=154462 Ack=22719 Win=4194560 Len=0"
"252","1.130464","13.107.42.14","100.81.191.105","TCP","56","443  >  56355 [ACK] Seq=154462 Ack=22820 Win=4194304 Len=0"
"253","1.130465","13.107.42.14","100.81.191.105","TCP","56","443  >  56355 [ACK] Seq=154462 Ack=23521 Win=4193536 Len=0"
"254","1.132283","13.107.42.14","100.81.191.105","TCP","56","443  >  56355 [ACK] Seq=154462 Ack=23622 Win=4193536 Len=0"
"255","1.132289","13.107.42.14","100.81.191.105","TCP","56","443  >  56355 [ACK] Seq=154462 Ack=26205 Win=4194560 Len=0"
"256","1.195944","13.107.42.14","100.81.191.105","TLSv1.2","402","Application Data"
"257","1.196128","100.81.191.105","13.107.42.14","TCP","54","56355  >  443 [ACK] Seq=26205 Ack=154810 Win=262144 Len=0"
"258","1.209413","13.107.42.14","100.81.191.105","TLSv1.2","236","Application Data"
"259","1.209548","100.81.191.105","13.107.42.14","TCP","54","56355  >  443 [ACK] Seq=26205 Ack=154992 Win=262144 Len=0"
"260","1.221604","13.107.42.14","100.81.191.105","TLSv1.2","236","Application Data"
"261","1.221731","100.81.191.105","13.107.42.14","TCP","54","56355  >  443 [ACK] Seq=26205 Ack=155174 Win=262144 Len=0"
"262","1.234490","13.107.42.14","100.81.191.105","TLSv1.2","235","Application Data"
"263","1.234627","100.81.191.105","13.107.42.14","TCP","54","56355  >  443 [ACK] Seq=26205 Ack=155355 Win=262144 Len=0"
"264","1.251968","13.107.42.14","100.81.191.105","TLSv1.2","615","Application Data"
"265","1.251970","13.107.42.14","100.81.191.105","TCP","1514","443  >  56355 [ACK] Seq=155916 Ack=26205 Win=4194560 Len=1460 [TCP segment of a reassembled PDU]"
"266","1.251972","13.107.42.14","100.81.191.105","TCP","1514","443  >  56355 [ACK] Seq=157376 Ack=26205 Win=4194560 Len=1460 [TCP segment of a reassembled PDU]"
"267","1.251973","13.107.42.14","100.81.191.105","TLSv1.2","739","Application Data"
"268","1.251975","13.107.42.14","100.81.191.105","TCP","1514","443  >  56355 [ACK] Seq=159521 Ack=26205 Win=4194560 Len=1460 [TCP segment of a reassembled PDU]"
"269","1.251977","13.107.42.14","100.81.191.105","TCP","1514","443  >  56355 [ACK] Seq=160981 Ack=26205 Win=4194560 Len=1460 [TCP segment of a reassembled PDU]"
"270","1.252107","100.81.191.105","13.107.42.14","TCP","54","56355  >  443 [ACK] Seq=26205 Ack=162441 Win=262144 Len=0"
"271","1.253814","13.107.42.14","100.81.191.105","TLSv1.2","1268","Application Data"
"272","1.253815","13.107.42.14","100.81.191.105","TCP","1514","443  >  56355 [ACK] Seq=163655 Ack=26205 Win=4194560 Len=1460 [TCP segment of a reassembled PDU]"
"273","1.253816","13.107.42.14","100.81.191.105","TCP","1514","443  >  56355 [ACK] Seq=165115 Ack=26205 Win=4194560 Len=1460 [TCP segment of a reassembled PDU]"
"274","1.253816","13.107.42.14","100.81.191.105","TLSv1.2","1268","Application Data"
"275","1.253817","13.107.42.14","100.81.191.105","TCP","1514","443  >  56355 [ACK] Seq=167789 Ack=26205 Win=4194560 Len=1460 [TCP segment of a reassembled PDU]"
"276","1.253818","13.107.42.14","100.81.191.105","TLSv1.2","133","Application Data"
"277","1.253885","100.81.191.105","13.107.42.14","TCP","54","56355  >  443 [ACK] Seq=26205 Ack=169328 Win=262144 Len=0"
"278","1.299856","13.107.42.14","100.81.191.105","TLSv1.2","145","Application Data"
"279","1.299858","13.107.42.14","100.81.191.105","TLSv1.2","178","Application Data"
"280","1.299859","13.107.42.14","100.81.191.105","TLSv1.2","198","Application Data"
"281","1.299860","13.107.42.14","100.81.191.105","TLSv1.2","102","Application Data"
"282","1.299860","13.107.42.14","100.81.191.105","TLSv1.2","92","Application Data"
"283","1.299969","100.81.191.105","13.107.42.14","TCP","54","56355  >  443 [ACK] Seq=26205 Ack=169773 Win=262144 Len=0"
"284","1.682200","100.81.191.105","13.107.42.14","TCP","1494","56355  >  443 [ACK] Seq=26205 Ack=169773 Win=262144 Len=1440 [TCP segment of a reassembled PDU]"
"285","1.682203","100.81.191.105","13.107.42.14","TLSv1.2","863","Application Data"
"286","1.682214","100.81.191.105","13.107.42.14","TLSv1.2","687","Application Data"
"287","1.694941","13.107.42.14","100.81.191.105","TCP","56","443  >  56355 [ACK] Seq=169773 Ack=28454 Win=4194560 Len=0"
"288","1.694942","13.107.42.14","100.81.191.105","TCP","56","443  >  56355 [ACK] Seq=169773 Ack=29087 Win=4193792 Len=0"
"289","1.779681","13.107.42.14","100.81.191.105","TLSv1.2","272","Application Data"
"290","1.779743","100.81.191.105","13.107.42.14","TCP","54","56355  >  443 [ACK] Seq=29087 Ack=169991 Win=261888 Len=0"
"291","1.799421","100.81.191.105","13.107.42.14","TLSv1.2","520","Application Data"
"292","1.811518","13.107.42.14","100.81.191.105","TCP","56","443  >  56355 [ACK] Seq=169991 Ack=29553 Win=4193280 Len=0"
"293","1.824267","100.81.191.105","13.107.42.14","TCP","1494","56355  >  443 [ACK] Seq=29553 Ack=169991 Win=262144 Len=1440 [TCP segment of a reassembled PDU]"
"294","1.824287","100.81.191.105","13.107.42.14","TLSv1.2","865","Application Data"
"295","1.824332","100.81.191.105","13.107.42.14","TCP","1494","56355  >  443 [ACK] Seq=31804 Ack=169991 Win=262144 Len=1440 [TCP segment of a reassembled PDU]"
"296","1.824336","100.81.191.105","13.107.42.14","TLSv1.2","1033","Application Data"
"297","1.826314","100.81.191.105","13.107.42.14","TCP","1494","56355  >  443 [ACK] Seq=34223 Ack=169991 Win=262144 Len=1440 [TCP segment of a reassembled PDU]"
"298","1.826316","100.81.191.105","13.107.42.14","TCP","1494","56355  >  443 [ACK] Seq=35663 Ack=169991 Win=262144 Len=1440 [TCP segment of a reassembled PDU]"
"299","1.826343","100.81.191.105","13.107.42.14","TLSv1.2","137","Application Data"
"300","1.826469","100.81.191.105","13.107.42.14","TCP","1494","56355  >  443 [ACK] Seq=37186 Ack=169991 Win=262144 Len=1440 [TCP segment of a reassembled PDU]"
"301","1.826473","100.81.191.105","13.107.42.14","TLSv1.2","1115","Application Data"
"302","1.828383","100.81.191.105","13.107.42.14","TCP","1494","56355  >  443 [ACK] Seq=39687 Ack=169991 Win=262144 Len=1440 [TCP segment of a reassembled PDU]"
"303","1.828384","100.81.191.105","13.107.42.14","TCP","1494","56355  >  443 [ACK] Seq=41127 Ack=169991 Win=262144 Len=1440 [TCP segment of a reassembled PDU]"
"304","1.828386","100.81.191.105","13.107.42.14","TCP","1494","56355  >  443 [ACK] Seq=42567 Ack=169991 Win=262144 Len=1440 [TCP segment of a reassembled PDU]"
"305","1.828407","100.81.191.105","13.107.42.14","TLSv1.2","1480","Application Data"
"306","1.828448","100.81.191.105","13.107.42.14","TCP","1494","56355  >  443 [ACK] Seq=45433 Ack=169991 Win=262144 Len=1440 [TCP segment of a reassembled PDU]"
"307","1.828452","100.81.191.105","13.107.42.14","TLSv1.2","1117","Application Data"
"308","1.828481","100.81.191.105","13.107.42.14","TCP","1494","56355  >  443 [ACK] Seq=47936 Ack=169991 Win=262144 Len=1440 [TCP segment of a reassembled PDU]"
"309","1.828485","100.81.191.105","13.107.42.14","TLSv1.2","1097","Application Data"
"310","1.828514","100.81.191.105","13.107.42.14","TCP","1494","56355  >  443 [ACK] Seq=50419 Ack=169991 Win=262144 Len=1440 [TCP segment of a reassembled PDU]"
"311","1.828593","100.81.191.105","13.107.42.14","TLSv1.2","1415","Application Data"
"312","1.829027","100.81.191.105","13.107.42.14","TCP","1494","56355  >  443 [ACK] Seq=53220 Ack=169991 Win=262144 Len=1440 [TCP segment of a reassembled PDU]"
"313","1.829031","100.81.191.105","13.107.42.14","TLSv1.2","1179","Application Data"
"314","1.829060","100.81.191.105","13.107.42.14","TCP","1494","56355  >  443 [ACK] Seq=55785 Ack=169991 Win=262144 Len=1440 [TCP segment of a reassembled PDU]"
"315","1.829064","100.81.191.105","13.107.42.14","TLSv1.2","1138","Application Data"
"316","1.829092","100.81.191.105","13.107.42.14","TCP","1494","56355  >  443 [ACK] Seq=58309 Ack=169991 Win=262144 Len=1440 [TCP segment of a reassembled PDU]"
"317","1.829095","100.81.191.105","13.107.42.14","TLSv1.2","1089","Application Data"
"318","1.829124","100.81.191.105","13.107.42.14","TCP","1494","56355  >  443 [ACK] Seq=60784 Ack=169991 Win=262144 Len=1440 [TCP segment of a reassembled PDU]"
"319","1.829129","100.81.191.105","13.107.42.14","TLSv1.2","1089","Application Data"
"320","1.829157","100.81.191.105","13.107.42.14","TCP","1494","56355  >  443 [ACK] Seq=63259 Ack=169991 Win=262144 Len=1440 [TCP segment of a reassembled PDU]"
"321","1.829160","100.81.191.105","13.107.42.14","TLSv1.2","1030","Application Data"
"322","1.829184","100.81.191.105","13.107.42.14","TCP","1494","56355  >  443 [ACK] Seq=65675 Ack=169991 Win=262144 Len=1440 [TCP segment of a reassembled PDU]"
"323","1.829187","100.81.191.105","13.107.42.14","TLSv1.2","1030","Application Data"
"324","1.829211","100.81.191.105","13.107.42.14","TCP","1494","56355  >  443 [ACK] Seq=68091 Ack=169991 Win=262144 Len=1440 [TCP segment of a reassembled PDU]"
"325","1.829213","100.81.191.105","13.107.42.14","TLSv1.2","1070","Application Data"
"326","1.829237","100.81.191.105","13.107.42.14","TCP","1494","56355  >  443 [ACK] Seq=70547 Ack=169991 Win=262144 Len=1440 [TCP segment of a reassembled PDU]"
"327","1.829240","100.81.191.105","13.107.42.14","TLSv1.2","1053","Application Data"
