"No.","Time","Source","Destination","Protocol","Length","Info"
"1","0.000000","100.86.191.105","13.107.42.14","TCP","78","53215  >  443 [SYN] Seq=0 Win=65535 Len=0 MSS=1460 WS=64 TSval=3976213393 TSecr=0 SACK_PERM"
"2","0.002081","100.86.191.105","13.107.42.14","TCP","78","53216  >  443 [SYN] Seq=0 Win=65535 Len=0 MSS=1460 WS=64 TSval=2317708930 TSecr=0 SACK_PERM"
"3","0.014422","13.107.42.14","100.86.191.105","TCP","66","443  >  53215 [SYN, ACK] Seq=0 Ack=1 Win=65535 Len=0 MSS=1440 WS=256 SACK_PERM"
"4","0.014424","13.107.42.14","100.86.191.105","TCP","66","443  >  53216 [SYN, ACK] Seq=0 Ack=1 Win=65535 Len=0 MSS=1440 WS=256 SACK_PERM"
"5","0.014545","100.86.191.105","13.107.42.14","TCP","54","53215  >  443 [ACK] Seq=1 Ack=1 Win=262144 Len=0"
"6","0.014595","100.86.191.105","13.107.42.14","TCP","54","53216  >  443 [ACK] Seq=1 Ack=1 Win=262144 Len=0"
"7","0.014858","100.86.191.105","13.107.42.14","TCP","1494","53215  >  443 [ACK] Seq=1 Ack=1 Win=262144 Len=1440 [TCP segment of a reassembled PDU]"
"8","0.014875","100.86.191.105","13.107.42.14","TLSv1.2","404","Client Hello (SNI=www.linkedin.com)"
"9","0.015210","100.86.191.105","13.107.42.14","TCP","1494","53216  >  443 [ACK] Seq=1 Ack=1 Win=262144 Len=1440 [TCP segment of a reassembled PDU]"
"10","0.015219","100.86.191.105","13.107.42.14","TLSv1.2","340","Client Hello (SNI=www.linkedin.com)"
"11","0.028546","13.107.42.14","100.86.191.105","TCP","56","443  >  53215 [ACK] Seq=1 Ack=1791 Win=4194560 Len=0"
"12","0.028547","13.107.42.14","100.86.191.105","TCP","56","443  >  53216 [ACK] Seq=1 Ack=1727 Win=4194560 Len=0"
"13","0.031447","13.107.42.14","100.86.191.105","TCP","1514","443  >  53216 [ACK] Seq=1 Ack=1727 Win=4194560 Len=1460 [TCP segment of a reassembled PDU]"
"14","0.031448","13.107.42.14","100.86.191.105","TCP","1514","443  >  53216 [ACK] Seq=1461 Ack=1727 Win=4194560 Len=1460 [TCP segment of a reassembled PDU]"
"15","0.031449","13.107.42.14","100.86.191.105","TCP","1514","443  >  53216 [ACK] Seq=2921 Ack=1727 Win=4194560 Len=1460 [TCP segment of a reassembled PDU]"
"16","0.031450","13.107.42.14","100.86.191.105","TLSv1.2","265","Server Hello, Certificate, Certificate Status, Server Key Exchange, Server Hello Done"
"17","0.031451","13.107.42.14","100.86.191.105","TCP","1514","443  >  53215 [ACK] Seq=1 Ack=1791 Win=4194560 Len=1460 [TCP segment of a reassembled PDU]"
"18","0.031453","13.107.42.14","100.86.191.105","TCP","1514","443  >  53215 [ACK] Seq=1461 Ack=1791 Win=4194560 Len=1460 [TCP segment of a reassembled PDU]"
"19","0.031454","13.107.42.14","100.86.191.105","TCP","1514","443  >  53215 [ACK] Seq=2921 Ack=1791 Win=4194560 Len=1460 [TCP segment of a reassembled PDU]"
"20","0.031579","100.86.191.105","13.107.42.14","TCP","54","53216  >  443 [ACK] Seq=1727 Ack=4592 Win=257536 Len=0"
"21","0.031634","100.86.191.105","13.107.42.14","TCP","54","53215  >  443 [ACK] Seq=1791 Ack=4381 Win=257728 Len=0"
"22","0.031648","13.107.42.14","100.86.191.105","TLSv1.2","265","Server Hello, Certificate, Certificate Status, Server Key Exchange, Server Hello Done"
"23","0.031667","100.86.191.105","13.107.42.14","TCP","54","[TCP Window Update] 53216  >  443 [ACK] Seq=1727 Ack=4592 Win=262144 Len=0"
"24","0.031686","100.86.191.105","13.107.42.14","TCP","54","53215  >  443 [ACK] Seq=1791 Ack=4592 Win=257536 Len=0"
"25","0.032011","100.86.191.105","13.107.42.14","TCP","54","[TCP Window Update] 53215  >  443 [ACK] Seq=1791 Ack=4592 Win=262144 Len=0"
"26","0.034395","100.86.191.105","13.107.42.14","TLSv1.2","212","Client Key Exchange, Change Cipher Spec, Encrypted Handshake Message"
"27","0.035546","100.86.191.105","13.107.42.14","TLSv1.2","212","Client Key Exchange, Change Cipher Spec, Encrypted Handshake Message"
"28","0.035623","100.86.191.105","13.107.42.14","TCP","54","53216  >  443 [FIN, ACK] Seq=1885 Ack=4592 Win=262144 Len=0"
"29","0.036010","100.86.191.105","13.107.42.14","TLSv1.2","153","Application Data"
"30","0.036276","100.86.191.105","13.107.42.14","TCP","1494","53215  >  443 [ACK] Seq=2048 Ack=4592 Win=262144 Len=1440 [TCP segment of a reassembled PDU]"
"31","0.036285","100.86.191.105","13.107.42.14","TLSv1.2","662","Application Data"
"32","0.046490","13.107.42.14","100.86.191.105","TCP","56","443  >  53215 [ACK] Seq=4592 Ack=1949 Win=4194304 Len=0"
"33","0.047986","13.107.42.14","100.86.191.105","TLSv1.2","396","New Session Ticket, Change Cipher Spec, Encrypted Handshake Message"
"34","0.047987","13.107.42.14","100.86.191.105","TLSv1.2","123","Application Data"
"35","0.047987","13.107.42.14","100.86.191.105","TCP","56","443  >  53216 [ACK] Seq=4592 Ack=1886 Win=4194304 Len=0"
"36","0.048049","100.86.191.105","13.107.42.14","TCP","54","53215  >  443 [ACK] Seq=4096 Ack=5003 Win=261696 Len=0"
"37","0.048173","100.86.191.105","13.107.42.14","TLSv1.2","92","Application Data"
"38","0.049344","13.107.42.14","100.86.191.105","TLSv1.2","396","New Session Ticket, Change Cipher Spec, Encrypted Handshake Message"
"39","0.049345","13.107.42.14","100.86.191.105","TLSv1.2","123","Application Data"
"40","0.049345","13.107.42.14","100.86.191.105","TCP","56","443  >  53216 [RST, ACK] Seq=5003 Ack=1886 Win=0 Len=0"
"41","0.049346","13.107.42.14","100.86.191.105","TLSv1.2","92","Application Data"
"42","0.049428","100.86.191.105","13.107.42.14","TCP","54","53216  >  443 [RST] Seq=1886 Win=0 Len=0"
"43","0.049450","100.86.191.105","13.107.42.14","TCP","54","53215  >  443 [ACK] Seq=4134 Ack=5041 Win=262080 Len=0"
"44","0.059778","13.107.42.14","100.86.191.105","TCP","56","443  >  53215 [ACK] Seq=5041 Ack=4134 Win=4193792 Len=0"
"45","0.404146","13.107.42.14","100.86.191.105","TCP","1514","443  >  53215 [ACK] Seq=5041 Ack=4134 Win=4193792 Len=1460 [TCP segment of a reassembled PDU]"
"46","0.404148","13.107.42.14","100.86.191.105","TCP","1514","443  >  53215 [ACK] Seq=6501 Ack=4134 Win=4193792 Len=1460 [TCP segment of a reassembled PDU]"
"47","0.404149","13.107.42.14","100.86.191.105","TLSv1.2","515","Application Data"
"48","0.404249","100.86.191.105","13.107.42.14","TCP","54","53215  >  443 [ACK] Seq=4134 Ack=8422 Win=258752 Len=0"
"49","0.404384","100.86.191.105","13.107.42.14","TCP","54","[TCP Window Update] 53215  >  443 [ACK] Seq=4134 Ack=8422 Win=262144 Len=0"
"50","0.406109","13.107.42.14","100.86.191.105","TCP","1514","443  >  53215 [ACK] Seq=8422 Ack=4134 Win=4193792 Len=1460 [TCP segment of a reassembled PDU]"
"51","0.406110","13.107.42.14","100.86.191.105","TCP","1514","443  >  53215 [ACK] Seq=9882 Ack=4134 Win=4193792 Len=1460 [TCP segment of a reassembled PDU]"
"52","0.406111","13.107.42.14","100.86.191.105","TLSv1.2","877","Application Data"
"53","0.406113","13.107.42.14","100.86.191.105","TCP","1514","443  >  53215 [ACK] Seq=12165 Ack=4134 Win=4193792 Len=1460 [TCP segment of a reassembled PDU]"
"54","0.406114","13.107.42.14","100.86.191.105","TCP","1514","443  >  53215 [ACK] Seq=13625 Ack=4134 Win=4193792 Len=1460 [TCP segment of a reassembled PDU]"
"55","0.406115","13.107.42.14","100.86.191.105","TLSv1.2","1268","Application Data"
"56","0.406116","13.107.42.14","100.86.191.105","TCP","1514","[TCP Retransmission] 443  >  53215 [PSH, ACK] Seq=14839 Ack=4134 Win=4193792 Len=1460 [TCP segment of a reassembled PDU]"
"57","0.406118","13.107.42.14","100.86.191.105","TCP","1514","443  >  53215 [ACK] Seq=16299 Ack=4134 Win=4193792 Len=1460 [TCP segment of a reassembled PDU]"
"58","0.406119","13.107.42.14","100.86.191.105","TCP","1514","443  >  53215 [ACK] Seq=17759 Ack=4134 Win=4193792 Len=1460 [TCP segment of a reassembled PDU]"
"59","0.406120","13.107.42.14","100.86.191.105","TLSv1.2","1268","Application Data"
"60","0.406121","13.107.42.14","100.86.191.105","TCP","1514","443  >  53215 [ACK] Seq=20433 Ack=4134 Win=4193792 Len=1460 [TCP segment of a reassembled PDU]"
"61","0.406122","13.107.42.14","100.86.191.105","TCP","1514","443  >  53215 [ACK] Seq=21893 Ack=4134 Win=4193792 Len=1460 [TCP segment of a reassembled PDU]"
"62","0.406123","13.107.42.14","100.86.191.105","TLSv1.2","1268","Application Data"
"63","0.406124","13.107.42.14","100.86.191.105","TCP","1514","443  >  53215 [ACK] Seq=24567 Ack=4134 Win=4193792 Len=1460 [TCP segment of a reassembled PDU]"
"64","0.406126","13.107.42.14","100.86.191.105","TCP","1514","443  >  53215 [ACK] Seq=26027 Ack=4134 Win=4193792 Len=1460 [TCP segment of a reassembled PDU]"
"65","0.406127","13.107.42.14","100.86.191.105","TLSv1.2","1268","Application Data"
"66","0.406128","13.107.42.14","100.86.191.105","TCP","1514","443  >  53215 [ACK] Seq=28701 Ack=4134 Win=4193792 Len=1460 [TCP segment of a reassembled PDU]"
"67","0.406129","13.107.42.14","100.86.191.105","TCP","1514","443  >  53215 [ACK] Seq=30161 Ack=4134 Win=4193792 Len=1460 [TCP segment of a reassembled PDU]"
"68","0.406130","13.107.42.14","100.86.191.105","TLSv1.2","1268","Application Data"
"69","0.406225","100.86.191.105","13.107.42.14","TCP","54","53215  >  443 [ACK] Seq=4134 Ack=16299 Win=254208 Len=0"
"70","0.406275","100.86.191.105","13.107.42.14","TCP","54","53215  >  443 [ACK] Seq=4134 Ack=31621 Win=238912 Len=0"
"71","0.406290","100.86.191.105","13.107.42.14","TCP","54","53215  >  443 [ACK] Seq=4134 Ack=32835 Win=237696 Len=0"
"72","0.406339","100.86.191.105","13.107.42.14","TCP","54","[TCP Window Update] 53215  >  443 [ACK] Seq=4134 Ack=32835 Win=262144 Len=0"
"73","0.417134","13.107.42.14","100.86.191.105","TCP","1514","443  >  53215 [ACK] Seq=32835 Ack=4134 Win=4193792 Len=1460 [TCP segment of a reassembled PDU]"
"74","0.417136","13.107.42.14","100.86.191.105","TCP","1514","443  >  53215 [ACK] Seq=34295 Ack=4134 Win=4193792 Len=1460 [TCP segment of a reassembled PDU]"
"75","0.417136","13.107.42.14","100.86.191.105","TLSv1.2","1514","Application Data"
"76","0.417137","13.107.42.14","100.86.191.105","TCP","1514","443  >  53215 [ACK] Seq=37215 Ack=4134 Win=4193792 Len=1460 [TCP segment of a reassembled PDU]"
"77","0.417138","13.107.42.14","100.86.191.105","TCP","1514","443  >  53215 [ACK] Seq=38675 Ack=4134 Win=4193792 Len=1460 [TCP segment of a reassembled PDU]"
"78","0.417257","100.86.191.105","13.107.42.14","TCP","54","53215  >  443 [ACK] Seq=4134 Ack=40135 Win=254784 Len=0"
"79","0.417361","100.86.191.105","13.107.42.14","TCP","54","[TCP Window Update] 53215  >  443 [ACK] Seq=4134 Ack=40135 Win=262144 Len=0"
"80","0.418482","13.107.42.14","100.86.191.105","TLSv1.2","1514","Application Data"
"81","0.418483","13.107.42.14","100.86.191.105","TCP","1514","443  >  53215 [ACK] Seq=41595 Ack=4134 Win=4193792 Len=1460 [TCP segment of a reassembled PDU]"
"82","0.418485","13.107.42.14","100.86.191.105","TCP","1514","443  >  53215 [ACK] Seq=43055 Ack=4134 Win=4193792 Len=1460 [TCP segment of a reassembled PDU]"
"83","0.418485","13.107.42.14","100.86.191.105","TLSv1.2","763","Application Data"
"84","0.418589","100.86.191.105","13.107.42.14","TCP","54","53215  >  443 [ACK] Seq=4134 Ack=45224 Win=257024 Len=0"
"85","0.418654","100.86.191.105","13.107.42.14","TCP","54","[TCP Window Update] 53215  >  443 [ACK] Seq=4134 Ack=45224 Win=262144 Len=0"
"86","0.435514","13.107.42.14","100.86.191.105","TCP","1514","443  >  53215 [ACK] Seq=45224 Ack=4134 Win=4193792 Len=1460 [TCP segment of a reassembled PDU]"
"87","0.435515","13.107.42.14","100.86.191.105","TCP","1514","443  >  53215 [ACK] Seq=46684 Ack=4134 Win=4193792 Len=1460 [TCP segment of a reassembled PDU]"
"88","0.435516","13.107.42.14","100.86.191.105","TLSv1.2","1268","Application Data"
"89","0.435517","13.107.42.14","100.86.191.105","TCP","1514","443  >  53215 [ACK] Seq=49358 Ack=4134 Win=4193792 Len=1460 [TCP segment of a reassembled PDU]"
"90","0.435518","13.107.42.14","100.86.191.105","TCP","1514","443  >  53215 [ACK] Seq=50818 Ack=4134 Win=4193792 Len=1460 [TCP segment of a reassembled PDU]"
"91","0.435519","13.107.42.14","100.86.191.105","TCP","1514","[TCP Previous segment not captured] 443  >  53215 [ACK] Seq=53492 Ack=4134 Win=4193792 Len=1460 [TCP segment of a reassembled PDU]"
"92","0.435520","13.107.42.14","100.86.191.105","TCP","1514","443  >  53215 [ACK] Seq=54952 Ack=4134 Win=4193792 Len=1460 [TCP segment of a reassembled PDU]"
"93","0.435521","13.107.42.14","100.86.191.105","TLSv1.2","1268","Application Data"
"94","0.435522","13.107.42.14","100.86.191.105","TCP","1514","443  >  53215 [ACK] Seq=57626 Ack=4134 Win=4193792 Len=1460 [TCP segment of a reassembled PDU]"
"95","0.436321","100.86.191.105","13.107.42.14","TCP","54","53215  >  443 [ACK] Seq=4134 Ack=52278 Win=255040 Len=0"
"96","0.436364","100.86.191.105","13.107.42.14","TCP","66","[TCP Dup ACK 95#1] 53215  >  443 [ACK] Seq=4134 Ack=52278 Win=255040 Len=0 SLE=53492 SRE=59086"
"97","0.436413","100.86.191.105","13.107.42.14","TCP","66","[TCP Window Update] 53215  >  443 [ACK] Seq=4134 Ack=52278 Win=262144 Len=0 SLE=53492 SRE=59086"
"98","0.436855","13.107.42.14","100.86.191.105","TCP","1514","443  >  53215 [ACK] Seq=59086 Ack=4134 Win=4193792 Len=1460 [TCP segment of a reassembled PDU]"
"99","0.436856","13.107.42.14","100.86.191.105","TLSv1.2","1202","Application Data"
"100","0.436865","13.107.42.14","100.86.191.105","TLSv1.2","150","Application Data"
"101","0.436866","13.107.42.14","100.86.191.105","TCP","1514","443  >  53215 [ACK] Seq=61790 Ack=4134 Win=4193792 Len=1460 [TCP segment of a reassembled PDU]"
"102","0.436867","13.107.42.14","100.86.191.105","TCP","1514","443  >  53215 [ACK] Seq=63250 Ack=4134 Win=4193792 Len=1460 [TCP segment of a reassembled PDU]"
"103","0.436869","13.107.42.14","100.86.191.105","TLSv1.2","1268","Application Data"
"104","0.437424","100.86.191.105","13.107.42.14","TCP","66","[TCP Dup ACK 95#2] 53215  >  443 [ACK] Seq=4134 Ack=52278 Win=262144 Len=0 SLE=53492 SRE=65924"
"105","0.458425","13.107.42.14","100.86.191.105","TCP","1514","443  >  53215 [ACK] Seq=65924 Ack=4134 Win=4193792 Len=1460 [TCP segment of a reassembled PDU]"
"106","0.458426","13.107.42.14","100.86.191.105","TCP","1514","443  >  53215 [ACK] Seq=67384 Ack=4134 Win=4193792 Len=1460 [TCP segment of a reassembled PDU]"
"107","0.458428","13.107.42.14","100.86.191.105","TLSv1.2","1268","Application Data"
"108","0.458429","13.107.42.14","100.86.191.105","TCP","1514","443  >  53215 [ACK] Seq=70058 Ack=4134 Win=4193792 Len=1460 [TCP segment of a reassembled PDU]"
"109","0.458430","13.107.42.14","100.86.191.105","TCP","1514","443  >  53215 [ACK] Seq=71518 Ack=4134 Win=4193792 Len=1460 [TCP segment of a reassembled PDU]"
"110","0.458431","13.107.42.14","100.86.191.105","TLSv1.2","1268","Application Data"
"111","0.458432","13.107.42.14","100.86.191.105","TLSv1.2","803","Application Data"
"112","0.458468","13.107.42.14","100.86.191.105","TCP","1514","443  >  53215 [ACK] Seq=74941 Ack=4134 Win=4193792 Len=1460 [TCP segment of a reassembled PDU]"
"113","0.458469","13.107.42.14","100.86.191.105","TCP","1514","443  >  53215 [ACK] Seq=76401 Ack=4134 Win=4193792 Len=1460 [TCP segment of a reassembled PDU]"
"114","0.458540","100.86.191.105","13.107.42.14","TCP","66","[TCP Dup ACK 95#3] 53215  >  443 [ACK] Seq=4134 Ack=52278 Win=262144 Len=0 SLE=53492 SRE=74941"
"115","0.458591","100.86.191.105","13.107.42.14","TCP","66","[TCP Dup ACK 95#4] 53215  >  443 [ACK] Seq=4134 Ack=52278 Win=262144 Len=0 SLE=53492 SRE=77861"
"116","0.458604","13.107.42.14","100.86.191.105","TLSv1.2","1146","Application Data"
"117","0.458604","13.107.42.14","100.86.191.105","TLSv1.2","208","Application Data"
"118","0.458623","100.86.191.105","13.107.42.14","TCP","66","[TCP Dup ACK 95#5] 53215  >  443 [ACK] Seq=4134 Ack=52278 Win=262144 Len=0 SLE=53492 SRE=79107"
"119","0.459494","13.107.42.14","100.86.191.105","TCP","1514","443  >  53215 [ACK] Seq=79107 Ack=4134 Win=4193792 Len=1460 [TCP segment of a reassembled PDU]"
"120","0.459496","13.107.42.14","100.86.191.105","TCP","1514","443  >  53215 [ACK] Seq=80567 Ack=4134 Win=4193792 Len=1460 [TCP segment of a reassembled PDU]"
"121","0.459595","100.86.191.105","13.107.42.14","TCP","66","[TCP Dup ACK 95#6] 53215  >  443 [ACK] Seq=4134 Ack=52278 Win=262144 Len=0 SLE=53492 SRE=82027"
"122","0.460256","13.107.42.14","100.86.191.105","TLSv1.2","1037","Application Data"
"123","0.460258","13.107.42.14","100.86.191.105","TLSv1.2","223","Application Data"
"124","0.460258","13.107.42.14","100.86.191.105","TCP","1514","443  >  53215 [ACK] Seq=83179 Ack=4134 Win=4193792 Len=1460 [TCP segment of a reassembled PDU]"
"125","0.460259","13.107.42.14","100.86.191.105","TLSv1.2","62","Application Data"
"126","0.460260","13.107.42.14","100.86.191.105","TLSv1.2","211","Application Data"
"127","0.460260","13.107.42.14","100.86.191.105","TLSv1.2","158","Application Data"
"128","0.460261","13.107.42.14","100.86.191.105","TLSv1.2","1514","[TCP Fast Retransmission] , Application Data"
"129","0.460343","100.86.191.105","13.107.42.14","TCP","66","[TCP Dup ACK 95#7] 53215  >  443 [ACK] Seq=4134 Ack=52278 Win=262144 Len=0 SLE=53492 SRE=84908"
"130","0.460373","100.86.191.105","13.107.42.14","TCP","66","53215  >  443 [ACK] Seq=4134 Ack=84908 Win=229504 Len=0 SLE=53492 SRE=53738"
"131","0.460512","100.86.191.105","13.107.42.14","TCP","54","[TCP Window Update] 53215  >  443 [ACK] Seq=4134 Ack=84908 Win=262144 Len=0"
"132","0.537060","13.107.42.14","100.86.191.105","TCP","1514","443  >  53215 [ACK] Seq=84908 Ack=4134 Win=4193792 Len=1460 [TCP segment of a reassembled PDU]"
"133","0.537061","13.107.42.14","100.86.191.105","TLSv1.2","902","Application Data"
"134","0.537062","13.107.42.14","100.86.191.105","TLSv1.2","1169","Application Data"
"135","0.537176","100.86.191.105","13.107.42.14","TCP","54","53215  >  443 [ACK] Seq=4134 Ack=88331 Win=258688 Len=0"
"136","0.537237","100.86.191.105","13.107.42.14","TCP","54","[TCP Window Update] 53215  >  443 [ACK] Seq=4134 Ack=88331 Win=262144 Len=0"
"137","0.556042","13.107.42.14","100.86.191.105","TLSv1.2","518","Application Data"
"138","0.556112","100.86.191.105","13.107.42.14","TCP","54","53215  >  443 [ACK] Seq=4134 Ack=88795 Win=261632 Len=0"
"139","0.568495","13.107.42.14","100.86.191.105","TLSv1.2","284","Application Data"
"140","0.568543","100.86.191.105","13.107.42.14","TCP","54","53215  >  443 [ACK] Seq=4134 Ack=89025 Win=261888 Len=0"
"141","0.587138","13.107.42.14","100.86.191.105","TLSv1.2","879","Application Data"
"142","0.587227","100.86.191.105","13.107.42.14","TCP","54","53215  >  443 [ACK] Seq=4134 Ack=89850 Win=261312 Len=0"
"143","0.641512","13.107.42.14","100.86.191.105","TCP","1514","443  >  53215 [ACK] Seq=89850 Ack=4134 Win=4193792 Len=1460 [TCP segment of a reassembled PDU]"
"144","0.641514","13.107.42.14","100.86.191.105","TLSv1.2","1247","Application Data"
"145","0.641514","13.107.42.14","100.86.191.105","TCP","1514","443  >  53215 [ACK] Seq=92503 Ack=4134 Win=4193792 Len=1460 [TCP segment of a reassembled PDU]"
"146","0.641515","13.107.42.14","100.86.191.105","TLSv1.2","107","Application Data"
"147","0.641515","13.107.42.14","100.86.191.105","TCP","1514","443  >  53215 [ACK] Seq=94016 Ack=4134 Win=4193792 Len=1460 [TCP segment of a reassembled PDU]"
"148","0.641517","13.107.42.14","100.86.191.105","TCP","1514","443  >  53215 [ACK] Seq=95476 Ack=4134 Win=4193792 Len=1460 [TCP segment of a reassembled PDU]"
"149","0.641517","13.107.42.14","100.86.191.105","TLSv1.2","1268","Application Data"
"150","0.641518","13.107.42.14","100.86.191.105","TCP","1514","443  >  53215 [ACK] Seq=98150 Ack=4134 Win=4193792 Len=1460 [TCP segment of a reassembled PDU]"
"151","0.641576","100.86.191.105","13.107.42.14","TCP","54","53215  >  443 [ACK] Seq=4134 Ack=99610 Win=252352 Len=0"
"152","0.641622","100.86.191.105","13.107.42.14","TCP","54","[TCP Window Update] 53215  >  443 [ACK] Seq=4134 Ack=99610 Win=262144 Len=0"
"153","0.643665","13.107.42.14","100.86.191.105","TCP","1514","443  >  53215 [ACK] Seq=99610 Ack=4134 Win=4193792 Len=1460 [TCP segment of a reassembled PDU]"
"154","0.643666","13.107.42.14","100.86.191.105","TLSv1.2","1268","Application Data"
"155","0.643670","13.107.42.14","100.86.191.105","TCP","1514","443  >  53215 [ACK] Seq=102284 Ack=4134 Win=4193792 Len=1460 [TCP segment of a reassembled PDU]"
"156","0.643671","13.107.42.14","100.86.191.105","TCP","1514","443  >  53215 [ACK] Seq=103744 Ack=4134 Win=4193792 Len=1460 [TCP segment of a reassembled PDU]"
"157","0.643671","13.107.42.14","100.86.191.105","TLSv1.2","1268","Application Data"
"158","0.643672","13.107.42.14","100.86.191.105","TLSv1.2","1250","Application Data"
"159","0.643672","13.107.42.14","100.86.191.105","TLSv1.2","915","Application Data"
"160","0.643731","100.86.191.105","13.107.42.14","TCP","54","53215  >  443 [ACK] Seq=4134 Ack=108475 Win=253248 Len=0"
"161","0.643784","100.86.191.105","13.107.42.14","TCP","54","[TCP Window Update] 53215  >  443 [ACK] Seq=4134 Ack=108475 Win=262144 Len=0"
"162","0.695744","13.107.42.14","100.86.191.105","TCP","1514","443  >  53215 [ACK] Seq=108475 Ack=4134 Win=4193792 Len=1460 [TCP segment of a reassembled PDU]"
"163","0.695745","13.107.42.14","100.86.191.105","TCP","1514","443  >  53215 [ACK] Seq=109935 Ack=4134 Win=4193792 Len=1460 [TCP segment of a reassembled PDU]"
"164","0.695747","13.107.42.14","100.86.191.105","TLSv1.2","1212","Application Data"
"165","0.695816","100.86.191.105","13.107.42.14","TCP","54","53215  >  443 [ACK] Seq=4134 Ack=112553 Win=258048 Len=0"
"166","0.695923","100.86.191.105","13.107.42.14","TCP","54","[TCP Window Update] 53215  >  443 [ACK] Seq=4134 Ack=112553 Win=262144 Len=0"
"167","0.697329","13.107.42.14","100.86.191.105","TLSv1.2","142","Application Data"
"168","0.697329","13.107.42.14","100.86.191.105","TCP","1514","443  >  53215 [ACK] Seq=112641 Ack=4134 Win=4193792 Len=1460 [TCP segment of a reassembled PDU]"
"169","0.697330","13.107.42.14","100.86.191.105","TCP","1514","443  >  53215 [ACK] Seq=114101 Ack=4134 Win=4193792 Len=1460 [TCP segment of a reassembled PDU]"
"170","0.697331","13.107.42.14","100.86.191.105","TLSv1.2","1268","Application Data"
"171","0.697332","13.107.42.14","100.86.191.105","TLSv1.2","239","Application Data"
"172","0.697412","100.86.191.105","13.107.42.14","TCP","54","53215  >  443 [ACK] Seq=4134 Ack=116960 Win=257728 Len=0"
"173","0.697635","100.86.191.105","13.107.42.14","TCP","54","[TCP Window Update] 53215  >  443 [ACK] Seq=4134 Ack=116960 Win=262144 Len=0"
"174","0.802631","13.107.42.14","100.86.191.105","TCP","1514","443  >  53215 [ACK] Seq=116960 Ack=4134 Win=4193792 Len=1460 [TCP segment of a reassembled PDU]"
"175","0.802665","100.86.191.105","13.107.42.14","TCP","54","53215  >  443 [ACK] Seq=4134 Ack=118420 Win=260672 Len=0"
"176","0.803033","13.107.42.14","100.86.191.105","TLSv1.2","264","Application Data"
"177","0.803107","100.86.191.105","13.107.42.14","TCP","54","53215  >  443 [ACK] Seq=4134 Ack=118630 Win=261888 Len=0"
"178","0.808930","13.107.42.14","100.86.191.105","TLSv1.2","468","Application Data"
"179","0.809000","100.86.191.105","13.107.42.14","TCP","54","53215  >  443 [ACK] Seq=4134 Ack=119044 Win=261696 Len=0"
"180","0.839934","13.107.42.14","100.86.191.105","TLSv1.2","1270","Application Data"
"181","0.839972","100.86.191.105","13.107.42.14","TCP","54","53215  >  443 [ACK] Seq=4134 Ack=120260 Win=260928 Len=0"
"182","0.853629","13.107.42.14","100.86.191.105","TLSv1.2","925","Application Data"
"183","0.853630","13.107.42.14","100.86.191.105","TCP","1514","443  >  53215 [ACK] Seq=121131 Ack=4134 Win=4193792 Len=1460 [TCP segment of a reassembled PDU]"
"184","0.853631","13.107.42.14","100.86.191.105","TCP","1514","443  >  53215 [ACK] Seq=122591 Ack=4134 Win=4193792 Len=1460 [TCP segment of a reassembled PDU]"
"185","0.853632","13.107.42.14","100.86.191.105","TLSv1.2","429","Application Data"
"186","0.853632","13.107.42.14","100.86.191.105","TLSv1.2","335","Application Data"
"187","0.853633","13.107.42.14","100.86.191.105","TLSv1.2","325","Application Data"
"188","0.853808","100.86.191.105","13.107.42.14","TCP","54","53215  >  443 [ACK] Seq=4134 Ack=124978 Win=257408 Len=0"
"189","0.853836","100.86.191.105","13.107.42.14","TCP","54","[TCP Window Update] 53215  >  443 [ACK] Seq=4134 Ack=124978 Win=262144 Len=0"
"190","0.939447","13.107.42.14","100.86.191.105","TCP","1514","443  >  53215 [ACK] Seq=124978 Ack=4134 Win=4193792 Len=1460 [TCP segment of a reassembled PDU]"
"191","0.939449","13.107.42.14","100.86.191.105","TLSv1.2","329","Application Data"
"192","0.939617","100.86.191.105","13.107.42.14","TCP","54","53215  >  443 [ACK] Seq=4134 Ack=126713 Win=260352 Len=0"
"193","0.983222","13.107.42.14","100.86.191.105","TCP","1514","[TCP Spurious Retransmission] 443  >  53215 [PSH, ACK] Seq=125253 Ack=4134 Win=4193792 Len=1460 [TCP segment of a reassembled PDU]"
"194","0.983223","13.107.42.14","100.86.191.105","TCP","1514","443  >  53215 [ACK] Seq=126713 Ack=4134 Win=4193792 Len=1460 [TCP segment of a reassembled PDU]"
"195","0.983224","13.107.42.14","100.86.191.105","TLSv1.2","729","Application Data"
"196","0.983225","13.107.42.14","100.86.191.105","TCP","1514","443  >  53215 [ACK] Seq=128848 Ack=4134 Win=4193792 Len=1460 [TCP segment of a reassembled PDU]"
"197","0.983226","13.107.42.14","100.86.191.105","TLSv1.2","625","Application Data"
"198","0.983226","13.107.42.14","100.86.191.105","TCP","1514","443  >  53215 [ACK] Seq=130879 Ack=4134 Win=4193792 Len=1460 [TCP segment of a reassembled PDU]"
"199","0.983227","13.107.42.14","100.86.191.105","TCP","1514","443  >  53215 [ACK] Seq=132339 Ack=4134 Win=4193792 Len=1460 [TCP segment of a reassembled PDU]"
"200","0.983438","13.107.42.14","100.86.191.105","TLSv1.2","1268","Application Data"
"201","0.983439","13.107.42.14","100.86.191.105","TCP","1514","443  >  53215 [ACK] Seq=135013 Ack=4134 Win=4193792 Len=1460 [TCP segment of a reassembled PDU]"
"202","0.983440","13.107.42.14","100.86.191.105","TCP","1514","443  >  53215 [ACK] Seq=136473 Ack=4134 Win=4193792 Len=1460 [TCP segment of a reassembled PDU]"
"203","0.983440","13.107.42.14","100.86.191.105","TLSv1.2","1268","Application Data"
"204","0.983469","100.86.191.105","13.107.42.14","TCP","54","53215  >  443 [ACK] Seq=4134 Ack=133799 Win=262144 Len=0"
"205","0.983496","100.86.191.105","13.107.42.14","TCP","54","53215  >  443 [ACK] Seq=4134 Ack=139147 Win=262144 Len=0"
"206","0.984428","13.107.42.14","100.86.191.105","TCP","1514","443  >  53215 [ACK] Seq=139147 Ack=4134 Win=4193792 Len=1460 [TCP segment of a reassembled PDU]"
"207","0.984429","13.107.42.14","100.86.191.105","TLSv1.2","455","Application Data"
"208","0.984470","100.86.191.105","13.107.42.14","TCP","54","53215  >  443 [ACK] Seq=4134 Ack=141008 Win=262144 Len=0"
"209","0.986023","13.107.42.14","100.86.191.105","TCP","1514","443  >  53215 [ACK] Seq=141008 Ack=4134 Win=4193792 Len=1460 [TCP segment of a reassembled PDU]"
"210","0.986024","13.107.42.14","100.86.191.105","TCP","1514","443  >  53215 [ACK] Seq=142468 Ack=4134 Win=4193792 Len=1460 [TCP segment of a reassembled PDU]"
"211","0.986025","13.107.42.14","100.86.191.105","TLSv1.2","1268","Application Data"
"212","0.986027","13.107.42.14","100.86.191.105","TCP","1514","443  >  53215 [ACK] Seq=145142 Ack=4134 Win=4193792 Len=1460 [TCP segment of a reassembled PDU]"
"213","0.986028","13.107.42.14","100.86.191.105","TLSv1.2","640","Application Data"
"214","0.986078","100.86.191.105","13.107.42.14","TCP","54","53215  >  443 [ACK] Seq=4134 Ack=147188 Win=262144 Len=0"
"215","1.015508","13.107.42.14","100.86.191.105","TCP","1514","443  >  53215 [ACK] Seq=147188 Ack=4134 Win=4193792 Len=1460 [TCP segment of a reassembled PDU]"
"216","1.015510","13.107.42.14","100.86.191.105","TCP","1514","443  >  53215 [ACK] Seq=148648 Ack=4134 Win=4193792 Len=1460 [TCP segment of a reassembled PDU]"
"217","1.015511","13.107.42.14","100.86.191.105","TLSv1.2","1026","Application Data"
"218","1.016961","100.86.191.105","13.107.42.14","TCP","54","53215  >  443 [ACK] Seq=4134 Ack=151080 Win=262144 Len=0"
"219","1.367233","100.86.191.105","13.107.42.14","TCP","1494","53215  >  443 [ACK] Seq=4134 Ack=151080 Win=262144 Len=1440 [TCP segment of a reassembled PDU]"
"220","1.367235","100.86.191.105","13.107.42.14","TCP","1494","53215  >  443 [ACK] Seq=5574 Ack=151080 Win=262144 Len=1440 [TCP segment of a reassembled PDU]"
"221","1.367236","100.86.191.105","13.107.42.14","TCP","1494","53215  >  443 [ACK] Seq=7014 Ack=151080 Win=262144 Len=1440 [TCP segment of a reassembled PDU]"
"222","1.367255","100.86.191.105","13.107.42.14","TLSv1.2","1437","Application Data"
"223","1.367270","100.86.191.105","13.107.42.14","TLSv1.2","273","Application Data"
"224","1.367348","100.86.191.105","13.107.42.14","TCP","1494","53215  >  443 [ACK] Seq=10056 Ack=151080 Win=262144 Len=1440 [TCP segment of a reassembled PDU]"
"225","1.367350","100.86.191.105","13.107.42.14","TCP","1494","53215  >  443 [ACK] Seq=11496 Ack=151080 Win=262144 Len=1440 [TCP segment of a reassembled PDU]"
"226","1.367350","100.86.191.105","13.107.42.14","TCP","1494","53215  >  443 [ACK] Seq=12936 Ack=151080 Win=262144 Len=1440 [TCP segment of a reassembled PDU]"
"227","1.367354","100.86.191.105","13.107.42.14","TLSv1.2","1438","Application Data"
"228","1.395614","100.86.191.105","13.107.42.14","TCP","1494","[TCP Retransmission] 53215  >  443 [PSH, ACK] Seq=14320 Ack=151080 Win=262144 Len=1440 [TCP segment of a reassembled PDU]"
"229","1.479836","13.107.42.14","100.86.191.105","TCP","56","443  >  53215 [ACK] Seq=151080 Ack=12936 Win=4193024 Len=0"
"230","1.479837","13.107.42.14","100.86.191.105","TCP","56","443  >  53215 [ACK] Seq=151080 Ack=15760 Win=4193024 Len=0"
"231","1.479838","13.107.42.14","100.86.191.105","TCP","66","[TCP Dup ACK 230#1] 443  >  53215 [ACK] Seq=151080 Ack=15760 Win=4193024 Len=0 SLE=14320 SRE=15760"
"232","1.505606","13.107.42.14","100.86.191.105","TLSv1.2","371","Application Data"
"233","1.505607","13.107.42.14","100.86.191.105","TCP","1514","443  >  53215 [ACK] Seq=151397 Ack=15760 Win=4193024 Len=1460 [TCP segment of a reassembled PDU]"
"234","1.505716","100.86.191.105","13.107.42.14","TCP","54","53215  >  443 [ACK] Seq=15760 Ack=152857 Win=260352 Len=0"
"235","1.513387","100.86.191.105","13.107.42.14","TLSv1.2","389","Application Data"
"236","1.513451","100.86.191.105","13.107.42.14","TLSv1.2","713","Application Data"
"237","1.513752","100.86.191.105","13.107.42.14","TLSv1.2","155","Application Data"
"238","1.513777","100.86.191.105","13.107.42.14","TCP","1494","53215  >  443 [ACK] Seq=16855 Ack=152857 Win=262144 Len=1440 [TCP segment of a reassembled PDU]"
"239","1.513778","100.86.191.105","13.107.42.14","TCP","1494","53215  >  443 [ACK] Seq=18295 Ack=152857 Win=262144 Len=1440 [TCP segment of a reassembled PDU]"
"240","1.513779","100.86.191.105","13.107.42.14","TCP","1494","53215  >  443 [ACK] Seq=19735 Ack=152857 Win=262144 Len=1440 [TCP segment of a reassembled PDU]"
"241","1.513781","100.86.191.105","13.107.42.14","TCP","1494","53215  >  443 [ACK] Seq=21175 Ack=152857 Win=262144 Len=1440 [TCP segment of a reassembled PDU]"
"242","1.513787","100.86.191.105","13.107.42.14","TLSv1.2","1004","Application Data"
"243","1.515117","13.107.42.14","100.86.191.105","TLSv1.2","1466","Application Data"
"244","1.515228","100.86.191.105","13.107.42.14","TCP","54","53215  >  443 [ACK] Seq=23565 Ack=154269 Win=260672 Len=0"
"245","1.517969","100.86.191.105","13.107.42.14","TCP","1494","53215  >  443 [ACK] Seq=23565 Ack=154269 Win=262144 Len=1440 [TCP segment of a reassembled PDU]"
"246","1.517987","100.86.191.105","13.107.42.14","TLSv1.2","710","Application Data"
"247","1.518069","100.86.191.105","13.107.42.14","TCP","1494","53215  >  443 [ACK] Seq=25661 Ack=154269 Win=262144 Len=1440 [TCP segment of a reassembled PDU]"
"248","1.518075","100.86.191.105","13.107.42.14","TLSv1.2","909","Application Data"
"249","1.518087","100.86.191.105","13.107.42.14","TLSv1.2","443","Application Data"
"250","1.518096","100.86.191.105","13.107.42.14","TLSv1.2","497","Application Data"
"251","1.518163","100.86.191.105","13.107.42.14","TLSv1.2","365","Application Data"
"252","1.518174","100.86.191.105","13.107.42.14","TLSv1.2","900","Application Data"
"253","1.533236","13.107.42.14","100.86.191.105","TCP","56","443  >  53215 [ACK] Seq=154269 Ack=16754 Win=4194560 Len=0"
"254","1.533237","13.107.42.14","100.86.191.105","TCP","56","443  >  53215 [ACK] Seq=154269 Ack=18295 Win=4194560 Len=0"
"255","1.535611","13.107.42.14","100.86.191.105","TCP","56","443  >  53215 [ACK] Seq=154269 Ack=23565 Win=4194560 Len=0"
"256","1.535612","13.107.42.14","100.86.191.105","TCP","56","443  >  53215 [ACK] Seq=154269 Ack=28788 Win=4193536 Len=0"
"257","1.535613","13.107.42.14","100.86.191.105","TCP","56","443  >  53215 [ACK] Seq=154269 Ack=29945 Win=4194560 Len=0"
"258","1.542369","100.86.191.105","13.107.42.14","TLSv1.2","155","Application Data"
"259","1.542456","100.86.191.105","13.107.42.14","TLSv1.2","986","Application Data"
"260","1.559114","13.107.42.14","100.86.191.105","TCP","56","443  >  53215 [ACK] Seq=154269 Ack=30978 Win=4193536 Len=0"
"261","1.625979","13.107.42.14","100.86.191.105","TLSv1.2","460","Application Data"
"262","1.625980","13.107.42.14","100.86.191.105","TLSv1.2","102","Application Data"
"263","1.625981","13.107.42.14","100.86.191.105","TLSv1.2","92","Application Data"
"264","1.625981","13.107.42.14","100.86.191.105","TLSv1.2","270","Application Data"
"265","1.625982","13.107.42.14","100.86.191.105","TLSv1.2","102","Application Data"
"266","1.625982","13.107.42.14","100.86.191.105","TLSv1.2","92","Application Data"
"267","1.626090","100.86.191.105","13.107.42.14","TCP","54","53215  >  443 [ACK] Seq=30978 Ack=155063 Win=261312 Len=0"
"268","1.639077","13.107.42.14","100.86.191.105","TLSv1.2","534","Application Data, Application Data"
"269","1.639157","100.86.191.105","13.107.42.14","TCP","54","53215  >  443 [ACK] Seq=30978 Ack=155543 Win=261632 Len=0"
"270","1.661937","13.107.42.14","100.86.191.105","TLSv1.2","235","Application Data"
"271","1.662030","100.86.191.105","13.107.42.14","TCP","54","53215  >  443 [ACK] Seq=30978 Ack=155724 Win=261952 Len=0"
"272","1.678412","13.107.42.14","100.86.191.105","TLSv1.2","236","Application Data"
"273","1.678481","100.86.191.105","13.107.42.14","TCP","54","53215  >  443 [ACK] Seq=30978 Ack=155906 Win=261952 Len=0"
"274","1.697407","13.107.42.14","100.86.191.105","TLSv1.2","271","Application Data"
"275","1.697408","13.107.42.14","100.86.191.105","TCP","1514","443  >  53215 [ACK] Seq=156123 Ack=30978 Win=4193536 Len=1460 [TCP segment of a reassembled PDU]"
"276","1.697410","13.107.42.14","100.86.191.105","TCP","1514","443  >  53215 [ACK] Seq=157583 Ack=30978 Win=4193536 Len=1460 [TCP segment of a reassembled PDU]"
"277","1.697490","100.86.191.105","13.107.42.14","TCP","54","53215  >  443 [ACK] Seq=30978 Ack=159043 Win=258944 Len=0"
"278","1.697567","100.86.191.105","13.107.42.14","TCP","54","[TCP Window Update] 53215  >  443 [ACK] Seq=30978 Ack=159043 Win=262144 Len=0"
"279","1.699347","13.107.42.14","100.86.191.105","TLSv1.2","1083","Application Data"
"280","1.699348","13.107.42.14","100.86.191.105","TCP","1514","443  >  53215 [ACK] Seq=160072 Ack=30978 Win=4193536 Len=1460 [TCP segment of a reassembled PDU]"
"281","1.699349","13.107.42.14","100.86.191.105","TCP","1514","443  >  53215 [ACK] Seq=161532 Ack=30978 Win=4193536 Len=1460 [TCP segment of a reassembled PDU]"
"282","1.699350","13.107.42.14","100.86.191.105","TLSv1.2","1268","Application Data"
"283","1.699351","13.107.42.14","100.86.191.105","TCP","1514","443  >  53215 [ACK] Seq=164206 Ack=30978 Win=4193536 Len=1460 [TCP segment of a reassembled PDU]"
"284","1.699351","13.107.42.14","100.86.191.105","TCP","1514","443  >  53215 [ACK] Seq=165666 Ack=30978 Win=4193536 Len=1460 [TCP segment of a reassembled PDU]"
"285","1.699352","13.107.42.14","100.86.191.105","TLSv1.2","1268","Application Data"
"286","1.699352","13.107.42.14","100.86.191.105","TCP","1514","443  >  53215 [ACK] Seq=168340 Ack=30978 Win=4193536 Len=1460 [TCP segment of a reassembled PDU]"
"287","1.699411","100.86.191.105","13.107.42.14","TCP","54","53215  >  443 [ACK] Seq=30978 Ack=169800 Win=251328 Len=0"
"288","1.699450","100.86.191.105","13.107.42.14","TCP","54","[TCP Window Update] 53215  >  443 [ACK] Seq=30978 Ack=169800 Win=262144 Len=0"
"289","1.700528","13.107.42.14","100.86.191.105","TLSv1.2","541","Application Data"
"290","1.700579","100.86.191.105","13.107.42.14","TCP","54","53215  >  443 [ACK] Seq=30978 Ack=170287 Win=261632 Len=0"
"291","1.749570","13.107.42.14","100.86.191.105","TLSv1.2","145","Application Data"
"292","1.749571","13.107.42.14","100.86.191.105","TLSv1.2","176","Application Data"
"293","1.749572","13.107.42.14","100.86.191.105","TLSv1.2","194","Application Data"
"294","1.749572","13.107.42.14","100.86.191.105","TLSv1.2","102","Application Data"
"295","1.749573","13.107.42.14","100.86.191.105","TLSv1.2","92","Application Data"
"296","1.749655","100.86.191.105","13.107.42.14","TCP","54","53215  >  443 [ACK] Seq=30978 Ack=170726 Win=261696 Len=0"
"297","2.058672","100.86.191.105","13.107.42.14","TCP","1494","53215  >  443 [ACK] Seq=30978 Ack=170726 Win=262144 Len=1440 [TCP segment of a reassembled PDU]"
"298","2.058681","100.86.191.105","13.107.42.14","TLSv1.2","850","Application Data"
"299","2.058722","100.86.191.105","13.107.42.14","TCP","1494","53215  >  443 [ACK] Seq=33214 Ack=170726 Win=262144 Len=1440 [TCP segment of a reassembled PDU]"
"300","2.058722","100.86.191.105","13.107.42.14","TLSv1.2","993","Application Data"
"301","2.060449","100.86.191.105","13.107.42.14","TCP","1494","53215  >  443 [ACK] Seq=35593 Ack=170726 Win=262144 Len=1440 [TCP segment of a reassembled PDU]"
"302","2.060451","100.86.191.105","13.107.42.14","TCP","1494","53215  >  443 [ACK] Seq=37033 Ack=170726 Win=262144 Len=1440 [TCP segment of a reassembled PDU]"
"303","2.060464","100.86.191.105","13.107.42.14","TLSv1.2","97","Application Data"
"304","2.060858","100.86.191.105","13.107.42.14","TCP","1494","53215  >  443 [ACK] Seq=38516 Ack=170726 Win=262144 Len=1440 [TCP segment of a reassembled PDU]"
"305","2.060862","100.86.191.105","13.107.42.14","TLSv1.2","1075","Application Data"
"306","2.060892","100.86.191.105","13.107.42.14","TCP","1494","53215  >  443 [ACK] Seq=40977 Ack=170726 Win=262144 Len=1440 [TCP segment of a reassembled PDU]"
"307","2.060895","100.86.191.105","13.107.42.14","TLSv1.2","1038","Application Data"
"308","2.061036","100.86.191.105","13.107.42.14","TCP","1494","53215  >  443 [ACK] Seq=43401 Ack=170726 Win=262144 Len=1440 [TCP segment of a reassembled PDU]"
"309","2.061037","100.86.191.105","13.107.42.14","TCP","1494","53215  >  443 [ACK] Seq=44841 Ack=170726 Win=262144 Len=1440 [TCP segment of a reassembled PDU]"
"310","2.061038","100.86.191.105","13.107.42.14","TCP","1494","53215  >  443 [ACK] Seq=46281 Ack=170726 Win=262144 Len=1440 [TCP segment of a reassembled PDU]"
"311","2.061043","100.86.191.105","13.107.42.14","TLSv1.2","1441","Application Data"
"312","2.061074","100.86.191.105","13.107.42.14","TCP","1494","53215  >  443 [ACK] Seq=49108 Ack=170726 Win=262144 Len=1440 [TCP segment of a reassembled PDU]"
"313","2.061077","100.86.191.105","13.107.42.14","TLSv1.2","1077","Application Data"
"314","2.061153","100.86.191.105","13.107.42.14","TCP","1494","53215  >  443 [ACK] Seq=51571 Ack=170726 Win=262144 Len=1440 [TCP segment of a reassembled PDU]"
"315","2.061157","100.86.191.105","13.107.42.14","TLSv1.2","1057","Application Data"
"316","2.061182","100.86.191.105","13.107.42.14","TCP","1494","53215  >  443 [ACK] Seq=54014 Ack=170726 Win=262144 Len=1440 [TCP segment of a reassembled PDU]"
"317","2.061184","100.86.191.105","13.107.42.14","TLSv1.2","1336","Application Data"
"318","2.070369","13.107.42.14","100.86.191.105","TCP","56","443  >  53215 [ACK] Seq=170726 Ack=34654 Win=4194560 Len=0"
"319","2.070370","13.107.42.14","100.86.191.105","TCP","56","443  >  53215 [ACK] Seq=170726 Ack=35593 Win=4193536 Len=0"
"320","2.073863","13.107.42.14","100.86.191.105","TCP","56","443  >  53215 [ACK] Seq=170726 Ack=38473 Win=4194560 Len=0"
"321","2.073863","13.107.42.14","100.86.191.105","TCP","56","443  >  53215 [ACK] Seq=170726 Ack=38516 Win=4194304 Len=0"
