"No.","Time","Source","Destination","Protocol","Length","Info"
"1","0.000000","13.107.42.14","100.81.191.105","TLSv1.2","190","Application Data"
"2","0.000163","100.81.191.105","13.107.42.14","TCP","54","65413  >  443 [ACK] Seq=1 Ack=137 Win=7221 Len=0"
"3","0.002048","100.81.191.105","13.107.42.14","TLSv1.2","96","Application Data"
"4","0.002117","100.81.191.105","13.107.42.14","TLSv1.2","96","Application Data"
"5","0.013595","100.81.191.105","13.107.42.14","TCP","1494","65413  >  443 [ACK] Seq=85 Ack=137 Win=7223 Len=1440 [TCP segment of a reassembled PDU]"
"6","0.013636","100.81.191.105","13.107.42.14","TLSv1.2","1393","Application Data"
"7","0.014474","13.107.42.14","100.81.191.105","TCP","56","443  >  65413 [ACK] Seq=137 Ack=43 Win=16384 Len=0"
"8","0.014476","13.107.42.14","100.81.191.105","TCP","56","443  >  65413 [ACK] Seq=137 Ack=85 Win=16384 Len=0"
"9","0.026593","13.107.42.14","100.81.191.105","TCP","56","443  >  65413 [ACK] Seq=137 Ack=2864 Win=16379 Len=0"
"10","0.096451","13.107.42.14","100.81.191.105","TLSv1.2","650","Application Data"
"11","0.096453","13.107.42.14","100.81.191.105","TLSv1.2","92","Application Data"
"12","0.096538","100.81.191.105","13.107.42.14","TCP","54","65413  >  443 [ACK] Seq=2864 Ack=771 Win=7213 Len=0"
"13","0.097398","100.81.191.105","13.107.42.14","TCP","1494","65413  >  443 [ACK] Seq=2864 Ack=771 Win=7223 Len=1440 [TCP segment of a reassembled PDU]"
"14","0.097414","100.81.191.105","13.107.42.14","TLSv1.2","1393","Application Data"
"15","0.110307","13.107.42.14","100.81.191.105","TCP","56","443  >  65413 [ACK] Seq=771 Ack=5643 Win=16379 Len=0"
"16","0.180790","13.107.42.14","100.81.191.105","TLSv1.2","489","Application Data"
"17","0.180792","13.107.42.14","100.81.191.105","TLSv1.2","92","Application Data"
"18","0.180900","100.81.191.105","13.107.42.14","TCP","54","65413  >  443 [ACK] Seq=5643 Ack=1244 Win=7216 Len=0"
"19","0.181520","100.81.191.105","13.107.42.14","TCP","1494","65413  >  443 [ACK] Seq=5643 Ack=1244 Win=7223 Len=1440 [TCP segment of a reassembled PDU]"
"20","0.181540","100.81.191.105","13.107.42.14","TLSv1.2","1393","Application Data"
"21","0.194278","13.107.42.14","100.81.191.105","TCP","56","443  >  65413 [ACK] Seq=1244 Ack=7083 Win=16385 Len=0"
"22","0.194279","13.107.42.14","100.81.191.105","TCP","56","443  >  65413 [ACK] Seq=1244 Ack=8422 Win=16379 Len=0"
"23","0.258916","13.107.42.14","100.81.191.105","TLSv1.2","492","Application Data"
"24","0.258918","13.107.42.14","100.81.191.105","TLSv1.2","92","Application Data"
"25","0.259029","100.81.191.105","13.107.42.14","TCP","54","65413  >  443 [ACK] Seq=8422 Ack=1720 Win=7216 Len=0"
"26","0.259777","100.81.191.105","13.107.42.14","TCP","1494","65413  >  443 [ACK] Seq=8422 Ack=1720 Win=7223 Len=1440 [TCP segment of a reassembled PDU]"
"27","0.259795","100.81.191.105","13.107.42.14","TLSv1.2","1393","Application Data"
"28","0.272832","13.107.42.14","100.81.191.105","TCP","56","443  >  65413 [ACK] Seq=1720 Ack=11201 Win=16385 Len=0"
"29","0.344054","13.107.42.14","100.81.191.105","TLSv1.2","357","Application Data"
"30","0.344057","13.107.42.14","100.81.191.105","TLSv1.2","224","Application Data"
"31","0.344059","13.107.42.14","100.81.191.105","TLSv1.2","92","Application Data"
"32","0.344253","100.81.191.105","13.107.42.14","TCP","54","65413  >  443 [ACK] Seq=11201 Ack=2231 Win=7215 Len=0"
"33","0.578177","100.81.191.105","13.107.42.14","TCP","1494","65413  >  443 [ACK] Seq=11201 Ack=2231 Win=7223 Len=1440 [TCP segment of a reassembled PDU]"
"34","0.578211","100.81.191.105","13.107.42.14","TLSv1.2","1440","Application Data"
"35","0.579357","100.81.191.105","13.107.42.14","TCP","1494","65413  >  443 [ACK] Seq=14027 Ack=2231 Win=7223 Len=1440 [TCP segment of a reassembled PDU]"
"36","0.579374","100.81.191.105","13.107.42.14","TLSv1.2","1429","Application Data"
"37","0.587867","100.81.191.105","13.107.42.14","TCP","1494","65413  >  443 [ACK] Seq=16842 Ack=2231 Win=7223 Len=1440 [TCP segment of a reassembled PDU]"
"38","0.587868","100.81.191.105","13.107.42.14","TCP","1494","65413  >  443 [ACK] Seq=18282 Ack=2231 Win=7223 Len=1440 [TCP segment of a reassembled PDU]"
"39","0.587895","100.81.191.105","13.107.42.14","TLSv1.2","100","Application Data"
"40","0.590386","13.107.42.14","100.81.191.105","TCP","56","443  >  65413 [ACK] Seq=2231 Ack=14027 Win=16385 Len=0"
"41","0.591496","13.107.42.14","100.81.191.105","TCP","56","443  >  65413 [ACK] Seq=2231 Ack=16842 Win=16385 Len=0"
"42","0.601297","13.107.42.14","100.81.191.105","TCP","56","443  >  65413 [ACK] Seq=2231 Ack=18282 Win=16379 Len=0"
"43","0.601299","13.107.42.14","100.81.191.105","TCP","56","443  >  65413 [ACK] Seq=2231 Ack=19768 Win=16385 Len=0"
"44","0.674905","13.107.42.14","100.81.191.105","TLSv1.2","578","Application Data"
"45","0.674907","13.107.42.14","100.81.191.105","TLSv1.2","92","Application Data"
"46","0.675034","100.81.191.105","13.107.42.14","TCP","54","65413  >  443 [ACK] Seq=19768 Ack=2793 Win=7214 Len=0"
"47","0.683113","13.107.42.14","100.81.191.105","TLSv1.2","546","Application Data"
"48","0.683114","13.107.42.14","100.81.191.105","TLSv1.2","92","Application Data"
"49","0.683204","100.81.191.105","13.107.42.14","TCP","54","65413  >  443 [ACK] Seq=19768 Ack=3323 Win=7215 Len=0"
"50","0.829915","13.107.42.14","100.81.191.105","TCP","1514","443  >  65413 [ACK] Seq=3323 Ack=19768 Win=16385 Len=1460 [TCP segment of a reassembled PDU]"
"51","0.829918","13.107.42.14","100.81.191.105","TCP","1514","443  >  65413 [ACK] Seq=4783 Ack=19768 Win=16385 Len=1460 [TCP segment of a reassembled PDU]"
"52","0.829919","13.107.42.14","100.81.191.105","TLSv1.2","1454","Application Data"
"53","0.829921","13.107.42.14","100.81.191.105","TLSv1.2","885","Application Data"
"54","0.829922","13.107.42.14","100.81.191.105","TLSv1.2","92","Application Data"
"55","0.830090","100.81.191.105","13.107.42.14","TCP","54","65413  >  443 [ACK] Seq=19768 Ack=8512 Win=7142 Len=0"
"56","0.830232","100.81.191.105","13.107.42.14","TCP","54","[TCP Window Update] 65413  >  443 [ACK] Seq=19768 Ack=8512 Win=7223 Len=0"
"57","0.844038","100.81.191.105","13.107.42.14","TCP","1494","65413  >  443 [ACK] Seq=19768 Ack=8512 Win=7223 Len=1440 [TCP segment of a reassembled PDU]"
"58","0.844041","100.81.191.105","13.107.42.14","TCP","1494","65413  >  443 [ACK] Seq=21208 Ack=8512 Win=7223 Len=1440 [TCP segment of a reassembled PDU]"
"59","0.844070","100.81.191.105","13.107.42.14","TLSv1.2","193","Application Data"
"60","0.856625","13.107.42.14","100.81.191.105","TCP","56","443  >  65413 [ACK] Seq=8512 Ack=21208 Win=16379 Len=0"
"61","0.856627","13.107.42.14","100.81.191.105","TCP","56","443  >  65413 [ACK] Seq=8512 Ack=22787 Win=16385 Len=0"
"62","0.956130","13.107.42.14","100.81.191.105","TLSv1.2","649","Application Data"
"63","0.956131","13.107.42.14","100.81.191.105","TLSv1.2","92","Application Data"
"64","0.956209","100.81.191.105","13.107.42.14","TCP","54","65413  >  443 [ACK] Seq=22787 Ack=9145 Win=7213 Len=0"
"65","0.969520","100.81.191.105","13.107.42.14","TCP","1494","65413  >  443 [ACK] Seq=22787 Ack=9145 Win=7223 Len=1440 [TCP segment of a reassembled PDU]"
"66","0.969562","100.81.191.105","13.107.42.14","TLSv1.2","1066","Application Data"
"67","0.969679","100.81.191.105","13.107.42.14","TCP","1494","65413  >  443 [ACK] Seq=25239 Ack=9145 Win=7223 Len=1440 [TCP segment of a reassembled PDU]"
"68","0.969694","100.81.191.105","13.107.42.14","TLSv1.2","1343","Application Data"
"69","0.969726","100.81.191.105","13.107.42.14","TCP","1494","65413  >  443 [ACK] Seq=27968 Ack=9145 Win=7223 Len=1440 [TCP segment of a reassembled PDU]"
"70","0.969730","100.81.191.105","13.107.42.14","TCP","1494","65413  >  443 [ACK] Seq=29408 Ack=9145 Win=7223 Len=1440 [TCP segment of a reassembled PDU]"
"71","0.969740","100.81.191.105","13.107.42.14","TLSv1.2","345","Application Data"
"72","0.969760","100.81.191.105","13.107.42.14","TLSv1.2","265","Application Data"
"73","0.971276","100.81.191.105","13.107.42.14","TCP","1494","65413  >  443 [ACK] Seq=31350 Ack=9145 Win=7223 Len=1440 [TCP segment of a reassembled PDU]"
"74","0.971304","100.81.191.105","13.107.42.14","TLSv1.2","1440","Application Data"
"75","0.982308","13.107.42.14","100.81.191.105","TCP","56","443  >  65413 [ACK] Seq=9145 Ack=24227 Win=16379 Len=0"
"76","0.982310","13.107.42.14","100.81.191.105","TCP","56","443  >  65413 [ACK] Seq=9145 Ack=25239 Win=16385 Len=0"
"77","0.984299","13.107.42.14","100.81.191.105","TCP","56","443  >  65413 [ACK] Seq=9145 Ack=26679 Win=16379 Len=0"
"78","0.984300","13.107.42.14","100.81.191.105","TCP","56","443  >  65413 [ACK] Seq=9145 Ack=27968 Win=16385 Len=0"
"79","0.984300","13.107.42.14","100.81.191.105","TCP","66","[TCP Dup ACK 78#1] 443  >  65413 [ACK] Seq=9145 Ack=27968 Win=16385 Len=0 SLE=30848 SRE=31139"
"80","0.984301","13.107.42.14","100.81.191.105","TCP","56","443  >  65413 [ACK] Seq=9145 Ack=31139 Win=16385 Len=0"
"81","0.984301","13.107.42.14","100.81.191.105","TCP","56","443  >  65413 [ACK] Seq=9145 Ack=31350 Win=16384 Len=0"
"82","0.984302","13.107.42.14","100.81.191.105","TCP","56","443  >  65413 [ACK] Seq=9145 Ack=34176 Win=16379 Len=0"
"83","1.050791","13.107.42.14","100.81.191.105","TLSv1.2","285","Application Data"
"84","1.050792","13.107.42.14","100.81.191.105","TLSv1.2","102","Application Data"
"85","1.050793","13.107.42.14","100.81.191.105","TLSv1.2","92","Application Data"
"86","1.050858","100.81.191.105","13.107.42.14","TCP","54","65413  >  443 [ACK] Seq=34176 Ack=9462 Win=7218 Len=0"
"87","1.062844","13.107.42.14","100.81.191.105","TLSv1.2","303","Application Data"
"88","1.063000","100.81.191.105","13.107.42.14","TCP","54","65413  >  443 [ACK] Seq=34176 Ack=9711 Win=7219 Len=0"
"89","1.077611","13.107.42.14","100.81.191.105","TLSv1.2","622","Application Data"
"90","1.077614","13.107.42.14","100.81.191.105","TLSv1.2","92","Application Data"
"91","1.077786","100.81.191.105","13.107.42.14","TCP","54","65413  >  443 [ACK] Seq=34176 Ack=10317 Win=7214 Len=0"
"92","1.192252","100.81.191.105","13.107.42.14","TCP","1494","65413  >  443 [ACK] Seq=34176 Ack=10317 Win=7223 Len=1440 [TCP segment of a reassembled PDU]"
"93","1.192358","100.81.191.105","13.107.42.14","TLSv1.2","1440","Application Data"
"94","1.192446","100.81.191.105","13.107.42.14","TCP","1494","65413  >  443 [ACK] Seq=37002 Ack=10317 Win=7223 Len=1440 [TCP segment of a reassembled PDU]"
"95","1.192458","100.81.191.105","13.107.42.14","TLSv1.2","1429","Application Data"
"96","1.205276","13.107.42.14","100.81.191.105","TCP","56","443  >  65413 [ACK] Seq=10317 Ack=37002 Win=16379 Len=0"
"97","1.205277","13.107.42.14","100.81.191.105","TCP","56","443  >  65413 [ACK] Seq=10317 Ack=38442 Win=16385 Len=0"
"98","1.205278","13.107.42.14","100.81.191.105","TCP","56","443  >  65413 [ACK] Seq=10317 Ack=39817 Win=16379 Len=0"
"99","1.279448","13.107.42.14","100.81.191.105","TLSv1.2","668","Application Data"
"100","1.279451","13.107.42.14","100.81.191.105","TLSv1.2","92","Application Data"
"101","1.279623","100.81.191.105","13.107.42.14","TCP","54","65413  >  443 [ACK] Seq=39817 Ack=10969 Win=7213 Len=0"
"102","1.291489","13.107.42.14","100.81.191.105","TLSv1.2","542","Application Data"
"103","1.291490","13.107.42.14","100.81.191.105","TLSv1.2","92","Application Data"
"104","1.291594","100.81.191.105","13.107.42.14","TCP","54","65413  >  443 [ACK] Seq=39817 Ack=11495 Win=7215 Len=0"
"105","4.336790","100.81.191.105","13.107.42.14","TCP","1494","65413  >  443 [ACK] Seq=39817 Ack=11495 Win=7223 Len=1440 [TCP segment of a reassembled PDU]"
"106","4.336825","100.81.191.105","13.107.42.14","TLSv1.2","1481","Application Data"
"107","4.336854","100.81.191.105","13.107.42.14","TLSv1.2","156","Application Data"
"108","4.351119","13.107.42.14","100.81.191.105","TCP","56","443  >  65413 [ACK] Seq=11495 Ack=42786 Win=16385 Len=0"
"109","4.433865","13.107.42.14","100.81.191.105","TLSv1.2","240","Application Data"
"110","4.433961","100.81.191.105","13.107.42.14","TCP","54","65413  >  443 [ACK] Seq=42786 Ack=11681 Win=7220 Len=0"
"111","4.440081","100.81.191.105","13.107.42.14","TCP","1494","65413  >  443 [ACK] Seq=42786 Ack=11681 Win=7223 Len=1440 [TCP segment of a reassembled PDU]"
"112","4.440083","100.81.191.105","13.107.42.14","TCP","1494","65413  >  443 [ACK] Seq=44226 Ack=11681 Win=7223 Len=1440 [TCP segment of a reassembled PDU]"
"113","4.440104","100.81.191.105","13.107.42.14","TLSv1.2","103","Application Data"
"114","4.440146","100.81.191.105","13.107.42.14","TCP","1494","65413  >  443 [ACK] Seq=45715 Ack=11681 Win=7223 Len=1440 [TCP segment of a reassembled PDU]"
"115","4.440147","100.81.191.105","13.107.42.14","TCP","1494","65413  >  443 [ACK] Seq=47155 Ack=11681 Win=7223 Len=1440 [TCP segment of a reassembled PDU]"
"116","4.440152","100.81.191.105","13.107.42.14","TLSv1.2","55","Application Data"
"117","4.452515","13.107.42.14","100.81.191.105","TCP","56","443  >  65413 [ACK] Seq=11681 Ack=45715 Win=16385 Len=0"
"118","4.452516","13.107.42.14","100.81.191.105","TCP","56","443  >  65413 [ACK] Seq=11681 Ack=47155 Win=16379 Len=0"
"119","4.452517","13.107.42.14","100.81.191.105","TCP","66","[TCP Dup ACK 118#1] 443  >  65413 [ACK] Seq=11681 Ack=47155 Win=16379 Len=0 SLE=48595 SRE=48596"
"120","4.452517","13.107.42.14","100.81.191.105","TCP","56","443  >  65413 [ACK] Seq=11681 Ack=48596 Win=16385 Len=0"
"121","4.509970","100.81.191.105","13.107.42.14","TCP","1494","65413  >  443 [ACK] Seq=48596 Ack=11681 Win=7223 Len=1440 [TCP segment of a reassembled PDU]"
"122","4.509992","100.81.191.105","13.107.42.14","TLSv1.2","1066","Application Data"
"123","4.510019","100.81.191.105","13.107.42.14","TCP","1494","65413  >  443 [ACK] Seq=51048 Ack=11681 Win=7223 Len=1440 [TCP segment of a reassembled PDU]"
"124","4.510020","100.81.191.105","13.107.42.14","TCP","1494","65413  >  443 [ACK] Seq=52488 Ack=11681 Win=7223 Len=1440 [TCP segment of a reassembled PDU]"
"125","4.510022","100.81.191.105","13.107.42.14","TCP","1494","65413  >  443 [ACK] Seq=53928 Ack=11681 Win=7223 Len=1440 [TCP segment of a reassembled PDU]"
"126","4.510052","100.81.191.105","13.107.42.14","TLSv1.2","1061","Application Data"
"127","4.510104","100.81.191.105","13.107.42.14","TCP","1494","65413  >  443 [ACK] Seq=56375 Ack=11681 Win=7223 Len=1440 [TCP segment of a reassembled PDU]"
"128","4.510110","100.81.191.105","13.107.42.14","TLSv1.2","1066","Application Data"
"129","4.510119","100.81.191.105","13.107.42.14","TLSv1.2","719","Application Data"
"130","4.522750","13.107.42.14","100.81.191.105","TCP","56","443  >  65413 [ACK] Seq=11681 Ack=51048 Win=16385 Len=0"
"131","4.522751","13.107.42.14","100.81.191.105","TCP","56","443  >  65413 [ACK] Seq=11681 Ack=52488 Win=16379 Len=0"
"132","4.522751","13.107.42.14","100.81.191.105","TCP","56","443  >  65413 [ACK] Seq=11681 Ack=53928 Win=16385 Len=0"
"133","4.522751","13.107.42.14","100.81.191.105","TCP","56","443  >  65413 [ACK] Seq=11681 Ack=59492 Win=16385 Len=0"
"134","4.551680","13.107.42.14","100.81.191.105","TCP","1514","443  >  65413 [ACK] Seq=11681 Ack=59492 Win=16385 Len=1460 [TCP segment of a reassembled PDU]"
"135","4.551681","13.107.42.14","100.81.191.105","TLSv1.2","376","Application Data"
"136","4.551682","13.107.42.14","100.81.191.105","TLSv1.2","92","Application Data"
"137","4.551753","100.81.191.105","13.107.42.14","TCP","54","65413  >  443 [ACK] Seq=59492 Ack=13501 Win=7195 Len=0"
"138","4.611312","13.107.42.14","100.81.191.105","TLSv1.2","236","Application Data"
"139","4.611391","100.81.191.105","13.107.42.14","TCP","54","65413  >  443 [ACK] Seq=59492 Ack=13683 Win=7220 Len=0"
"140","4.709802","13.107.42.14","100.81.191.105","TLSv1.2","235","Application Data"
"141","4.709883","100.81.191.105","13.107.42.14","TCP","54","65413  >  443 [ACK] Seq=59492 Ack=13864 Win=7220 Len=0"
"142","5.017701","13.107.42.14","100.81.191.105","TCP","1514","443  >  65413 [ACK] Seq=13864 Ack=59492 Win=16385 Len=1460 [TCP segment of a reassembled PDU]"
"143","5.017704","13.107.42.14","100.81.191.105","TCP","1514","443  >  65413 [ACK] Seq=15324 Ack=59492 Win=16385 Len=1460 [TCP segment of a reassembled PDU]"
"144","5.017705","13.107.42.14","100.81.191.105","TLSv1.2","1432","Application Data"
"145","5.017831","13.107.42.14","100.81.191.105","TCP","1514","443  >  65413 [ACK] Seq=18162 Ack=59492 Win=16385 Len=1460 [TCP segment of a reassembled PDU]"
"146","5.017832","13.107.42.14","100.81.191.105","TLSv1.2","1262","Application Data"
"147","5.017834","13.107.42.14","100.81.191.105","TCP","1514","443  >  65413 [ACK] Seq=20830 Ack=59492 Win=16385 Len=1460 [TCP segment of a reassembled PDU]"
"148","5.017835","13.107.42.14","100.81.191.105","TLSv1.2","249","Application Data"
"149","5.017836","13.107.42.14","100.81.191.105","TLSv1.2","92","Application Data"
"150","5.017837","13.107.42.14","100.81.191.105","TCP","1514","[TCP Retransmission] 443  >  65413 [PSH, ACK] Seq=21063 Ack=59492 Win=16385 Len=1460"
"151","5.017870","100.81.191.105","13.107.42.14","TCP","54","65413  >  443 [ACK] Seq=59492 Ack=18162 Win=7156 Len=0"
"152","5.017901","100.81.191.105","13.107.42.14","TCP","66","65413  >  443 [ACK] Seq=59492 Ack=22523 Win=7088 Len=0 SLE=21063 SRE=22523"
"153","5.017968","100.81.191.105","13.107.42.14","TCP","54","[TCP Window Update] 65413  >  443 [ACK] Seq=59492 Ack=22523 Win=7223 Len=0"
"154","5.018709","100.81.191.105","13.107.42.14","TLSv1.2","96","Application Data"
"155","5.030977","13.107.42.14","100.81.191.105","TCP","56","443  >  65413 [ACK] Seq=22523 Ack=59534 Win=16384 Len=0"
"156","5.031659","100.81.191.105","13.107.42.14","TCP","1494","65413  >  443 [ACK] Seq=59534 Ack=22523 Win=7223 Len=1440 [TCP segment of a reassembled PDU]"
"157","5.031663","100.81.191.105","13.107.42.14","TCP","1494","65413  >  443 [ACK] Seq=60974 Ack=22523 Win=7223 Len=1440 [TCP segment of a reassembled PDU]"
"158","5.031703","100.81.191.105","13.107.42.14","TLSv1.2","75","Application Data"
"159","5.044408","13.107.42.14","100.81.191.105","TCP","56","443  >  65413 [ACK] Seq=22523 Ack=60974 Win=16385 Len=0"
"160","5.044410","13.107.42.14","100.81.191.105","TCP","56","443  >  65413 [ACK] Seq=22523 Ack=62414 Win=16379 Len=0"
"161","5.044410","13.107.42.14","100.81.191.105","TCP","56","443  >  65413 [ACK] Seq=22523 Ack=62435 Win=16385 Len=0"
"162","5.053118","100.81.191.105","13.107.42.14","TCP","1494","65413  >  443 [ACK] Seq=62435 Ack=22523 Win=7223 Len=1440 [TCP segment of a reassembled PDU]"
"163","5.053153","100.81.191.105","13.107.42.14","TLSv1.2","1493","Application Data"
"164","5.065763","13.107.42.14","100.81.191.105","TCP","56","443  >  65413 [ACK] Seq=22523 Ack=65314 Win=16385 Len=0"
"165","5.135066","13.107.42.14","100.81.191.105","TCP","1514","443  >  65413 [ACK] Seq=22523 Ack=65314 Win=16385 Len=1460 [TCP segment of a reassembled PDU]"
"166","5.135068","13.107.42.14","100.81.191.105","TLSv1.2","761","Application Data"
"167","5.135069","13.107.42.14","100.81.191.105","TLSv1.2","92","Application Data"
"168","5.135151","100.81.191.105","13.107.42.14","TCP","54","65413  >  443 [ACK] Seq=65314 Ack=24728 Win=7189 Len=0"
"169","5.136369","13.107.42.14","100.81.191.105","TLSv1.2","597","Application Data"
"170","5.136370","13.107.42.14","100.81.191.105","TLSv1.2","92","Application Data"
"171","5.136404","100.81.191.105","13.107.42.14","TCP","54","65413  >  443 [ACK] Seq=65314 Ack=25309 Win=7214 Len=0"
"172","5.140839","100.81.191.105","13.107.42.14","TCP","1494","65413  >  443 [ACK] Seq=65314 Ack=25309 Win=7223 Len=1440 [TCP segment of a reassembled PDU]"
"173","5.140862","100.81.191.105","13.107.42.14","TLSv1.2","1473","Application Data"
"174","5.140879","100.81.191.105","13.107.42.14","TLSv1.2","175","Application Data"
"175","5.148555","100.81.191.105","13.107.42.14","TCP","1494","65413  >  443 [ACK] Seq=68294 Ack=25309 Win=7223 Len=1440 [TCP segment of a reassembled PDU]"
"176","5.148578","100.81.191.105","13.107.42.14","TLSv1.2","1473","Application Data"
"177","5.148596","100.81.191.105","13.107.42.14","TLSv1.2","115","Application Data"
"178","5.153532","13.107.42.14","100.81.191.105","TCP","56","443  >  65413 [ACK] Seq=25309 Ack=68173 Win=16385 Len=0"
"179","5.153534","13.107.42.14","100.81.191.105","TCP","56","443  >  65413 [ACK] Seq=25309 Ack=68294 Win=16384 Len=0"
"180","5.161359","13.107.42.14","100.81.191.105","TCP","56","443  >  65413 [ACK] Seq=25309 Ack=69734 Win=16385 Len=0"
"181","5.161360","13.107.42.14","100.81.191.105","TCP","56","443  >  65413 [ACK] Seq=25309 Ack=71214 Win=16385 Len=0"
"182","5.239387","13.107.42.14","100.81.191.105","TLSv1.2","243","Application Data"
"183","5.239474","100.81.191.105","13.107.42.14","TCP","54","65413  >  443 [ACK] Seq=71214 Ack=25498 Win=7220 Len=0"
"184","5.253424","100.81.191.105","13.107.42.14","TCP","1494","65413  >  443 [ACK] Seq=71214 Ack=25498 Win=7223 Len=1440 [TCP segment of a reassembled PDU]"
"185","5.253445","100.81.191.105","13.107.42.14","TLSv1.2","1214","Application Data"
"186","5.266560","13.107.42.14","100.81.191.105","TCP","56","443  >  65413 [ACK] Seq=25498 Ack=73814 Win=16385 Len=0"
"187","5.326697","100.81.191.105","13.107.42.14","TCP","1494","65413  >  443 [ACK] Seq=73814 Ack=25498 Win=7223 Len=1440 [TCP segment of a reassembled PDU]"
"188","5.326719","100.81.191.105","13.107.42.14","TLSv1.2","1072","Application Data"
"189","5.326742","100.81.191.105","13.107.42.14","TCP","1494","65413  >  443 [ACK] Seq=76272 Ack=25498 Win=7223 Len=1440 [TCP segment of a reassembled PDU]"
"190","5.326743","100.81.191.105","13.107.42.14","TCP","1494","65413  >  443 [ACK] Seq=77712 Ack=25498 Win=7223 Len=1440 [TCP segment of a reassembled PDU]"
"191","5.326757","100.81.191.105","13.107.42.14","TLSv1.2","826","Application Data"
"192","5.329003","100.81.191.105","13.107.42.14","TCP","1494","65413  >  443 [ACK] Seq=79924 Ack=25498 Win=7223 Len=1440 [TCP segment of a reassembled PDU]"
"193","5.329020","100.81.191.105","13.107.42.14","TLSv1.2","1072","Application Data"
"194","5.329041","100.81.191.105","13.107.42.14","TLSv1.2","733","Application Data"
"195","5.330175","100.81.191.105","13.107.42.14","TCP","1494","65413  >  443 [ACK] Seq=83061 Ack=25498 Win=7223 Len=1440 [TCP segment of a reassembled PDU]"
"196","5.330185","100.81.191.105","13.107.42.14","TLSv1.2","1072","Application Data"
"197","5.330202","100.81.191.105","13.107.42.14","TCP","1494","65413  >  443 [ACK] Seq=85519 Ack=25498 Win=7223 Len=1440 [TCP segment of a reassembled PDU]"
"198","5.330206","100.81.191.105","13.107.42.14","TLSv1.2","1237","Application Data"
"199","5.331869","100.81.191.105","13.107.42.14","TCP","1494","65413  >  443 [ACK] Seq=88142 Ack=25498 Win=7223 Len=1440 [TCP segment of a reassembled PDU]"
"200","5.331880","100.81.191.105","13.107.42.14","TLSv1.2","1072","Application Data"
"201","5.331920","100.81.191.105","13.107.42.14","TCP","1494","65413  >  443 [ACK] Seq=90600 Ack=25498 Win=7223 Len=1440 [TCP segment of a reassembled PDU]"
"202","5.331923","100.81.191.105","13.107.42.14","TLSv1.2","978","Application Data"
"203","5.339081","13.107.42.14","100.81.191.105","TCP","56","443  >  65413 [ACK] Seq=25498 Ack=76272 Win=16385 Len=0"
"204","5.339082","13.107.42.14","100.81.191.105","TCP","56","443  >  65413 [ACK] Seq=25498 Ack=77712 Win=16379 Len=0"
"205","5.339083","13.107.42.14","100.81.191.105","TCP","56","443  >  65413 [ACK] Seq=25498 Ack=79152 Win=16385 Len=0"
"206","5.339083","13.107.42.14","100.81.191.105","TCP","56","443  >  65413 [ACK] Seq=25498 Ack=79924 Win=16382 Len=0"
"207","5.340452","13.107.42.14","100.81.191.105","TLSv1.2","312","Application Data"
"208","5.340453","13.107.42.14","100.81.191.105","TCP","66","[TCP Dup ACK 206#1] 443  >  65413 [ACK] Seq=25756 Ack=79924 Win=16382 Len=0 SLE=81364 SRE=82382"
"209","5.340454","13.107.42.14","100.81.191.105","TCP","56","443  >  65413 [ACK] Seq=25756 Ack=82382 Win=16385 Len=0"
"210","5.340454","13.107.42.14","100.81.191.105","TCP","56","443  >  65413 [ACK] Seq=25756 Ack=83061 Win=16382 Len=0"
"211","5.340540","100.81.191.105","13.107.42.14","TCP","54","65413  >  443 [ACK] Seq=92964 Ack=25756 Win=7219 Len=0"
"212","5.341589","13.107.42.14","100.81.191.105","TCP","56","443  >  65413 [ACK] Seq=25756 Ack=85519 Win=16381 Len=0"
"213","5.343101","13.107.42.14","100.81.191.105","TCP","56","443  >  65413 [ACK] Seq=25756 Ack=88142 Win=16380 Len=0"
"214","5.344352","13.107.42.14","100.81.191.105","TCP","56","443  >  65413 [ACK] Seq=25756 Ack=90600 Win=16381 Len=0"
"215","5.344353","13.107.42.14","100.81.191.105","TCP","56","443  >  65413 [ACK] Seq=25756 Ack=92964 Win=16385 Len=0"
"216","5.408747","13.107.42.14","100.81.191.105","TLSv1.2","407","Application Data"
"217","5.408855","100.81.191.105","13.107.42.14","TCP","54","65413  >  443 [ACK] Seq=92964 Ack=26109 Win=7217 Len=0"
"218","5.421406","13.107.42.14","100.81.191.105","TLSv1.2","417","Application Data, Application Data"
"219","5.421483","100.81.191.105","13.107.42.14","TCP","54","65413  >  443 [ACK] Seq=92964 Ack=26472 Win=7217 Len=0"
"220","5.437982","100.81.191.105","13.107.42.14","TCP","1494","65413  >  443 [ACK] Seq=92964 Ack=26472 Win=7223 Len=1440 [TCP segment of a reassembled PDU]"
"221","5.438003","100.81.191.105","13.107.42.14","TLSv1.2","1479","Application Data"
"222","5.438046","100.81.191.105","13.107.42.14","TLSv1.2","231","Application Data"
"223","5.445929","13.107.42.14","100.81.191.105","TCP","1514","443  >  65413 [ACK] Seq=26472 Ack=92964 Win=16385 Len=1460 [TCP segment of a reassembled PDU]"
"224","5.445983","100.81.191.105","13.107.42.14","TCP","54","65413  >  443 [ACK] Seq=96006 Ack=27932 Win=7200 Len=0"
"225","5.447294","13.107.42.14","100.81.191.105","TCP","1514","443  >  65413 [ACK] Seq=27932 Ack=92964 Win=16385 Len=1460 [TCP segment of a reassembled PDU]"
"226","5.447296","13.107.42.14","100.81.191.105","TCP","1514","443  >  65413 [ACK] Seq=29392 Ack=92964 Win=16385 Len=1460 [TCP segment of a reassembled PDU]"
"227","5.447297","13.107.42.14","100.81.191.105","TLSv1.2","668","Application Data"
"228","5.447298","13.107.42.14","100.81.191.105","TLSv1.2","725","Application Data"
"229","5.447299","13.107.42.14","100.81.191.105","TLSv1.2","92","Application Data"
"230","5.447364","100.81.191.105","13.107.42.14","TCP","54","65413  >  443 [ACK] Seq=96006 Ack=32175 Win=7157 Len=0"
"231","5.447423","100.81.191.105","13.107.42.14","TCP","54","[TCP Window Update] 65413  >  443 [ACK] Seq=96006 Ack=32175 Win=7223 Len=0"
"232","5.450718","13.107.42.14","100.81.191.105","TLSv1.2","305","Application Data"
"233","5.450718","13.107.42.14","100.81.191.105","TCP","56","443  >  65413 [ACK] Seq=32426 Ack=96006 Win=16384 Len=0"
"234","5.450784","100.81.191.105","13.107.42.14","TCP","54","65413  >  443 [ACK] Seq=96006 Ack=32426 Win=7219 Len=0"
"235","5.561943","100.81.191.105","13.107.42.14","TCP","1494","65413  >  443 [ACK] Seq=96006 Ack=32426 Win=7223 Len=1440 [TCP segment of a reassembled PDU]"
"236","5.561964","100.81.191.105","13.107.42.14","TLSv1.2","1117","Application Data"
"237","5.561983","100.81.191.105","13.107.42.14","TCP","1494","65413  >  443 [ACK] Seq=98509 Ack=32426 Win=7223 Len=1440 [TCP segment of a reassembled PDU]"
"238","5.561986","100.81.191.105","13.107.42.14","TLSv1.2","925","Application Data"
"239","5.590617","13.107.42.14","100.81.191.105","TLSv1.2","92","[TCP Previous segment not captured] , Application Data"
"240","5.590701","100.81.191.105","13.107.42.14","TCP","66","[TCP Dup ACK 234#1] 65413  >  443 [ACK] Seq=100820 Ack=32426 Win=7223 Len=0 SLE=33011 SRE=33049"
"241","5.599917","13.107.42.14","100.81.191.105","TCP","56","443  >  65413 [ACK] Seq=33049 Ack=100820 Win=16385 Len=0"
"242","5.609824","13.107.42.14","100.81.191.105","TCP","677","[TCP Retransmission] 443  >  65413 [PSH, ACK] Seq=32426 Ack=100820 Win=16385 Len=623"
"243","5.609895","100.81.191.105","13.107.42.14","TCP","66","65413  >  443 [ACK] Seq=100820 Ack=33049 Win=7213 Len=0 SLE=33011 SRE=33049"
"244","5.650435","100.81.191.105","13.107.42.14","TCP","1494","65413  >  443 [ACK] Seq=100820 Ack=33049 Win=7223 Len=1440 [TCP segment of a reassembled PDU]"
"245","5.650457","100.81.191.105","13.107.42.14","TLSv1.2","1473","Application Data"
"246","5.650498","100.81.191.105","13.107.42.14","TLSv1.2","115","Application Data"
"247","5.658456","100.81.191.105","13.107.42.14","TCP","1494","65413  >  443 [ACK] Seq=103740 Ack=33049 Win=7223 Len=1440 [TCP segment of a reassembled PDU]"
"248","5.658477","100.81.191.105","13.107.42.14","TLSv1.2","1477","Application Data"
"249","5.658536","100.81.191.105","13.107.42.14","TCP","1494","65413  >  443 [ACK] Seq=106603 Ack=33049 Win=7223 Len=1440 [TCP segment of a reassembled PDU]"
"250","5.658539","100.81.191.105","13.107.42.14","TCP","1494","65413  >  443 [ACK] Seq=108043 Ack=33049 Win=7223 Len=1440 [TCP segment of a reassembled PDU]"
"251","5.658541","100.81.191.105","13.107.42.14","TLSv1.2","93","Application Data"
"252","5.659218","100.81.191.105","13.107.42.14","TCP","1494","65413  >  443 [ACK] Seq=109522 Ack=33049 Win=7223 Len=1440 [TCP segment of a reassembled PDU]"
"253","5.659219","100.81.191.105","13.107.42.14","TCP","1494","65413  >  443 [ACK] Seq=110962 Ack=33049 Win=7223 Len=1440 [TCP segment of a reassembled PDU]"
"254","5.659239","100.81.191.105","13.107.42.14","TLSv1.2","112","Application Data"
"255","5.659566","100.81.191.105","13.107.42.14","TCP","1494","65413  >  443 [ACK] Seq=112460 Ack=33049 Win=7223 Len=1440 [TCP segment of a reassembled PDU]"
"256","5.659574","100.81.191.105","13.107.42.14","TLSv1.2","1479","Application Data"
"257","5.660417","100.81.191.105","13.107.42.14","TCP","1494","65413  >  443 [ACK] Seq=115325 Ack=33049 Win=7223 Len=1440 [TCP segment of a reassembled PDU]"
"258","5.660419","100.81.191.105","13.107.42.14","TCP","1494","65413  >  443 [ACK] Seq=116765 Ack=33049 Win=7223 Len=1440 [TCP segment of a reassembled PDU]"
"259","5.660429","100.81.191.105","13.107.42.14","TLSv1.2","127","Application Data"
"260","5.660465","100.81.191.105","13.107.42.14","TCP","1494","65413  >  443 [ACK] Seq=118278 Ack=33049 Win=7223 Len=1440 [TCP segment of a reassembled PDU]"
"261","5.660466","100.81.191.105","13.107.42.14","TCP","1494","65413  >  443 [ACK] Seq=119718 Ack=33049 Win=7223 Len=1440 [TCP segment of a reassembled PDU]"
"262","5.660470","100.81.191.105","13.107.42.14","TLSv1.2","62","Application Data"
"263","5.660541","100.81.191.105","13.107.42.14","TCP","1494","65413  >  443 [ACK] Seq=121166 Ack=33049 Win=7223 Len=1440 [TCP segment of a reassembled PDU]"
"264","5.660542","100.81.191.105","13.107.42.14","TCP","1494","65413  >  443 [ACK] Seq=122606 Ack=33049 Win=7223 Len=1440 [TCP segment of a reassembled PDU]"
"265","5.660546","100.81.191.105","13.107.42.14","TLSv1.2","73","Application Data"
"266","5.662690","13.107.42.14","100.81.191.105","TLSv1.2","237","Application Data"
"267","5.662739","100.81.191.105","13.107.42.14","TCP","54","65413  >  443 [ACK] Seq=124065 Ack=33232 Win=7220 Len=0"
"268","5.662865","13.107.42.14","100.81.191.105","TCP","56","443  >  65413 [ACK] Seq=33232 Ack=102260 Win=16379 Len=0"
"269","5.663872","13.107.42.14","100.81.191.105","TCP","56","443  >  65413 [ACK] Seq=33232 Ack=103740 Win=16385 Len=0"
"270","5.671171","13.107.42.14","100.81.191.105","TCP","56","443  >  65413 [ACK] Seq=33232 Ack=106603 Win=16385 Len=0"
"271","5.671172","13.107.42.14","100.81.191.105","TCP","56","443  >  65413 [ACK] Seq=33232 Ack=109522 Win=16384 Len=0"
"272","5.671172","13.107.42.14","100.81.191.105","TCP","56","443  >  65413 [ACK] Seq=33232 Ack=110962 Win=16385 Len=0"
"273","5.671173","13.107.42.14","100.81.191.105","TCP","56","443  >  65413 [ACK] Seq=33232 Ack=112460 Win=16385 Len=0"
"274","5.671173","13.107.42.14","100.81.191.105","TCP","56","443  >  65413 [ACK] Seq=33232 Ack=113900 Win=16379 Len=0"
"275","5.671174","13.107.42.14","100.81.191.105","TCP","56","443  >  65413 [ACK] Seq=33232 Ack=115325 Win=16385 Len=0"
"276","5.672875","13.107.42.14","100.81.191.105","TCP","56","443  >  65413 [ACK] Seq=33232 Ack=116765 Win=16379 Len=0"
"277","5.672876","13.107.42.14","100.81.191.105","TCP","56","443  >  65413 [ACK] Seq=33232 Ack=119718 Win=16379 Len=0"
"278","5.672876","13.107.42.14","100.81.191.105","TCP","66","[TCP Dup ACK 277#1] 443  >  65413 [ACK] Seq=33232 Ack=119718 Win=16379 Len=0 SLE=121158 SRE=121166"
"279","5.672877","13.107.42.14","100.81.191.105","TCP","56","443  >  65413 [ACK] Seq=33232 Ack=124065 Win=16385 Len=0"
"280","5.678463","100.81.191.105","13.107.42.14","TCP","1494","65413  >  443 [ACK] Seq=124065 Ack=33232 Win=7223 Len=1440 [TCP segment of a reassembled PDU]"
"281","5.678490","100.81.191.105","13.107.42.14","TLSv1.2","1072","Application Data"
"282","5.678525","100.81.191.105","13.107.42.14","TCP","1494","65413  >  443 [ACK] Seq=126523 Ack=33232 Win=7223 Len=1440 [TCP segment of a reassembled PDU]"
"283","5.678528","100.81.191.105","13.107.42.14","TCP","1494","65413  >  443 [ACK] Seq=127963 Ack=33232 Win=7223 Len=1440 [TCP segment of a reassembled PDU]"
"284","5.678529","100.81.191.105","13.107.42.14","TCP","1494","65413  >  443 [ACK] Seq=129403 Ack=33232 Win=7223 Len=1440 [TCP segment of a reassembled PDU]"
"285","5.678531","100.81.191.105","13.107.42.14","TLSv1.2","1275","Application Data"
"286","5.681333","100.81.191.105","13.107.42.14","TCP","1494","65413  >  443 [ACK] Seq=132064 Ack=33232 Win=7223 Len=1440 [TCP segment of a reassembled PDU]"
"287","5.681351","100.81.191.105","13.107.42.14","TLSv1.2","1072","Application Data"
"288","5.681376","100.81.191.105","13.107.42.14","TCP","1494","65413  >  443 [ACK] Seq=134522 Ack=33232 Win=7223 Len=1440 [TCP segment of a reassembled PDU]"
"289","5.681378","100.81.191.105","13.107.42.14","TCP","1494","65413  >  443 [ACK] Seq=135962 Ack=33232 Win=7223 Len=1440 [TCP segment of a reassembled PDU]"
"290","5.681378","100.81.191.105","13.107.42.14","TCP","1494","65413  >  443 [ACK] Seq=137402 Ack=33232 Win=7223 Len=1440 [TCP segment of a reassembled PDU]"
"291","5.681379","100.81.191.105","13.107.42.14","TCP","1494","65413  >  443 [ACK] Seq=138842 Ack=33232 Win=7223 Len=1440 [TCP segment of a reassembled PDU]"
"292","5.681380","100.81.191.105","13.107.42.14","TCP","1494","65413  >  443 [ACK] Seq=140282 Ack=33232 Win=7223 Len=1440 [TCP segment of a reassembled PDU]"
"293","5.681380","100.81.191.105","13.107.42.14","TCP","1494","65413  >  443 [ACK] Seq=141722 Ack=33232 Win=7223 Len=1440 [TCP segment of a reassembled PDU]"
"294","5.681380","100.81.191.105","13.107.42.14","TLSv1.2","402","Application Data"
"295","5.681620","100.81.191.105","13.107.42.14","TCP","1494","65413  >  443 [ACK] Seq=143510 Ack=33232 Win=7223 Len=1440 [TCP segment of a reassembled PDU]"
"296","5.681625","100.81.191.105","13.107.42.14","TLSv1.2","1072","Application Data"
"297","5.681635","100.81.191.105","13.107.42.14","TLSv1.2","1094","Application Data"
"298","5.690624","13.107.42.14","100.81.191.105","TCP","56","443  >  65413 [ACK] Seq=33232 Ack=126523 Win=16385 Len=0"
"299","5.690626","13.107.42.14","100.81.191.105","TCP","56","443  >  65413 [ACK] Seq=33232 Ack=129403 Win=16385 Len=0"
"300","5.690627","13.107.42.14","100.81.191.105","TCP","56","443  >  65413 [ACK] Seq=33232 Ack=130843 Win=16379 Len=0"
"301","5.690628","13.107.42.14","100.81.191.105","TCP","56","443  >  65413 [ACK] Seq=33232 Ack=132064 Win=16385 Len=0"
"302","5.690628","13.107.42.14","100.81.191.105","TLSv1.2","96","Application Data"
"303","5.690762","100.81.191.105","13.107.42.14","TCP","54","65413  >  443 [ACK] Seq=147008 Ack=33274 Win=7222 Len=0"
"304","5.693896","13.107.42.14","100.81.191.105","TCP","56","443  >  65413 [ACK] Seq=33274 Ack=135962 Win=16379 Len=0"
"305","5.693897","13.107.42.14","100.81.191.105","TCP","56","443  >  65413 [ACK] Seq=33274 Ack=137402 Win=16385 Len=0"
"306","5.693898","13.107.42.14","100.81.191.105","TCP","56","443  >  65413 [ACK] Seq=33274 Ack=140282 Win=16385 Len=0"
"307","5.695490","13.107.42.14","100.81.191.105","TCP","66","443  >  65413 [ACK] Seq=33274 Ack=141722 Win=16379 Len=0 SLE=144950 SRE=145968"
"308","5.695491","13.107.42.14","100.81.191.105","TCP","66","443  >  65413 [ACK] Seq=33274 Ack=143162 Win=16385 Len=0 SLE=144950 SRE=145968"
"309","5.695491","13.107.42.14","100.81.191.105","TCP","66","443  >  65413 [ACK] Seq=33274 Ack=143510 Win=16383 Len=0 SLE=144950 SRE=145968"
"310","5.695492","13.107.42.14","100.81.191.105","TCP","56","443  >  65413 [ACK] Seq=33274 Ack=147008 Win=16381 Len=0"
"311","5.745614","13.107.42.14","100.81.191.105","TLSv1.2","314","Application Data"
"312","5.745726","100.81.191.105","13.107.42.14","TCP","54","65413  >  443 [ACK] Seq=147008 Ack=33534 Win=7219 Len=0"
"313","5.751464","100.81.191.105","13.107.42.14","TCP","1494","65413  >  443 [ACK] Seq=147008 Ack=33534 Win=7223 Len=1440 [TCP segment of a reassembled PDU]"
"314","5.751485","100.81.191.105","13.107.42.14","TLSv1.2","1348","Application Data"
"315","5.751505","100.81.191.105","13.107.42.14","TLSv1.2","492","Application Data"
"316","5.757460","13.107.42.14","100.81.191.105","TLSv1.2","626","Application Data"
"317","5.757461","13.107.42.14","100.81.191.105","TLSv1.2","92","Application Data"
"318","5.757573","100.81.191.105","13.107.42.14","TCP","54","65413  >  443 [ACK] Seq=150180 Ack=34144 Win=7213 Len=0"
"319","5.764550","13.107.42.14","100.81.191.105","TCP","1514","443  >  65413 [ACK] Seq=34144 Ack=147008 Win=16381 Len=1460 [TCP segment of a reassembled PDU]"
"320","5.764552","13.107.42.14","100.81.191.105","TLSv1.2","129","Application Data"
"321","5.764552","13.107.42.14","100.81.191.105","TLSv1.2","92","Application Data"
"322","5.764553","13.107.42.14","100.81.191.105","TCP","56","443  >  65413 [ACK] Seq=35717 Ack=150180 Win=16385 Len=0"
"323","5.764634","100.81.191.105","13.107.42.14","TCP","54","65413  >  443 [ACK] Seq=150180 Ack=35717 Win=7198 Len=0"
"324","5.769581","13.107.42.14","100.81.191.105","TLSv1.2","482","Application Data, Application Data"
"325","5.769654","100.81.191.105","13.107.42.14","TCP","54","65413  >  443 [ACK] Seq=150180 Ack=36145 Win=7216 Len=0"
"326","5.772386","13.107.42.14","100.81.191.105","TLSv1.2","1514","Application Data"
"327","5.772456","100.81.191.105","13.107.42.14","TCP","54","65413  >  443 [ACK] Seq=150180 Ack=37605 Win=7200 Len=0"
"328","5.774049","13.107.42.14","100.81.191.105","TCP","1514","443  >  65413 [ACK] Seq=37605 Ack=150180 Win=16385 Len=1460 [TCP segment of a reassembled PDU]"
"329","5.774050","13.107.42.14","100.81.191.105","TCP","1514","443  >  65413 [ACK] Seq=39065 Ack=150180 Win=16385 Len=1460 [TCP segment of a reassembled PDU]"
"330","5.774056","13.107.42.14","100.81.191.105","TLSv1.2","150","Application Data"
"331","5.774056","13.107.42.14","100.81.191.105","TLSv1.2","564","Application Data"
"332","5.774057","13.107.42.14","100.81.191.105","TLSv1.2","92","Application Data"
"333","5.774161","100.81.191.105","13.107.42.14","TCP","54","65413  >  443 [ACK] Seq=150180 Ack=41169 Win=7167 Len=0"
"334","5.774221","100.81.191.105","13.107.42.14","TCP","54","[TCP Window Update] 65413  >  443 [ACK] Seq=150180 Ack=41169 Win=7223 Len=0"
"335","5.810742","13.107.42.14","100.81.191.105","TCP","1514","443  >  65413 [ACK] Seq=41169 Ack=150180 Win=16385 Len=1460 [TCP segment of a reassembled PDU]"
"336","5.810777","13.107.42.14","100.81.191.105","TLSv1.2","1047","Application Data"
"337","5.810778","13.107.42.14","100.81.191.105","TLSv1.2","92","Application Data"
"338","5.810849","100.81.191.105","13.107.42.14","TCP","54","65413  >  443 [ACK] Seq=150180 Ack=42629 Win=7200 Len=0"
"339","5.810915","100.81.191.105","13.107.42.14","TCP","54","65413  >  443 [ACK] Seq=150180 Ack=43660 Win=7184 Len=0"
"340","5.834310","13.107.42.14","100.81.191.105","TLSv1.2","284","Application Data"
"341","5.834312","13.107.42.14","100.81.191.105","TLSv1.2","102","Application Data"
"342","5.834313","13.107.42.14","100.81.191.105","TLSv1.2","92","Application Data"
"343","5.834427","100.81.191.105","13.107.42.14","TCP","54","65413  >  443 [ACK] Seq=150180 Ack=43976 Win=7218 Len=0"
"344","5.881479","13.107.42.14","100.81.191.105","TCP","1514","443  >  65413 [ACK] Seq=43976 Ack=150180 Win=16385 Len=1460 [TCP segment of a reassembled PDU]"
